02:02:06.984416 80:ad:16:cb:e4:d0 > 58:00:e3:7e:0b:53, ethertype IPv6 (0x86dd), length 1392: 2404:6800:4002:80a::2004.443 > 2409:4063:4015:31fe:c50f:5aca:b1f4:c6a7.60720: UDP, length 1330
02:02:06.984797 80:ad:16:cb:e4:d0 > 58:00:e3:7e:0b:53, ethertype IPv6 (0x86dd), length 93: 2404:6800:4002:80a::2004.443 > 2409:4063:4015:31fe:c50f:5aca:b1f4:c6a7.60720: UDP, length 31
02:02:06.995435 80:ad:16:cb:e4:d0 > 58:00:e3:7e:0b:53, ethertype IPv4 (0x0800), length 74: 13.35.130.56.443 > 192.168.43.126.40388: Flags [S.], seq 931746969, ack 810791420, win 28960, options [mss 1370,sackOK,TS val 1684073363 ecr 3857386401,nop,wscale 8], length 0
02:02:07.012783 80:ad:16:cb:e4:d0 > 58:00:e3:7e:0b:53, ethertype IPv6 (0x86dd), length 82: 2404:6800:4002:80a::2004.443 > 2409:4063:4015:31fe:c50f:5aca:b1f4:c6a7.60720: UDP, length 20
02:02:07.030162 80:ad:16:cb:e4:d0 > 58:00:e3:7e:0b:53, ethertype IPv6 (0x86dd), length 94: 2a03:2880:f22f:c5:face:b00c:0:167.443 > 2409:4063:4015:31fe:c50f:5aca:b1f4:c6a7.45860: Flags [S.], seq 4281112038, ack 3750152951, win 27760, options [mss 1370,sackOK,TS val 121941422 ecr 1342281281,nop,wscale 8], length 0
02:02:07.042876 58:00:e3:7e:0b:53 > 80:ad:16:cb:e4:d0, ethertype IPv6 (0x86dd), length 103: 2409:4063:4015:31fe:c50f:5aca:b1f4:c6a7.60720 > 2404:6800:4002:80a::2004.443: UDP, length 41
02:02:07.042901 58:00:e3:7e:0b:53 > 80:ad:16:cb:e4:d0, ethertype IPv6 (0x86dd), length 90: 2409:4063:4015:31fe:c50f:5aca:b1f4:c6a7.60720 > 2404:6800:4002:80a::2004.443: UDP, length 28
02:02:07.042909 58:00:e3:7e:0b:53 > 80:ad:16:cb:e4:d0, ethertype IPv4 (0x0800), length 66: 192.168.43.126.40388 > 13.35.130.56.443: Flags [.], ack 1, win 502, options [nop,nop,TS val 3857386472 ecr 1684073363], length 0
02:02:07.042938 58:00:e3:7e:0b:53 > 80:ad:16:cb:e4:d0, ethertype IPv4 (0x0800), length 583: 192.168.43.126.40388 > 13.35.130.56.443: Flags [P.], seq 1:518, ack 1, win 502, options [nop,nop,TS val 3857386472 ecr 1684073363], length 517
02:02:07.042945 58:00:e3:7e:0b:53 > 80:ad:16:cb:e4:d0, ethertype IPv6 (0x86dd), length 86: 2409:4063:4015:31fe:c50f:5aca:b1f4:c6a7.45860 > 2a03:2880:f22f:c5:face:b00c:0:167.443: Flags [.], ack 1, win 507, options [nop,nop,TS val 1342281362 ecr 121941422], length 0
02:02:07.042971 58:00:e3:7e:0b:53 > 80:ad:16:cb:e4:d0, ethertype IPv6 (0x86dd), length 603: 2409:4063:4015:31fe:c50f:5aca:b1f4:c6a7.45860 > 2a03:2880:f22f:c5:face:b00c:0:167.443: Flags [P.], seq 1:518, ack 1, win 507, options [nop,nop,TS val 1342281362 ecr 121941422], length 517
02:02:07.071736 58:00:e3:7e:0b:53 > 80:ad:16:cb:e4:d0, ethertype IPv6 (0x86dd), length 1434: 2409:4063:4015:31fe:c50f:5aca:b1f4:c6a7.47474 > 2606:4700::6810:5c34.443: Flags [.], seq 356601418:356602778, ack 2637627738, win 12525, length 1360
02:02:07.071759 58:00:e3:7e:0b:53 > 80:ad:16:cb:e4:d0, ethertype IPv6 (0x86dd), length 1434: 2409:4063:4015:31fe:c50f:5aca:b1f4:c6a7.47474 > 2606:4700::6810:5c34.443: Flags [.], seq 1360:2720, ack 1, win 12525, length 1360
02:02:07.071826 58:00:e3:7e:0b:53 > 80:ad:16:cb:e4:d0, ethertype IPv6 (0x86dd), length 133: 2409:4063:4015:31fe:c50f:5aca:b1f4:c6a7.47474 > 2606:4700::6810:5c34.443: Flags [P.], seq 2720:2779, ack 1, win 12525, length 59
02:02:07.092867 80:ad:16:cb:e4:d0 > 58:00:e3:7e:0b:53, ethertype IPv6 (0x86dd), length 493: 2404:6800:4002:80a::2004.443 > 2409:4063:4015:31fe:c50f:5aca:b1f4:c6a7.60720: UDP, length 431
02:02:07.092972 80:ad:16:cb:e4:d0 > 58:00:e3:7e:0b:53, ethertype IPv6 (0x86dd), length 161: 2404:6800:4002:80a::2004.443 > 2409:4063:4015:31fe:c50f:5aca:b1f4:c6a7.60720: UDP, length 99
02:02:07.093144 58:00:e3:7e:0b:53 > 80:ad:16:cb:e4:d0, ethertype IPv6 (0x86dd), length 90: 2409:4063:4015:31fe:c50f:5aca:b1f4:c6a7.60720 > 2404:6800:4002:80a::2004.443: UDP, length 28
02:02:07.107039 58:00:e3:7e:0b:53 > 80:ad:16:cb:e4:d0, ethertype IPv6 (0x86dd), length 1434: 2409:4063:4015:31fe:c50f:5aca:b1f4:c6a7.47474 > 2606:4700::6810:5c34.443: Flags [.], seq 2779:4139, ack 1, win 12525, length 1360
02:02:07.107061 58:00:e3:7e:0b:53 > 80:ad:16:cb:e4:d0, ethertype IPv6 (0x86dd), length 1434: 2409:4063:4015:31fe:c50f:5aca:b1f4:c6a7.47474 > 2606:4700::6810:5c34.443: Flags [.], seq 4139:5499, ack 1, win 12525, length 1360
02:02:07.107146 58:00:e3:7e:0b:53 > 80:ad:16:cb:e4:d0, ethertype IPv6 (0x86dd), length 111: 2409:4063:4015:31fe:c50f:5aca:b1f4:c6a7.47474 > 2606:4700::6810:5c34.443: Flags [P.], seq 5499:5536, ack 1, win 12525, length 37
02:02:07.112475 80:ad:16:cb:e4:d0 > 58:00:e3:7e:0b:53, ethertype IPv4 (0x0800), length 66: 13.35.130.56.443 > 192.168.43.126.40388: Flags [.], ack 518, win 118, options [nop,nop,TS val 1684073375 ecr 3857386472], length 0
02:02:07.113798 80:ad:16:cb:e4:d0 > 58:00:e3:7e:0b:53, ethertype IPv4 (0x0800), length 171: 13.35.130.56.443 > 192.168.43.126.40388: Flags [P.], seq 1:106, ack 518, win 118, options [nop,nop,TS val 1684073375 ecr 3857386472], length 105
02:02:07.113815 58:00:e3:7e:0b:53 > 80:ad:16:cb:e4:d0, ethertype IPv4 (0x0800), length 66: 192.168.43.126.40388 > 13.35.130.56.443: Flags [.], ack 106, win 502, options [nop,nop,TS val 3857386590 ecr 1684073375], length 0
02:02:07.140663 80:ad:16:cb:e4:d0 > 58:00:e3:7e:0b:53, ethertype IPv6 (0x86dd), length 82: 2404:6800:4002:80a::2004.443 > 2409:4063:4015:31fe:c50f:5aca:b1f4:c6a7.60720: UDP, length 20
02:02:07.184345 80:ad:16:cb:e4:d0 > 58:00:e3:7e:0b:53, ethertype IPv4 (0x0800), length 117: 13.35.130.56.443 > 192.168.43.126.40388: Flags [P.], seq 106:157, ack 518, win 118, options [nop,nop,TS val 1684073382 ecr 3857386590], length 51
02:02:07.184364 58:00:e3:7e:0b:53 > 80:ad:16:cb:e4:d0, ethertype IPv4 (0x0800), length 66: 192.168.43.126.40388 > 13.35.130.56.443: Flags [.], ack 157, win 502, options [nop,nop,TS val 3857386661 ecr 1684073382], length 0
02:02:07.184523 58:00:e3:7e:0b:53 > 80:ad:16:cb:e4:d0, ethertype IPv4 (0x0800), length 117: 192.168.43.126.40388 > 13.35.130.56.443: Flags [P.], seq 518:569, ack 157, win 502, options [nop,nop,TS val 3857386661 ecr 1684073382], length 51
02:02:07.184776 58:00:e3:7e:0b:53 > 80:ad:16:cb:e4:d0, ethertype IPv4 (0x0800), length 159: 192.168.43.126.40388 > 13.35.130.56.443: Flags [P.], seq 569:662, ack 157, win 502, options [nop,nop,TS val 3857386661 ecr 1684073382], length 93
02:02:07.185022 58:00:e3:7e:0b:53 > 80:ad:16:cb:e4:d0, ethertype IPv4 (0x0800), length 356: 192.168.43.126.40388 > 13.35.130.56.443: Flags [P.], seq 662:952, ack 157, win 502, options [nop,nop,TS val 3857386662 ecr 1684073382], length 290
02:02:07.210240 80:ad:16:cb:e4:d0 > 58:00:e3:7e:0b:53, ethertype IPv6 (0x86dd), length 74: 2606:4700::6810:5c34.443 > 2409:4063:4015:31fe:c50f:5aca:b1f4:c6a7.47474: Flags [.], ack 1360, win 286, length 0
02:02:07.211448 80:ad:16:cb:e4:d0 > 58:00:e3:7e:0b:53, ethertype IPv6 (0x86dd), length 74: 2606:4700::6810:5c34.443 > 2409:4063:4015:31fe:c50f:5aca:b1f4:c6a7.47474: Flags [.], ack 2720, win 288, length 0
02:02:07.212288 80:ad:16:cb:e4:d0 > 58:00:e3:7e:0b:53, ethertype IPv6 (0x86dd), length 74: 2606:4700::6810:5c34.443 > 2409:4063:4015:31fe:c50f:5aca:b1f4:c6a7.47474: Flags [.], ack 2779, win 288, length 0
02:02:07.352791 58:00:e3:7e:0b:53 > 80:ad:16:cb:e4:d0, ethertype IPv4 (0x0800), length 356: 192.168.43.126.40388 > 13.35.130.56.443: Flags [P.], seq 662:952, ack 157, win 502, options [nop,nop,TS val 3857386829 ecr 1684073382], length 290
02:02:07.374803 58:00:e3:7e:0b:53 > 80:ad:16:cb:e4:d0, ethertype IPv4 (0x0800), length 145: 192.168.43.126.33020 > 151.101.154.110.443: Flags [P.], seq 3702524109:3702524188, ack 575052124, win 501, options [nop,nop,TS val 4089367667 ecr 1641556976], length 79
02:02:07.374886 58:00:e3:7e:0b:53 > 80:ad:16:cb:e4:d0, ethertype IPv4 (0x0800), length 112: 192.168.43.126.33020 > 151.101.154.110.443: Flags [P.], seq 79:125, ack 1, win 501, options [nop,nop,TS val 4089367667 ecr 1641556976], length 46
02:02:07.404789 58:00:e3:7e:0b:53 > 80:ad:16:cb:e4:d0, ethertype IPv6 (0x86dd), length 603: 2409:4063:4015:31fe:c50f:5aca:b1f4:c6a7.45860 > 2a03:2880:f22f:c5:face:b00c:0:167.443: Flags [P.], seq 1:518, ack 1, win 507, options [nop,nop,TS val 1342281736 ecr 121941422], length 517
02:02:07.413995 80:ad:16:cb:e4:d0 > 58:00:e3:7e:0b:53, ethertype IPv4 (0x0800), length 78: 13.35.130.56.443 > 192.168.43.126.40388: Flags [.], ack 952, win 122, options [nop,nop,TS val 1684073405 ecr 3857386829,nop,nop,sack 1 {662:952}], length 0
02:02:07.427060 58:00:e3:7e:0b:53 > 80:ad:16:cb:e4:d0, ethertype IPv6 (0x86dd), length 144: 2409:4063:4015:31fe:c50f:5aca:b1f4:c6a7.56070 > 2606:4700:30::6812:3d08.443: Flags [P.], seq 93433352:93433422, ack 2956174952, win 501, length 70
02:02:07.427148 58:00:e3:7e:0b:53 > 80:ad:16:cb:e4:d0, ethertype IPv6 (0x86dd), length 278: 2409:4063:4015:31fe:c50f:5aca:b1f4:c6a7.56070 > 2606:4700:30::6812:3d08.443: Flags [P.], seq 70:274, ack 1, win 501, length 204
02:02:07.432660 80:ad:16:cb:e4:d0 > 58:00:e3:7e:0b:53, ethertype IPv6 (0x86dd), length 289: 2a03:2880:f22f:c5:face:b00c:0:167.443 > 2409:4063:4015:31fe:c50f:5aca:b1f4:c6a7.45860: Flags [P.], seq 1:204, ack 518, win 113, options [nop,nop,TS val 121941825 ecr 1342281362], length 203
02:02:07.432702 58:00:e3:7e:0b:53 > 80:ad:16:cb:e4:d0, ethertype IPv6 (0x86dd), length 86: 2409:4063:4015:31fe:c50f:5aca:b1f4:c6a7.45860 > 2a03:2880:f22f:c5:face:b00c:0:167.443: Flags [.], ack 204, win 506, options [nop,nop,TS val 1342281764 ecr 121941825], length 0
02:02:07.434186 58:00:e3:7e:0b:53 > 80:ad:16:cb:e4:d0, ethertype IPv6 (0x86dd), length 150: 2409:4063:4015:31fe:c50f:5aca:b1f4:c6a7.45860 > 2a03:2880:f22f:c5:face:b00c:0:167.443: Flags [P.], seq 518:582, ack 204, win 506, options [nop,nop,TS val 1342281766 ecr 121941825], length 64
02:02:07.434530 58:00:e3:7e:0b:53 > 80:ad:16:cb:e4:d0, ethertype IPv6 (0x86dd), length 608: 2409:4063:4015:31fe:c50f:5aca:b1f4:c6a7.45860 > 2a03:2880:f22f:c5:face:b00c:0:167.443: Flags [P.], seq 582:1104, ack 204, win 506, options [nop,nop,TS val 1342281766 ecr 121941825], length 522
02:02:07.466657 80:ad:16:cb:e4:d0 > 58:00:e3:7e:0b:53, ethertype IPv4 (0x0800), length 66: 151.101.154.110.443 > 192.168.43.126.33020: Flags [.], ack 79, win 61, options [nop,nop,TS val 1641557161 ecr 4089367667], length 0
02:02:07.466942 80:ad:16:cb:e4:d0 > 58:00:e3:7e:0b:53, ethertype IPv4 (0x0800), length 66: 151.101.154.110.443 > 192.168.43.126.33020: Flags [.], ack 125, win 61, options [nop,nop,TS val 1641557161 ecr 4089367667], length 0
02:02:07.466968 80:ad:16:cb:e4:d0 > 58:00:e3:7e:0b:53, ethertype IPv4 (0x0800), length 112: 151.101.154.110.443 > 192.168.43.126.33020: Flags [P.], seq 1:47, ack 125, win 61, options [nop,nop,TS val 1641557161 ecr 4089367667], length 46
02:02:07.466980 80:ad:16:cb:e4:d0 > 58:00:e3:7e:0b:53, ethertype IPv4 (0x0800), length 270: 151.101.154.110.443 > 192.168.43.126.33020: Flags [P.], seq 47:251, ack 125, win 61, options [nop,nop,TS val 1641557161 ecr 4089367667], length 204
02:02:07.467042 58:00:e3:7e:0b:53 > 80:ad:16:cb:e4:d0, ethertype IPv4 (0x0800), length 66: 192.168.43.126.33020 > 151.101.154.110.443: Flags [.], ack 251, win 501, options [nop,nop,TS val 4089367760 ecr 1641557161], length 0
02:02:07.467441 58:00:e3:7e:0b:53 > 80:ad:16:cb:e4:d0, ethertype IPv4 (0x0800), length 108: 192.168.43.126.33020 > 151.101.154.110.443: Flags [P.], seq 125:167, ack 251, win 501, options [nop,nop,TS val 4089367760 ecr 1641557161], length 42
02:02:07.491622 80:ad:16:cb:e4:d0 > 58:00:e3:7e:0b:53, ethertype IPv6 (0x86dd), length 86: 2a03:2880:f22f:c5:face:b00c:0:167.443 > 2409:4063:4015:31fe:c50f:5aca:b1f4:c6a7.45860: Flags [.], ack 518, win 113, options [nop,nop,TS val 121941882 ecr 1342281736], length 0
02:02:07.521739 80:ad:16:cb:e4:d0 > 58:00:e3:7e:0b:53, ethertype IPv6 (0x86dd), length 86: 2a03:2880:f22f:c5:face:b00c:0:167.443 > 2409:4063:4015:31fe:c50f:5aca:b1f4:c6a7.45860: Flags [.], ack 582, win 113, options [nop,nop,TS val 121941913 ecr 1342281766], length 0
02:02:07.522282 80:ad:16:cb:e4:d0 > 58:00:e3:7e:0b:53, ethertype IPv6 (0x86dd), length 86: 2a03:2880:f22f:c5:face:b00c:0:167.443 > 2409:4063:4015:31fe:c50f:5aca:b1f4:c6a7.45860: Flags [.], ack 1104, win 117, options [nop,nop,TS val 121941913 ecr 1342281766], length 0
02:02:07.522294 80:ad:16:cb:e4:d0 > 58:00:e3:7e:0b:53, ethertype IPv6 (0x86dd), length 241: 2a03:2880:f22f:c5:face:b00c:0:167.443 > 2409:4063:4015:31fe:c50f:5aca:b1f4:c6a7.45860: Flags [P.], seq 204:359, ack 1104, win 117, options [nop,nop,TS val 121941913 ecr 1342281766], length 155
02:02:07.523540 58:00:e3:7e:0b:53 > 80:ad:16:cb:e4:d0, ethertype IPv4 (0x0800), length 145: 192.168.43.126.56972 > 35.186.220.184.443: Flags [P.], seq 1950972813:1950972892, ack 1390123470, win 501, options [nop,nop,TS val 1071242576 ecr 1824347611], length 79
02:02:07.523621 58:00:e3:7e:0b:53 > 80:ad:16:cb:e4:d0, ethertype IPv4 (0x0800), length 555: 192.168.43.126.56972 > 35.186.220.184.443: Flags [P.], seq 79:568, ack 1, win 501, options [nop,nop,TS val 1071242576 ecr 1824347611], length 489
02:02:07.528174 80:ad:16:cb:e4:d0 > 58:00:e3:7e:0b:53, ethertype IPv6 (0x86dd), length 1434: 2606:4700::6810:5c34.443 > 2409:4063:4015:31fe:c50f:5aca:b1f4:c6a7.47474: Flags [.], seq 1:1361, ack 5536, win 294, length 1360
02:02:07.603344 80:ad:16:cb:e4:d0 > 58:00:e3:7e:0b:53, ethertype IPv4 (0x0800), length 66: 151.101.154.110.443 > 192.168.43.126.33020: Flags [.], ack 167, win 61, options [nop,nop,TS val 1641557195 ecr 4089367760], length 0
02:02:07.610903 58:00:e3:7e:0b:53 > 80:ad:16:cb:e4:d0, ethertype IPv6 (0x86dd), length 86: 2409:4063:4015:31fe:c50f:5aca:b1f4:c6a7.45860 > 2a03:2880:f22f:c5:face:b00c:0:167.443: Flags [.], ack 359, win 505, options [nop,nop,TS val 1342281896 ecr 121941913], length 0
02:02:07.610930 58:00:e3:7e:0b:53 > 80:ad:16:cb:e4:d0, ethertype IPv6 (0x86dd), length 74: 2409:4063:4015:31fe:c50f:5aca:b1f4:c6a7.47474 > 2606:4700::6810:5c34.443: Flags [.], ack 1361, win 12547, length 0
02:02:07.610936 58:00:e3:7e:0b:53 > 80:ad:16:cb:e4:d0, ethertype IPv4 (0x0800), length 73: 192.168.43.126.39494 > 192.168.43.1.53: 31396+ A? www.udemy.com. (31)
02:02:07.610966 58:00:e3:7e:0b:53 > 80:ad:16:cb:e4:d0, ethertype IPv6 (0x86dd), length 93: 2409:4063:4015:31fe:c50f:5aca:b1f4:c6a7.42042 > 2409:4063:4015:31fe::a2.53: 41374+ AAAA? www.udemy.com. (31)
02:02:07.614789 80:ad:16:cb:e4:d0 > 58:00:e3:7e:0b:53, ethertype IPv6 (0x86dd), length 149: 2409:4063:4015:31fe::a2.53 > 2409:4063:4015:31fe:c50f:5aca:b1f4:c6a7.42042: 41374 2/0/0 AAAA 2606:4700::6810:5c34, AAAA 2606:4700::6810:5b34 (87)
02:02:07.616225 80:ad:16:cb:e4:d0 > 58:00:e3:7e:0b:53, ethertype IPv4 (0x0800), length 105: 192.168.43.1.53 > 192.168.43.126.39494: 31396 2/0/0 A 104.16.92.52, A 104.16.91.52 (63)
02:02:07.645855 58:00:e3:7e:0b:53 > 80:ad:16:cb:e4:d0, ethertype IPv6 (0x86dd), length 287: 2409:4063:4015:31fe:c50f:5aca:b1f4:c6a7.60720 > 2404:6800:4002:80a::2004.443: UDP, length 225
02:02:07.646034 58:00:e3:7e:0b:53 > 80:ad:16:cb:e4:d0, ethertype IPv6 (0x86dd), length 140: 2409:4063:4015:31fe:c50f:5aca:b1f4:c6a7.60720 > 2404:6800:4002:80a::2004.443: UDP, length 78
02:02:07.684807 58:00:e3:7e:0b:53 > 80:ad:16:cb:e4:d0, ethertype IPv4 (0x0800), length 555: 192.168.43.126.56972 > 35.186.220.184.443: Flags [P.], seq 79:568, ack 1, win 501, options [nop,nop,TS val 1071242737 ecr 1824347611], length 489
02:02:07.717116 80:ad:16:cb:e4:d0 > 58:00:e3:7e:0b:53, ethertype IPv6 (0x86dd), length 82: 2404:6800:4002:80a::2004.443 > 2409:4063:4015:31fe:c50f:5aca:b1f4:c6a7.60720: UDP, length 20
02:02:07.724847 58:00:e3:7e:0b:53 > 80:ad:16:cb:e4:d0, ethertype IPv6 (0x86dd), length 278: 2409:4063:4015:31fe:c50f:5aca:b1f4:c6a7.56070 > 2606:4700:30::6812:3d08.443: Flags [P.], seq 70:274, ack 1, win 501, length 204
02:02:07.729066 80:ad:16:cb:e4:d0 > 58:00:e3:7e:0b:53, ethertype IPv6 (0x86dd), length 300: 2a03:2880:f22f:c5:face:b00c:0:167.443 > 2409:4063:4015:31fe:c50f:5aca:b1f4:c6a7.45860: Flags [P.], seq 359:573, ack 1104, win 117, options [nop,nop,TS val 121942119 ecr 1342281896], length 214
02:02:07.729082 58:00:e3:7e:0b:53 > 80:ad:16:cb:e4:d0, ethertype IPv6 (0x86dd), length 86: 2409:4063:4015:31fe:c50f:5aca:b1f4:c6a7.45860 > 2a03:2880:f22f:c5:face:b00c:0:167.443: Flags [.], ack 573, win 504, options [nop,nop,TS val 1342282061 ecr 121942119], length 0
02:02:07.752921 80:ad:16:cb:e4:d0 > 58:00:e3:7e:0b:53, ethertype IPv4 (0x0800), length 78: 35.186.220.184.443 > 192.168.43.126.56972: Flags [.], ack 568, win 265, options [nop,nop,TS val 1824352291 ecr 1071242737,nop,nop,sack 1 {79:568}], length 0
02:02:07.754079 80:ad:16:cb:e4:d0 > 58:00:e3:7e:0b:53, ethertype IPv4 (0x0800), length 244: 35.186.220.184.443 > 192.168.43.126.56972: Flags [P.], seq 1:179, ack 568, win 265, options [nop,nop,TS val 1824352293 ecr 1071242737], length 178
02:02:07.755176 80:ad:16:cb:e4:d0 > 58:00:e3:7e:0b:53, ethertype IPv4 (0x0800), length 221: 35.186.220.184.443 > 192.168.43.126.56972: Flags [P.], seq 179:334, ack 568, win 265, options [nop,nop,TS val 1824352293 ecr 1071242737], length 155
02:02:07.755230 58:00:e3:7e:0b:53 > 80:ad:16:cb:e4:d0, ethertype IPv4 (0x0800), length 66: 192.168.43.126.56972 > 35.186.220.184.443: Flags [.], ack 334, win 501, options [nop,nop,TS val 1071242808 ecr 1824352293], length 0
02:02:07.757677 80:ad:16:cb:e4:d0 > 58:00:e3:7e:0b:53, ethertype IPv4 (0x0800), length 112: 35.186.220.184.443 > 192.168.43.126.56972: Flags [P.], seq 334:380, ack 568, win 265, options [nop,nop,TS val 1824352293 ecr 1071242737], length 46
02:02:07.758027 58:00:e3:7e:0b:53 > 80:ad:16:cb:e4:d0, ethertype IPv4 (0x0800), length 112: 192.168.43.126.56972 > 35.186.220.184.443: Flags [P.], seq 568:614, ack 380, win 501, options [nop,nop,TS val 1071242811 ecr 1824352293], length 46
02:02:07.759852 58:00:e3:7e:0b:53 > 80:ad:16:cb:e4:d0, ethertype IPv6 (0x86dd), length 97: 2409:4063:4015:31fe:c50f:5aca:b1f4:c6a7.57605 > 2409:4063:4015:31fe::a2.53: 47202+ A? static.hotjar.com. (35)
02:02:07.795880 80:ad:16:cb:e4:d0 > 58:00:e3:7e:0b:53, ethertype IPv6 (0x86dd), length 183: 2606:4700:30::6812:3d08.443 > 2409:4063:4015:31fe:c50f:5aca:b1f4:c6a7.56070: Flags [P.], seq 1:110, ack 274, win 104, length 109
02:02:07.795904 58:00:e3:7e:0b:53 > 80:ad:16:cb:e4:d0, ethertype IPv6 (0x86dd), length 74: 2409:4063:4015:31fe:c50f:5aca:b1f4:c6a7.56070 > 2606:4700:30::6812:3d08.443: Flags [.], ack 110, win 501, length 0
02:02:07.796086 80:ad:16:cb:e4:d0 > 58:00:e3:7e:0b:53, ethertype IPv6 (0x86dd), length 105: 2606:4700:30::6812:3d08.443 > 2409:4063:4015:31fe:c50f:5aca:b1f4:c6a7.56070: Flags [P.], seq 110:141, ack 274, win 104, length 31
02:02:07.796093 58:00:e3:7e:0b:53 > 80:ad:16:cb:e4:d0, ethertype IPv6 (0x86dd), length 74: 2409:4063:4015:31fe:c50f:5aca:b1f4:c6a7.56070 > 2606:4700:30::6812:3d08.443: Flags [.], ack 141, win 501, length 0
02:02:07.887223 80:ad:16:cb:e4:d0 > 58:00:e3:7e:0b:53, ethertype IPv6 (0x86dd), length 1392: 2404:6800:4002:80a::2004.443 > 2409:4063:4015:31fe:c50f:5aca:b1f4:c6a7.60720: UDP, length 1330
02:02:07.887381 80:ad:16:cb:e4:d0 > 58:00:e3:7e:0b:53, ethertype IPv6 (0x86dd), length 885: 2404:6800:4002:80a::2004.443 > 2409:4063:4015:31fe:c50f:5aca:b1f4:c6a7.60720: UDP, length 823
02:02:07.887385 80:ad:16:cb:e4:d0 > 58:00:e3:7e:0b:53, ethertype IPv6 (0x86dd), length 164: 2404:6800:4002:80a::2004.443 > 2409:4063:4015:31fe:c50f:5aca:b1f4:c6a7.60720: UDP, length 102
02:02:07.887625 80:ad:16:cb:e4:d0 > 58:00:e3:7e:0b:53, ethertype IPv6 (0x86dd), length 1392: 2404:6800:4002:80a::2004.443 > 2409:4063:4015:31fe:c50f:5aca:b1f4:c6a7.60720: UDP, length 1330
02:02:07.887840 80:ad:16:cb:e4:d0 > 58:00:e3:7e:0b:53, ethertype IPv6 (0x86dd), length 1392: 2404:6800:4002:80a::2004.443 > 2409:4063:4015:31fe:c50f:5aca:b1f4:c6a7.60720: UDP, length 1330
02:02:07.888069 80:ad:16:cb:e4:d0 > 58:00:e3:7e:0b:53, ethertype IPv6 (0x86dd), length 1392: 2404:6800:4002:80a::2004.443 > 2409:4063:4015:31fe:c50f:5aca:b1f4:c6a7.60720: UDP, length 1330
02:02:07.888285 80:ad:16:cb:e4:d0 > 58:00:e3:7e:0b:53, ethertype IPv6 (0x86dd), length 1392: 2404:6800:4002:80a::2004.443 > 2409:4063:4015:31fe:c50f:5aca:b1f4:c6a7.60720: UDP, length 1330
02:02:07.888513 80:ad:16:cb:e4:d0 > 58:00:e3:7e:0b:53, ethertype IPv6 (0x86dd), length 1392: 2404:6800:4002:80a::2004.443 > 2409:4063:4015:31fe:c50f:5aca:b1f4:c6a7.60720: UDP, length 1330
02:02:07.890532 80:ad:16:cb:e4:d0 > 58:00:e3:7e:0b:53, ethertype IPv6 (0x86dd), length 1348: 2404:6800:4002:80a::2004.443 > 2409:4063:4015:31fe:c50f:5aca:b1f4:c6a7.60720: UDP, length 1286
02:02:07.895153 58:00:e3:7e:0b:53 > 80:ad:16:cb:e4:d0, ethertype IPv6 (0x86dd), length 93: 2409:4063:4015:31fe:c50f:5aca:b1f4:c6a7.60720 > 2404:6800:4002:80a::2004.443: UDP, length 31
02:02:07.895241 58:00:e3:7e:0b:53 > 80:ad:16:cb:e4:d0, ethertype IPv6 (0x86dd), length 93: 2409:4063:4015:31fe:c50f:5aca:b1f4:c6a7.60720 > 2404:6800:4002:80a::2004.443: UDP, length 31
02:02:07.895255 58:00:e3:7e:0b:53 > 80:ad:16:cb:e4:d0, ethertype IPv6 (0x86dd), length 93: 2409:4063:4015:31fe:c50f:5aca:b1f4:c6a7.60720 > 2404:6800:4002:80a::2004.443: UDP, length 31
02:02:07.895286 58:00:e3:7e:0b:53 > 80:ad:16:cb:e4:d0, ethertype IPv6 (0x86dd), length 93: 2409:4063:4015:31fe:c50f:5aca:b1f4:c6a7.60720 > 2404:6800:4002:80a::2004.443: UDP, length 31
02:02:07.895298 58:00:e3:7e:0b:53 > 80:ad:16:cb:e4:d0, ethertype IPv6 (0x86dd), length 93: 2409:4063:4015:31fe:c50f:5aca:b1f4:c6a7.60720 > 2404:6800:4002:80a::2004.443: UDP, length 31
02:02:07.895362 58:00:e3:7e:0b:53 > 80:ad:16:cb:e4:d0, ethertype IPv6 (0x86dd), length 93: 2409:4063:4015:31fe:c50f:5aca:b1f4:c6a7.60720 > 2404:6800:4002:80a::2004.443: UDP, length 31
02:02:07.904969 80:ad:16:cb:e4:d0 > 58:00:e3:7e:0b:53, ethertype IPv6 (0x86dd), length 1392: 2404:6800:4002:80a::2004.443 > 2409:4063:4015:31fe:c50f:5aca:b1f4:c6a7.60720: UDP, length 1330
02:02:07.905157 58:00:e3:7e:0b:53 > 80:ad:16:cb:e4:d0, ethertype IPv6 (0x86dd), length 93: 2409:4063:4015:31fe:c50f:5aca:b1f4:c6a7.60720 > 2404:6800:4002:80a::2004.443: UDP, length 31
02:02:07.913113 80:ad:16:cb:e4:d0 > 58:00:e3:7e:0b:53, ethertype IPv6 (0x86dd), length 1392: 2404:6800:4002:80a::2004.443 > 2409:4063:4015:31fe:c50f:5aca:b1f4:c6a7.60720: UDP, length 1330
02:02:07.914682 80:ad:16:cb:e4:d0 > 58:00:e3:7e:0b:53, ethertype IPv6 (0x86dd), length 1392: 2404:6800:4002:80a::2004.443 > 2409:4063:4015:31fe:c50f:5aca:b1f4:c6a7.60720: UDP, length 1330
02:02:07.914928 58:00:e3:7e:0b:53 > 80:ad:16:cb:e4:d0, ethertype IPv6 (0x86dd), length 93: 2409:4063:4015:31fe:c50f:5aca:b1f4:c6a7.60720 > 2404:6800:4002:80a::2004.443: UDP, length 31
02:02:07.916279 80:ad:16:cb:e4:d0 > 58:00:e3:7e:0b:53, ethertype IPv6 (0x86dd), length 1392: 2404:6800:4002:80a::2004.443 > 2409:4063:4015:31fe:c50f:5aca:b1f4:c6a7.60720: UDP, length 1330
02:02:07.920395 80:ad:16:cb:e4:d0 > 58:00:e3:7e:0b:53, ethertype IPv4 (0x0800), length 135: 13.35.130.56.443 > 192.168.43.126.40388: Flags [P.], seq 157:226, ack 952, win 122, options [nop,nop,TS val 1684073456 ecr 3857386829], length 69
02:02:07.920704 58:00:e3:7e:0b:53 > 80:ad:16:cb:e4:d0, ethertype IPv4 (0x0800), length 104: 192.168.43.126.40388 > 13.35.130.56.443: Flags [P.], seq 952:990, ack 226, win 502, options [nop,nop,TS val 3857387397 ecr 1684073456], length 38
02:02:07.922727 80:ad:16:cb:e4:d0 > 58:00:e3:7e:0b:53, ethertype IPv6 (0x86dd), length 1392: 2404:6800:4002:80a::2004.443 > 2409:4063:4015:31fe:c50f:5aca:b1f4:c6a7.60720: UDP, length 1330
02:02:07.922962 58:00:e3:7e:0b:53 > 80:ad:16:cb:e4:d0, ethertype IPv6 (0x86dd), length 93: 2409:4063:4015:31fe:c50f:5aca:b1f4:c6a7.60720 > 2404:6800:4002:80a::2004.443: UDP, length 31
02:02:07.924832 80:ad:16:cb:e4:d0 > 58:00:e3:7e:0b:53, ethertype IPv6 (0x86dd), length 1392: 2404:6800:4002:80a::2004.443 > 2409:4063:4015:31fe:c50f:5aca:b1f4:c6a7.60720: UDP, length 1330
02:02:07.930421 80:ad:16:cb:e4:d0 > 58:00:e3:7e:0b:53, ethertype IPv6 (0x86dd), length 1392: 2404:6800:4002:80a::2004.443 > 2409:4063:4015:31fe:c50f:5aca:b1f4:c6a7.60720: UDP, length 1330
02:02:07.930642 58:00:e3:7e:0b:53 > 80:ad:16:cb:e4:d0, ethertype IPv6 (0x86dd), length 93: 2409:4063:4015:31fe:c50f:5aca:b1f4:c6a7.60720 > 2404:6800:4002:80a::2004.443: UDP, length 31
02:02:07.936035 80:ad:16:cb:e4:d0 > 58:00:e3:7e:0b:53, ethertype IPv6 (0x86dd), length 1392: 2404:6800:4002:80a::2004.443 > 2409:4063:4015:31fe:c50f:5aca:b1f4:c6a7.60720: UDP, length 1330
02:02:07.936210 80:ad:16:cb:e4:d0 > 58:00:e3:7e:0b:53, ethertype IPv6 (0x86dd), length 1392: 2404:6800:4002:80a::2004.443 > 2409:4063:4015:31fe:c50f:5aca:b1f4:c6a7.60720: UDP, length 1330
02:02:07.936682 58:00:e3:7e:0b:53 > 80:ad:16:cb:e4:d0, ethertype IPv6 (0x86dd), length 93: 2409:4063:4015:31fe:c50f:5aca:b1f4:c6a7.60720 > 2404:6800:4002:80a::2004.443: UDP, length 31
02:02:07.939030 80:ad:16:cb:e4:d0 > 58:00:e3:7e:0b:53, ethertype IPv6 (0x86dd), length 1392: 2404:6800:4002:80a::2004.443 > 2409:4063:4015:31fe:c50f:5aca:b1f4:c6a7.60720: UDP, length 1330
02:02:07.944348 80:ad:16:cb:e4:d0 > 58:00:e3:7e:0b:53, ethertype IPv6 (0x86dd), length 1392: 2404:6800:4002:80a::2004.443 > 2409:4063:4015:31fe:c50f:5aca:b1f4:c6a7.60720: UDP, length 1330
02:02:07.944567 58:00:e3:7e:0b:53 > 80:ad:16:cb:e4:d0, ethertype IPv6 (0x86dd), length 93: 2409:4063:4015:31fe:c50f:5aca:b1f4:c6a7.60720 > 2404:6800:4002:80a::2004.443: UDP, length 31
02:02:07.950053 80:ad:16:cb:e4:d0 > 58:00:e3:7e:0b:53, ethertype IPv6 (0x86dd), length 1392: 2404:6800:4002:80a::2004.443 > 2409:4063:4015:31fe:c50f:5aca:b1f4:c6a7.60720: UDP, length 1330
02:02:07.951106 80:ad:16:cb:e4:d0 > 58:00:e3:7e:0b:53, ethertype IPv6 (0x86dd), length 1392: 2404:6800:4002:80a::2004.443 > 2409:4063:4015:31fe:c50f:5aca:b1f4:c6a7.60720: UDP, length 1330
02:02:07.951948 58:00:e3:7e:0b:53 > 80:ad:16:cb:e4:d0, ethertype IPv6 (0x86dd), length 93: 2409:4063:4015:31fe:c50f:5aca:b1f4:c6a7.60720 > 2404:6800:4002:80a::2004.443: UDP, length 31
02:02:07.955884 80:ad:16:cb:e4:d0 > 58:00:e3:7e:0b:53, ethertype IPv6 (0x86dd), length 1392: 2404:6800:4002:80a::2004.443 > 2409:4063:4015:31fe:c50f:5aca:b1f4:c6a7.60720: UDP, length 1330
02:02:07.965696 80:ad:16:cb:e4:d0 > 58:00:e3:7e:0b:53, ethertype IPv6 (0x86dd), length 1392: 2404:6800:4002:80a::2004.443 > 2409:4063:4015:31fe:c50f:5aca:b1f4:c6a7.60720: UDP, length 1330
02:02:07.966227 58:00:e3:7e:0b:53 > 80:ad:16:cb:e4:d0, ethertype IPv6 (0x86dd), length 93: 2409:4063:4015:31fe:c50f:5aca:b1f4:c6a7.60720 > 2404:6800:4002:80a::2004.443: UDP, length 31
02:02:07.971042 80:ad:16:cb:e4:d0 > 58:00:e3:7e:0b:53, ethertype IPv6 (0x86dd), length 1392: 2404:6800:4002:80a::2004.443 > 2409:4063:4015:31fe:c50f:5aca:b1f4:c6a7.60720: UDP, length 1330
02:02:07.971310 80:ad:16:cb:e4:d0 > 58:00:e3:7e:0b:53, ethertype IPv6 (0x86dd), length 1392: 2404:6800:4002:80a::2004.443 > 2409:4063:4015:31fe:c50f:5aca:b1f4:c6a7.60720: UDP, length 1330
02:02:07.971457 58:00:e3:7e:0b:53 > 80:ad:16:cb:e4:d0, ethertype IPv6 (0x86dd), length 93: 2409:4063:4015:31fe:c50f:5aca:b1f4:c6a7.60720 > 2404:6800:4002:80a::2004.443: UDP, length 31
02:02:07.975186 80:ad:16:cb:e4:d0 > 58:00:e3:7e:0b:53, ethertype IPv6 (0x86dd), length 1392: 2404:6800:4002:80a::2004.443 > 2409:4063:4015:31fe:c50f:5aca:b1f4:c6a7.60720: UDP, length 1330
02:02:07.975457 80:ad:16:cb:e4:d0 > 58:00:e3:7e:0b:53, ethertype IPv6 (0x86dd), length 1392: 2404:6800:4002:80a::2004.443 > 2409:4063:4015:31fe:c50f:5aca:b1f4:c6a7.60720: UDP, length 1330
02:02:07.975575 58:00:e3:7e:0b:53 > 80:ad:16:cb:e4:d0, ethertype IPv6 (0x86dd), length 93: 2409:4063:4015:31fe:c50f:5aca:b1f4:c6a7.60720 > 2404:6800:4002:80a::2004.443: UDP, length 31
02:02:07.978492 80:ad:16:cb:e4:d0 > 58:00:e3:7e:0b:53, ethertype IPv6 (0x86dd), length 1392: 2404:6800:4002:80a::2004.443 > 2409:4063:4015:31fe:c50f:5aca:b1f4:c6a7.60720: UDP, length 1330
02:02:07.978630 80:ad:16:cb:e4:d0 > 58:00:e3:7e:0b:53, ethertype IPv4 (0x0800), length 104: 13.35.130.56.443 > 192.168.43.126.40388: Flags [P.], seq 226:264, ack 990, win 122, options [nop,nop,TS val 1684073462 ecr 3857387397], length 38
02:02:07.978700 80:ad:16:cb:e4:d0 > 58:00:e3:7e:0b:53, ethertype IPv4 (0x0800), length 402: 13.35.130.56.443 > 192.168.43.126.40388: Flags [P.], seq 264:600, ack 990, win 122, options [nop,nop,TS val 1684073462 ecr 3857387397], length 336
02:02:07.980690 58:00:e3:7e:0b:53 > 80:ad:16:cb:e4:d0, ethertype IPv4 (0x0800), length 66: 192.168.43.126.40388 > 13.35.130.56.443: Flags [.], ack 600, win 501, options [nop,nop,TS val 3857387457 ecr 1684073462], length 0
02:02:07.984313 58:00:e3:7e:0b:53 > 80:ad:16:cb:e4:d0, ethertype IPv4 (0x0800), length 108: 192.168.43.126.40388 > 13.35.130.56.443: Flags [P.], seq 990:1032, ack 600, win 501, options [nop,nop,TS val 3857387461 ecr 1684073462], length 42
02:02:07.985083 58:00:e3:7e:0b:53 > 80:ad:16:cb:e4:d0, ethertype IPv4 (0x0800), length 85: 192.168.43.126.58586 > 192.168.43.1.53: 557+ AAAA? f2.taboola.map.fastly.net. (43)
02:02:07.987472 80:ad:16:cb:e4:d0 > 58:00:e3:7e:0b:53, ethertype IPv6 (0x86dd), length 1392: 2404:6800:4002:80a::2004.443 > 2409:4063:4015:31fe:c50f:5aca:b1f4:c6a7.60720: UDP, length 1330
02:02:07.990246 80:ad:16:cb:e4:d0 > 58:00:e3:7e:0b:53, ethertype IPv6 (0x86dd), length 1392: 2404:6800:4002:80a::2004.443 > 2409:4063:4015:31fe:c50f:5aca:b1f4:c6a7.60720: UDP, length 1330
02:02:07.994018 58:00:e3:7e:0b:53 > 80:ad:16:cb:e4:d0, ethertype IPv6 (0x86dd), length 93: 2409:4063:4015:31fe:c50f:5aca:b1f4:c6a7.60720 > 2404:6800:4002:80a::2004.443: UDP, length 31
02:02:07.996003 80:ad:16:cb:e4:d0 > 58:00:e3:7e:0b:53, ethertype IPv6 (0x86dd), length 1392: 2404:6800:4002:80a::2004.443 > 2409:4063:4015:31fe:c50f:5aca:b1f4:c6a7.60720: UDP, length 1330
02:02:07.996672 58:00:e3:7e:0b:53 > 80:ad:16:cb:e4:d0, ethertype IPv6 (0x86dd), length 93: 2409:4063:4015:31fe:c50f:5aca:b1f4:c6a7.60720 > 2404:6800:4002:80a::2004.443: UDP, length 31
02:02:07.998108 80:ad:16:cb:e4:d0 > 58:00:e3:7e:0b:53, ethertype IPv6 (0x86dd), length 1392: 2404:6800:4002:80a::2004.443 > 2409:4063:4015:31fe:c50f:5aca:b1f4:c6a7.60720: UDP, length 1330
02:02:07.998291 80:ad:16:cb:e4:d0 > 58:00:e3:7e:0b:53, ethertype IPv6 (0x86dd), length 1392: 2404:6800:4002:80a::2004.443 > 2409:4063:4015:31fe:c50f:5aca:b1f4:c6a7.60720: UDP, length 1330
02:02:07.998399 58:00:e3:7e:0b:53 > 80:ad:16:cb:e4:d0, ethertype IPv6 (0x86dd), length 93: 2409:4063:4015:31fe:c50f:5aca:b1f4:c6a7.60720 > 2404:6800:4002:80a::2004.443: UDP, length 31
02:02:08.002961 80:ad:16:cb:e4:d0 > 58:00:e3:7e:0b:53, ethertype IPv6 (0x86dd), length 901: 2404:6800:4002:80a::2004.443 > 2409:4063:4015:31fe:c50f:5aca:b1f4:c6a7.60720: UDP, length 839
02:02:08.003313 80:ad:16:cb:e4:d0 > 58:00:e3:7e:0b:53, ethertype IPv4 (0x0800), length 85: 192.168.43.1.53 > 192.168.43.126.58586: 557 0/0/0 (43)
02:02:08.031047 80:ad:16:cb:e4:d0 > 58:00:e3:7e:0b:53, ethertype IPv6 (0x86dd), length 105: 2606:4700::6810:5c34.443 > 2409:4063:4015:31fe:c50f:5aca:b1f4:c6a7.47474: Flags [P.], seq 2080:2111, ack 5536, win 294, length 31
02:02:08.031073 58:00:e3:7e:0b:53 > 80:ad:16:cb:e4:d0, ethertype IPv6 (0x86dd), length 86: 2409:4063:4015:31fe:c50f:5aca:b1f4:c6a7.47474 > 2606:4700::6810:5c34.443: Flags [.], ack 1361, win 12547, options [nop,nop,sack 1 {2080:2111}], length 0
02:02:08.035345 58:00:e3:7e:0b:53 > 80:ad:16:cb:e4:d0, ethertype IPv6 (0x86dd), length 106: 2409:4063:4015:31fe:c50f:5aca:b1f4:c6a7.60720 > 2404:6800:4002:80a::2004.443: UDP, length 44
02:02:08.040356 58:00:e3:7e:0b:53 > 80:ad:16:cb:e4:d0, ethertype IPv6 (0x86dd), length 303: 2409:4063:4015:31fe:c50f:5aca:b1f4:c6a7.60720 > 2404:6800:4002:80a::2004.443: UDP, length 241
02:02:08.044787 58:00:e3:7e:0b:53 > 80:ad:16:cb:e4:d0, ethertype IPv4 (0x0800), length 112: 192.168.43.126.56972 > 35.186.220.184.443: Flags [P.], seq 568:614, ack 380, win 501, options [nop,nop,TS val 1071243097 ecr 1824352293], length 46
02:02:08.195430 80:ad:16:cb:e4:d0 > 58:00:e3:7e:0b:53, ethertype IPv6 (0x86dd), length 143: 2404:6800:4002:80a::2004.443 > 2409:4063:4015:31fe:c50f:5aca:b1f4:c6a7.60720: UDP, length 81
02:02:08.195441 80:ad:16:cb:e4:d0 > 58:00:e3:7e:0b:53, ethertype IPv6 (0x86dd), length 79: 2404:6800:4002:80a::2004.443 > 2409:4063:4015:31fe:c50f:5aca:b1f4:c6a7.60720: UDP, length 17
02:02:08.199388 58:00:e3:7e:0b:53 > 80:ad:16:cb:e4:d0, ethertype IPv6 (0x86dd), length 95: 2409:4063:4015:31fe:c50f:5aca:b1f4:c6a7.60720 > 2404:6800:4002:80a::2004.443: UDP, length 33
02:02:08.199455 58:00:e3:7e:0b:53 > 80:ad:16:cb:e4:d0, ethertype IPv6 (0x86dd), length 95: 2409:4063:4015:31fe:c50f:5aca:b1f4:c6a7.60720 > 2404:6800:4002:80a::2004.443: UDP, length 33
02:02:08.256627 58:00:e3:7e:0b:53 > 80:ad:16:cb:e4:d0, ethertype IPv6 (0x86dd), length 97: 2409:4063:4015:31fe:c50f:5aca:b1f4:c6a7.60720 > 2404:6800:4002:80a::2004.443: UDP, length 35
02:02:08.266737 58:00:e3:7e:0b:53 > 80:ad:16:cb:e4:d0, ethertype IPv6 (0x86dd), length 1392: 2409:4063:4015:31fe:c50f:5aca:b1f4:c6a7.41267 > 2404:6800:4002:802::200e.443: UDP, length 1330
02:02:08.266784 58:00:e3:7e:0b:53 > 80:ad:16:cb:e4:d0, ethertype IPv6 (0x86dd), length 1058: 2409:4063:4015:31fe:c50f:5aca:b1f4:c6a7.41267 > 2404:6800:4002:802::200e.443: UDP, length 996
02:02:08.268788 58:00:e3:7e:0b:53 > 80:ad:16:cb:e4:d0, ethertype IPv4 (0x0800), length 108: 192.168.43.126.40388 > 13.35.130.56.443: Flags [P.], seq 990:1032, ack 600, win 501, options [nop,nop,TS val 3857387745 ecr 1684073462], length 42
02:02:08.280968 58:00:e3:7e:0b:53 > 80:ad:16:cb:e4:d0, ethertype IPv4 (0x0800), length 87: 192.168.43.126.47094 > 192.168.43.1.53: 30908+ A? safebrowsing.googleapis.com. (45)
02:02:08.330006 80:ad:16:cb:e4:d0 > 58:00:e3:7e:0b:53, ethertype IPv4 (0x0800), length 103: 192.168.43.1.53 > 192.168.43.126.47094: 30908 1/0/0 A 172.217.167.42 (61)
02:02:08.330560 58:00:e3:7e:0b:53 > 80:ad:16:cb:e4:d0, ethertype IPv4 (0x0800), length 87: 192.168.43.126.52947 > 192.168.43.1.53: 57817+ AAAA? safebrowsing.googleapis.com. (45)
02:02:08.332629 80:ad:16:cb:e4:d0 > 58:00:e3:7e:0b:53, ethertype IPv4 (0x0800), length 78: 13.35.130.56.443 > 192.168.43.126.40388: Flags [.], ack 1032, win 122, options [nop,nop,TS val 1684073497 ecr 3857387745,nop,nop,sack 1 {990:1032}], length 0
02:02:08.332787 58:00:e3:7e:0b:53 > 80:ad:16:cb:e4:d0, ethertype IPv4 (0x0800), length 112: 192.168.43.126.56972 > 35.186.220.184.443: Flags [P.], seq 568:614, ack 380, win 501, options [nop,nop,TS val 1071243385 ecr 1824352293], length 46
02:02:08.336600 80:ad:16:cb:e4:d0 > 58:00:e3:7e:0b:53, ethertype IPv6 (0x86dd), length 82: 2404:6800:4002:802::200e.443 > 2409:4063:4015:31fe:c50f:5aca:b1f4:c6a7.41267: UDP, length 20
02:02:08.353144 80:ad:16:cb:e4:d0 > 58:00:e3:7e:0b:53, ethertype IPv6 (0x86dd), length 83: 2404:6800:4002:80a::2004.443 > 2409:4063:4015:31fe:c50f:5aca:b1f4:c6a7.60720: UDP, length 21
02:02:08.358991 58:00:e3:7e:0b:53 > 80:ad:16:cb:e4:d0, ethertype IPv4 (0x0800), length 171: 192.168.43.126.54722 > 199.232.22.2.443: Flags [P.], seq 1455079010:1455079115, ack 98392493, win 501, options [nop,nop,TS val 290128819 ecr 302477587], length 105
02:02:08.359069 58:00:e3:7e:0b:53 > 80:ad:16:cb:e4:d0, ethertype IPv4 (0x0800), length 112: 192.168.43.126.54722 > 199.232.22.2.443: Flags [P.], seq 105:151, ack 1, win 501, options [nop,nop,TS val 290128819 ecr 302477587], length 46
02:02:08.363038 58:00:e3:7e:0b:53 > 80:ad:16:cb:e4:d0, ethertype IPv6 (0x86dd), length 214: 2409:4063:4015:31fe:c50f:5aca:b1f4:c6a7.45860 > 2a03:2880:f22f:c5:face:b00c:0:167.443: Flags [P.], seq 1104:1232, ack 573, win 504, options [nop,nop,TS val 1342282695 ecr 121942119], length 128
02:02:08.379788 58:00:e3:7e:0b:53 > 80:ad:16:cb:e4:d0, ethertype IPv6 (0x86dd), length 318: 2409:4063:4015:31fe:c50f:5aca:b1f4:c6a7.45860 > 2a03:2880:f22f:c5:face:b00c:0:167.443: Flags [P.], seq 1232:1464, ack 573, win 504, options [nop,nop,TS val 1342282711 ecr 121942119], length 232
02:02:08.381684 58:00:e3:7e:0b:53 > 80:ad:16:cb:e4:d0, ethertype IPv4 (0x0800), length 72: 192.168.43.126.54631 > 192.168.43.1.53: 62111+ A? whatsapp.net. (30)
02:02:08.462577 80:ad:16:cb:e4:d0 > 58:00:e3:7e:0b:53, ethertype IPv6 (0x86dd), length 86: 2a03:2880:f22f:c5:face:b00c:0:167.443 > 2409:4063:4015:31fe:c50f:5aca:b1f4:c6a7.45860: Flags [.], ack 1464, win 126, options [nop,nop,TS val 121942852 ecr 1342282695], length 0
02:02:08.467565 80:ad:16:cb:e4:d0 > 58:00:e3:7e:0b:53, ethertype IPv4 (0x0800), length 66: 199.232.22.2.443 > 192.168.43.126.54722: Flags [.], ack 105, win 63, options [nop,nop,TS val 302489262 ecr 290128819], length 0
02:02:08.471355 80:ad:16:cb:e4:d0 > 58:00:e3:7e:0b:53, ethertype IPv4 (0x0800), length 66: 199.232.22.2.443 > 192.168.43.126.54722: Flags [.], ack 151, win 63, options [nop,nop,TS val 302489262 ecr 290128819], length 0
02:02:08.471371 80:ad:16:cb:e4:d0 > 58:00:e3:7e:0b:53, ethertype IPv4 (0x0800), length 112: 199.232.22.2.443 > 192.168.43.126.54722: Flags [P.], seq 1:47, ack 151, win 63, options [nop,nop,TS val 302489262 ecr 290128819], length 46
02:02:08.471383 58:00:e3:7e:0b:53 > 80:ad:16:cb:e4:d0, ethertype IPv4 (0x0800), length 66: 192.168.43.126.54722 > 199.232.22.2.443: Flags [.], ack 47, win 501, options [nop,nop,TS val 290128931 ecr 302489262], length 0
02:02:08.491851 80:ad:16:cb:e4:d0 > 58:00:e3:7e:0b:53, ethertype IPv6 (0x86dd), length 138: 2404:6800:4002:802::200e.443 > 2409:4063:4015:31fe:c50f:5aca:b1f4:c6a7.41267: UDP, length 76
02:02:08.517349 58:00:e3:7e:0b:53 > 80:ad:16:cb:e4:d0, ethertype IPv6 (0x86dd), length 90: 2409:4063:4015:31fe:c50f:5aca:b1f4:c6a7.41267 > 2404:6800:4002:802::200e.443: UDP, length 28
02:02:08.552975 80:ad:16:cb:e4:d0 > 58:00:e3:7e:0b:53, ethertype IPv6 (0x86dd), length 522: 2404:6800:4002:802::200e.443 > 2409:4063:4015:31fe:c50f:5aca:b1f4:c6a7.41267: UDP, length 460
02:02:08.553110 80:ad:16:cb:e4:d0 > 58:00:e3:7e:0b:53, ethertype IPv6 (0x86dd), length 90: 2404:6800:4002:802::200e.443 > 2409:4063:4015:31fe:c50f:5aca:b1f4:c6a7.41267: UDP, length 28
02:02:08.553175 80:ad:16:cb:e4:d0 > 58:00:e3:7e:0b:53, ethertype IPv6 (0x86dd), length 318: 2404:6800:4002:802::200e.443 > 2409:4063:4015:31fe:c50f:5aca:b1f4:c6a7.41267: UDP, length 256
02:02:08.553355 80:ad:16:cb:e4:d0 > 58:00:e3:7e:0b:53, ethertype IPv6 (0x86dd), length 793: 2606:4700::6810:5c34.443 > 2409:4063:4015:31fe:c50f:5aca:b1f4:c6a7.47474: Flags [P.], seq 1361:2080, ack 5536, win 294, length 719
02:02:08.553376 58:00:e3:7e:0b:53 > 80:ad:16:cb:e4:d0, ethertype IPv6 (0x86dd), length 74: 2409:4063:4015:31fe:c50f:5aca:b1f4:c6a7.47474 > 2606:4700::6810:5c34.443: Flags [.], ack 2111, win 12547, length 0
02:02:08.553418 80:ad:16:cb:e4:d0 > 58:00:e3:7e:0b:53, ethertype IPv4 (0x0800), length 283: 199.232.22.2.443 > 192.168.43.126.54722: Flags [P.], seq 47:264, ack 151, win 63, options [nop,nop,TS val 302489280 ecr 290128819], length 217
02:02:08.553448 58:00:e3:7e:0b:53 > 80:ad:16:cb:e4:d0, ethertype IPv4 (0x0800), length 66: 192.168.43.126.54722 > 199.232.22.2.443: Flags [.], ack 264, win 501, options [nop,nop,TS val 290129013 ecr 302489280], length 0
02:02:08.566499 58:00:e3:7e:0b:53 > 80:ad:16:cb:e4:d0, ethertype IPv6 (0x86dd), length 403: 2409:4063:4015:31fe:c50f:5aca:b1f4:c6a7.45504 > 2404:6800:4002:80f::200e.443: UDP, length 341
02:02:08.569798 58:00:e3:7e:0b:53 > 80:ad:16:cb:e4:d0, ethertype IPv6 (0x86dd), length 90: 2409:4063:4015:31fe:c50f:5aca:b1f4:c6a7.41267 > 2404:6800:4002:802::200e.443: UDP, length 28
02:02:08.570279 58:00:e3:7e:0b:53 > 80:ad:16:cb:e4:d0, ethertype IPv4 (0x0800), length 83: 192.168.43.126.55671 > 192.168.43.1.53: 52895+ A? stats.g.doubleclick.net. (41)
02:02:08.570491 58:00:e3:7e:0b:53 > 80:ad:16:cb:e4:d0, ethertype IPv4 (0x0800), length 83: 192.168.43.126.41200 > 192.168.43.1.53: 25331+ AAAA? stats.g.doubleclick.net. (41)
02:02:08.641174 80:ad:16:cb:e4:d0 > 58:00:e3:7e:0b:53, ethertype IPv6 (0x86dd), length 522: 2404:6800:4002:802::200e.443 > 2409:4063:4015:31fe:c50f:5aca:b1f4:c6a7.41267: UDP, length 460
02:02:08.646656 80:ad:16:cb:e4:d0 > 58:00:e3:7e:0b:53, ethertype IPv4 (0x0800), length 169: 192.168.43.1.53 > 192.168.43.126.55671: 52895 5/0/0 CNAME stats.l.doubleclick.net., A 172.217.194.155, A 172.217.194.157, A 172.217.194.156, A 172.217.194.154 (127)
02:02:08.649270 80:ad:16:cb:e4:d0 > 58:00:e3:7e:0b:53, ethertype IPv4 (0x0800), length 133: 192.168.43.1.53 > 192.168.43.126.41200: 25331 2/0/0 CNAME stats.l.doubleclick.net., AAAA 2404:6800:4003:c04::9d (91)
