18:46:17.270233 IP 192.168.43.1.5353 > 224.0.0.251.5353: 1 [2q] PTR (QU)? _37F83649._sub._googlecast._tcp.local. PTR (QU)? _googlecast._tcp.local. (61)
18:46:18.498306 IP 192.168.43.1.5353 > 224.0.0.251.5353: 3 [2q] PTR (QM)? _37F83649._sub._googlecast._tcp.local. PTR (QM)? _googlecast._tcp.local. (61)
18:46:38.967023 IP 192.168.43.1.5353 > 224.0.0.251.5353: 1 [2q] PTR (QU)? _37F83649._sub._googlecast._tcp.local. PTR (QU)? _googlecast._tcp.local. (61)
18:46:39.785740 IP 192.168.43.1.5353 > 224.0.0.251.5353: 2 [2q] PTR (QM)? _37F83649._sub._googlecast._tcp.local. PTR (QM)? _googlecast._tcp.local. (61)
18:47:00.870226 IP 192.168.43.1.5353 > 224.0.0.251.5353: 4 [2q] PTR (QM)? _37F83649._sub._googlecast._tcp.local. PTR (QM)? _googlecast._tcp.local. (61)
18:47:21.141424 IP 192.168.43.1.5353 > 224.0.0.251.5353: 5 [2q] PTR (QM)? _37F83649._sub._googlecast._tcp.local. PTR (QM)? _googlecast._tcp.local. (61)
18:47:40.790933 IP 192.168.43.1.5353 > 224.0.0.251.5353: 6 [2q] PTR (QM)? _37F83649._sub._googlecast._tcp.local. PTR (QM)? _googlecast._tcp.local. (61)
18:48:00.650334 IP 192.168.43.1.5353 > 224.0.0.251.5353: 7 [2q] PTR (QM)? _37F83649._sub._googlecast._tcp.local. PTR (QM)? _googlecast._tcp.local. (61)
18:48:21.124592 IP 192.168.43.1.5353 > 224.0.0.251.5353: 8 [2q] PTR (QM)? _37F83649._sub._googlecast._tcp.local. PTR (QM)? _googlecast._tcp.local. (61)
18:48:40.780766 IP 192.168.43.1.5353 > 224.0.0.251.5353: 9 [2q] PTR (QM)? _37F83649._sub._googlecast._tcp.local. PTR (QM)? _googlecast._tcp.local. (61)
18:48:44.466562 IP 192.168.43.1.5353 > 224.0.0.251.5353: 1 [3q] PTR (QU)? _37F83649._sub._googlecast._tcp.local. PTR (QU)? _C1EB68AE._sub._googlecast._tcp.local. PTR (QU)? _googlecast._tcp.local. (77)
18:48:47.537891 IP 192.168.43.1.5353 > 224.0.0.251.5353: 2 [3q] PTR (QM)? _37F83649._sub._googlecast._tcp.local. PTR (QM)? _C1EB68AE._sub._googlecast._tcp.local. PTR (QM)? _googlecast._tcp.local. (77)
18:48:47.539345 IP 192.168.43.1.5353 > 224.0.0.251.5353: 3 [3q] PTR (QM)? _37F83649._sub._googlecast._tcp.local. PTR (QM)? _C1EB68AE._sub._googlecast._tcp.local. PTR (QM)? _googlecast._tcp.local. (77)
18:48:48.561516 IP 192.168.43.1.5353 > 224.0.0.251.5353: 2 [2q] PTR (QM)? _37F83649._sub._googlecast._tcp.local. PTR (QM)? _googlecast._tcp.local. (61)
18:48:49.585306 IP 192.168.43.1.5353 > 224.0.0.251.5353: 3 [2q] PTR (QM)? _37F83649._sub._googlecast._tcp.local. PTR (QM)? _googlecast._tcp.local. (61)
18:48:49.586546 IP 192.168.43.1.5353 > 224.0.0.251.5353: 1 [3q] PTR (QU)? _37F83649._sub._googlecast._tcp.local. PTR (QU)? _C1EB68AE._sub._googlecast._tcp.local. PTR (QU)? _googlecast._tcp.local. (77)
18:48:51.223441 IP 192.168.43.1.5353 > 224.0.0.251.5353: 2 [3q] PTR (QM)? _37F83649._sub._googlecast._tcp.local. PTR (QM)? _C1EB68AE._sub._googlecast._tcp.local. PTR (QM)? _googlecast._tcp.local. (77)
18:48:53.680568 IP 192.168.43.1.5353 > 224.0.0.251.5353: 3 [3q] PTR (QM)? _37F83649._sub._googlecast._tcp.local. PTR (QM)? _C1EB68AE._sub._googlecast._tcp.local. PTR (QM)? _googlecast._tcp.local. (77)
18:49:00.437401 IP 192.168.43.1.5353 > 224.0.0.251.5353: 1 [2q] PTR (QU)? _37F83649._sub._googlecast._tcp.local. PTR (QU)? _googlecast._tcp.local. (61)
18:49:01.461003 IP 192.168.43.1.5353 > 224.0.0.251.5353: 2 [2q] PTR (QM)? _37F83649._sub._googlecast._tcp.local. PTR (QM)? _googlecast._tcp.local. (61)
18:49:02.689756 IP 192.168.43.1.5353 > 224.0.0.251.5353: 3 [2q] PTR (QM)? _37F83649._sub._googlecast._tcp.local. PTR (QM)? _googlecast._tcp.local. (61)
18:49:22.551645 IP 192.168.43.1.5353 > 224.0.0.251.5353: 4 [2q] PTR (QM)? _37F83649._sub._googlecast._tcp.local. PTR (QM)? _googlecast._tcp.local. (61)
18:49:42.297541 IP 192.168.43.1.5353 > 224.0.0.251.5353: 5 [2q] PTR (QM)? _37F83649._sub._googlecast._tcp.local. PTR (QM)? _googlecast._tcp.local. (61)
18:49:56.543154 IP 192.168.43.1.5353 > 224.0.0.251.5353: 2 [3q] PTR (QM)? _37F83649._sub._googlecast._tcp.local. PTR (QM)? _C1EB68AE._sub._googlecast._tcp.local. PTR (QM)? _googlecast._tcp.local. (77)
18:49:56.544481 IP 192.168.43.1.5353 > 224.0.0.251.5353: 1 [2q] PTR (QU)? _37F83649._sub._googlecast._tcp.local. PTR (QU)? _googlecast._tcp.local. (61)
18:49:57.163663 IP 192.168.43.1.5353 > 224.0.0.251.5353: 2 [2q] PTR (QM)? _37F83649._sub._googlecast._tcp.local. PTR (QM)? _googlecast._tcp.local. (61)
