18:45:13.905526 IP 192.168.43.126.57130 > 172.217.27.163.443: Flags [S], seq 12554976, win 64240, options [mss 1460,sackOK,TS val 2287275564 ecr 0,nop,wscale 7], length 0
18:45:14.036545 IP 192.168.43.126.57132 > 172.217.27.163.443: Flags [S], seq 933575337, win 64240, options [mss 1460,sackOK,TS val 2287275642 ecr 0,nop,wscale 7], length 0
18:45:14.226889 IP 172.217.27.163.443 > 192.168.43.126.57132: Flags [S.], seq 3262246607, ack 933575338, win 60192, options [mss 1370,sackOK,TS val 649484992 ecr 2287275642,nop,wscale 8], length 0
18:45:14.226954 IP 192.168.43.126.57132 > 172.217.27.163.443: Flags [.], ack 1, win 502, options [nop,nop,TS val 2287275886 ecr 649484992], length 0
18:45:14.227394 IP 192.168.43.126.57132 > 172.217.27.163.443: Flags [P.], seq 1:518, ack 1, win 502, options [nop,nop,TS val 2287275886 ecr 649484992], length 517
18:45:14.428157 IP 172.217.27.163.443 > 192.168.43.126.57132: Flags [.], seq 1:1359, ack 518, win 240, options [nop,nop,TS val 649485285 ecr 2287275886], length 1358
18:45:14.428209 IP 192.168.43.126.57132 > 172.217.27.163.443: Flags [.], ack 1359, win 501, options [nop,nop,TS val 2287276087 ecr 649485285], length 0
18:45:14.428589 IP 172.217.27.163.443 > 192.168.43.126.57132: Flags [.], seq 1359:2717, ack 518, win 240, options [nop,nop,TS val 649485285 ecr 2287275886], length 1358
18:45:14.428610 IP 192.168.43.126.57132 > 172.217.27.163.443: Flags [.], ack 2717, win 501, options [nop,nop,TS val 2287276087 ecr 649485285], length 0
18:45:14.428700 IP 172.217.27.163.443 > 192.168.43.126.57132: Flags [P.], seq 2717:3752, ack 518, win 240, options [nop,nop,TS val 649485285 ecr 2287275886], length 1035
18:45:14.428713 IP 192.168.43.126.57132 > 172.217.27.163.443: Flags [.], ack 3752, win 497, options [nop,nop,TS val 2287276087 ecr 649485285], length 0
18:45:14.436389 IP 192.168.43.126.57132 > 172.217.27.163.443: Flags [P.], seq 518:582, ack 3752, win 501, options [nop,nop,TS val 2287276095 ecr 649485285], length 64
18:45:14.436695 IP 192.168.43.126.57132 > 172.217.27.163.443: Flags [P.], seq 582:668, ack 3752, win 501, options [nop,nop,TS val 2287276095 ecr 649485285], length 86
18:45:14.437028 IP 192.168.43.126.57132 > 172.217.27.163.443: Flags [P.], seq 668:1107, ack 3752, win 501, options [nop,nop,TS val 2287276096 ecr 649485285], length 439
18:45:14.506701 IP 172.217.27.163.443 > 192.168.43.126.57132: Flags [.], ack 582, win 240, options [nop,nop,TS val 649485402 ecr 2287276095], length 0
18:45:14.607816 IP 172.217.27.163.443 > 192.168.43.126.57132: Flags [P.], seq 4347:5080, ack 1107, win 244, options [nop,nop,TS val 649485482 ecr 2287276096], length 733
18:45:14.607855 IP 172.217.27.163.443 > 192.168.43.126.57132: Flags [P.], seq 5080:5111, ack 1107, win 244, options [nop,nop,TS val 649485483 ecr 2287276096], length 31
18:45:14.607865 IP 172.217.27.163.443 > 192.168.43.126.57132: Flags [P.], seq 5111:5150, ack 1107, win 244, options [nop,nop,TS val 649485483 ecr 2287276096], length 39
18:45:14.608517 IP 192.168.43.126.57132 > 172.217.27.163.443: Flags [.], ack 3752, win 501, options [nop,nop,TS val 2287276267 ecr 649485402,nop,nop,sack 1 {4347:5080}], length 0
18:45:14.608544 IP 192.168.43.126.57132 > 172.217.27.163.443: Flags [.], ack 3752, win 501, options [nop,nop,TS val 2287276267 ecr 649485402,nop,nop,sack 1 {4347:5111}], length 0
18:45:14.608551 IP 192.168.43.126.57132 > 172.217.27.163.443: Flags [.], ack 3752, win 501, options [nop,nop,TS val 2287276267 ecr 649485402,nop,nop,sack 1 {4347:5150}], length 0
18:45:14.685603 IP 172.217.27.163.443 > 192.168.43.126.57132: Flags [P.], seq 3752:4347, ack 1107, win 244, options [nop,nop,TS val 649485562 ecr 2287276267], length 595
18:45:14.685659 IP 192.168.43.126.57132 > 172.217.27.163.443: Flags [.], ack 5150, win 501, options [nop,nop,TS val 2287276344 ecr 649485562], length 0
18:45:14.688931 IP 192.168.43.126.57132 > 172.217.27.163.443: Flags [P.], seq 1107:1138, ack 5150, win 501, options [nop,nop,TS val 2287276348 ecr 649485562], length 31
18:45:14.689085 IP 192.168.43.126.57132 > 172.217.27.163.443: Flags [P.], seq 1138:1177, ack 5150, win 501, options [nop,nop,TS val 2287276348 ecr 649485562], length 39
18:45:14.765766 IP 172.217.27.163.443 > 192.168.43.126.57132: Flags [.], ack 1177, win 244, options [nop,nop,TS val 649485652 ecr 2287276348], length 0
18:45:14.910391 IP 192.168.43.126.57130 > 172.217.27.163.443: Flags [S], seq 12554976, win 64240, options [mss 1460,sackOK,TS val 2287276569 ecr 0,nop,wscale 7], length 0
18:45:15.082187 IP 172.217.27.163.443 > 192.168.43.126.57130: Flags [S.], seq 2644089128, ack 12554977, win 60192, options [mss 1370,sackOK,TS val 4136017882 ecr 2287275564,nop,wscale 8], length 0
18:45:15.082245 IP 192.168.43.126.57130 > 172.217.27.163.443: Flags [.], ack 1, win 502, options [nop,nop,TS val 2287276741 ecr 4136017882], length 0
18:45:15.082842 IP 192.168.43.126.57130 > 172.217.27.163.443: Flags [P.], seq 1:635, ack 1, win 502, options [nop,nop,TS val 2287276742 ecr 4136017882], length 634
18:45:15.186108 IP 172.217.27.163.443 > 192.168.43.126.57130: Flags [.], ack 635, win 241, options [nop,nop,TS val 4136018046 ecr 2287276742], length 0
18:45:15.186124 IP 172.217.27.163.443 > 192.168.43.126.57130: Flags [P.], seq 1:213, ack 635, win 241, options [nop,nop,TS val 4136018046 ecr 2287276742], length 212
18:45:15.186137 IP 192.168.43.126.57130 > 172.217.27.163.443: Flags [.], ack 213, win 501, options [nop,nop,TS val 2287276845 ecr 4136018046], length 0
18:45:15.187652 IP 192.168.43.126.57130 > 172.217.27.163.443: Flags [P.], seq 635:699, ack 213, win 501, options [nop,nop,TS val 2287276846 ecr 4136018046], length 64
18:45:15.266725 IP 172.217.27.163.443 > 192.168.43.126.57130: Flags [P.], seq 213:777, ack 699, win 241, options [nop,nop,TS val 4136018142 ecr 2287276846], length 564
18:45:15.310590 IP 192.168.43.126.57130 > 172.217.27.163.443: Flags [.], ack 777, win 501, options [nop,nop,TS val 2287276969 ecr 4136018142], length 0
18:45:15.480407 IP 35.190.9.187.443 > 192.168.43.126.39262: Flags [P.], seq 214673259:214673322, ack 1712954572, win 272, options [nop,nop,TS val 2159425015 ecr 3815644954], length 63
18:45:15.480713 IP 192.168.43.126.39262 > 35.190.9.187.443: Flags [F.], seq 1, ack 63, win 501, options [nop,nop,TS val 3815885005 ecr 2159425015], length 0
18:45:15.481770 IP 35.190.9.187.443 > 192.168.43.126.39262: Flags [F.], seq 63, ack 1, win 272, options [nop,nop,TS val 2159425015 ecr 3815644954], length 0
18:45:15.481800 IP 192.168.43.126.39262 > 35.190.9.187.443: Flags [.], ack 64, win 501, options [nop,nop,TS val 3815885007 ecr 2159425015], length 0
18:45:15.934388 IP 192.168.43.126.39262 > 35.190.9.187.443: Flags [F.], seq 1, ack 64, win 501, options [nop,nop,TS val 3815885459 ecr 2159425015], length 0
18:45:16.041609 IP 35.190.9.187.443 > 192.168.43.126.39262: Flags [.], ack 2, win 272, options [nop,nop,TS val 2159425545 ecr 3815885007], length 0
18:45:16.414407 IP6 2405:204:a59d:38b6:410d:d45e:ae02:b1bd.49600 > 2404:6800:4002:80b::200a.443: Flags [.], ack 4283353024, win 501, options [nop,nop,TS val 3536762847 ecr 1620189788], length 0
18:45:16.467082 IP6 2404:6800:4002:80b::200a.443 > 2405:204:a59d:38b6:410d:d45e:ae02:b1bd.49600: Flags [.], ack 1, win 268, options [nop,nop,TS val 1620234968 ecr 3536671744], length 0
18:45:17.268374 IP 35.241.23.116.443 > 192.168.43.126.46736: Flags [P.], seq 4251670182:4251670245, ack 2773139567, win 261, options [nop,nop,TS val 1128143308 ecr 1802654804], length 63
18:45:17.268814 IP 192.168.43.126.46736 > 35.241.23.116.443: Flags [F.], seq 1, ack 63, win 501, options [nop,nop,TS val 1802894647 ecr 1128143308], length 0
18:45:17.337406 IP 35.241.23.116.443 > 192.168.43.126.46736: Flags [F.], seq 63, ack 1, win 261, options [nop,nop,TS val 1128143308 ecr 1802654804], length 0
18:45:17.337438 IP 192.168.43.126.46736 > 35.241.23.116.443: Flags [.], ack 64, win 501, options [nop,nop,TS val 1802894715 ecr 1128143308], length 0
18:45:17.337467 IP 35.241.16.233.443 > 192.168.43.126.33070: Flags [P.], seq 2006112225:2006112288, ack 284724566, win 272, options [nop,nop,TS val 1781850305 ecr 1466883073], length 63
18:45:17.337511 IP 35.241.16.233.443 > 192.168.43.126.33070: Flags [F.], seq 63, ack 1, win 272, options [nop,nop,TS val 1781850305 ecr 1466883073], length 0
18:45:17.337519 IP 35.241.23.116.443 > 192.168.43.126.46736: Flags [.], ack 2, win 261, options [nop,nop,TS val 1128143411 ecr 1802894647], length 0
18:45:17.337828 IP 192.168.43.126.33070 > 35.241.16.233.443: Flags [F.], seq 1, ack 64, win 501, options [nop,nop,TS val 1467123154 ecr 1781850305], length 0
18:45:17.413556 IP 35.241.16.233.443 > 192.168.43.126.33070: Flags [.], ack 2, win 272, options [nop,nop,TS val 1781850461 ecr 1467123154], length 0
18:45:17.758595 IP 192.168.43.126.55668 > 111.221.29.254.443: Flags [.], ack 193547585, win 501, options [nop,nop,TS val 1407345658 ecr 2465135480], length 0
18:45:18.023454 IP 111.221.29.254.443 > 192.168.43.126.55668: Flags [.], ack 1, win 1029, options [nop,nop,TS val 2465180923 ecr 1407300403], length 0
18:45:18.282599 IP 192.168.43.126.42798 > 172.217.166.227.443: Flags [.], ack 4275887301, win 501, options [nop,nop,TS val 2335137230 ecr 1261367536], length 0
18:45:18.405658 IP 172.217.166.227.443 > 192.168.43.126.42798: Flags [.], ack 1, win 250, options [nop,nop,TS val 1261412612 ecr 2335092124], length 0
18:45:18.466560 IP 13.35.130.42.443 > 192.168.43.126.50006: Flags [P.], seq 2235200856:2235200902, ack 2339600196, win 151, options [nop,nop,TS val 1646897703 ecr 3522496377], length 46
18:45:18.466586 IP 192.168.43.126.50006 > 13.35.130.42.443: Flags [.], ack 46, win 501, options [nop,nop,TS val 3522736215 ecr 1646897703], length 0
18:45:18.466721 IP 192.168.43.126.50006 > 13.35.130.42.443: Flags [F.], seq 1, ack 46, win 501, options [nop,nop,TS val 3522736215 ecr 1646897703], length 0
18:45:18.467682 IP 13.35.130.42.443 > 192.168.43.126.50006: Flags [FP.], seq 46:77, ack 1, win 151, options [nop,nop,TS val 1646897703 ecr 3522496377], length 31
18:45:18.467723 IP 192.168.43.126.50006 > 13.35.130.42.443: Flags [R], seq 2339600196, win 0, length 0
18:45:18.664365 IP 13.35.130.42.443 > 192.168.43.126.50006: Flags [.], ack 2, win 151, options [nop,nop,TS val 1646897710 ecr 3522736215], length 0
18:45:18.664387 IP 192.168.43.126.50006 > 13.35.130.42.443: Flags [R], seq 2339600197, win 0, length 0
18:45:20.318413 IP 192.168.43.126.55628 > 111.221.29.254.443: Flags [.], ack 2501031316, win 501, options [nop,nop,TS val 1407348218 ecr 2448067406], length 0
18:45:20.604707 IP 111.221.29.254.443 > 192.168.43.126.55628: Flags [.], ack 1, win 1029, options [nop,nop,TS val 2448114508 ecr 1407301304], length 0
18:45:30.558421 IP6 2405:204:a59d:38b6:410d:d45e:ae02:b1bd.55408 > 2404:6800:4002:808::2012.443: Flags [.], ack 3739266556, win 501, options [nop,nop,TS val 656108119 ecr 2262904102], length 0
18:45:30.558448 IP6 2405:204:a59d:38b6:410d:d45e:ae02:b1bd.41228 > 2404:6800:4003:c02::bc.5228: Flags [.], ack 1502576698, win 501, options [nop,nop,TS val 536496534 ecr 3759003896], length 0
18:45:31.166421 IP 192.168.43.126.43000 > 216.58.200.178.443: Flags [.], ack 3240696478, win 501, options [nop,nop,TS val 4126191794 ecr 367604231], length 0
18:45:31.167014 IP6 2404:6800:4002:808::2012.443 > 2405:204:a59d:38b6:410d:d45e:ae02:b1bd.55408: Flags [.], ack 1, win 265, options [nop,nop,TS val 2262949508 ecr 656062778], length 0
18:45:31.167249 IP6 2404:6800:4003:c02::bc.5228 > 2405:204:a59d:38b6:410d:d45e:ae02:b1bd.41228: Flags [.], ack 1, win 278, options [nop,nop,TS val 3759050967 ecr 536175026], length 0
18:45:31.419869 IP 216.58.200.178.443 > 192.168.43.126.43000: Flags [.], ack 1, win 244, options [nop,nop,TS val 367649467 ecr 4126146514], length 0
18:45:33.182819 IP 192.168.43.126.57130 > 172.217.27.163.443: Flags [R.], seq 699, ack 777, win 501, options [nop,nop,TS val 2287294842 ecr 4136018142], length 0
18:45:33.387126 IP 192.168.43.126.54918 > 168.63.244.178.443: Flags [S], seq 1042554175, win 64240, options [mss 1460,sackOK,TS val 578441898 ecr 0,nop,wscale 7], length 0
18:45:33.433762 IP 192.168.43.126.54920 > 168.63.244.178.443: Flags [S], seq 885964144, win 64240, options [mss 1460,sackOK,TS val 578441944 ecr 0,nop,wscale 7], length 0
18:45:33.512500 IP 168.63.244.178.443 > 192.168.43.126.54918: Flags [S.], seq 2643544810, ack 1042554176, win 8192, options [mss 1370,nop,wscale 8,sackOK,TS val 674655248 ecr 578441898], length 0
18:45:33.512587 IP 192.168.43.126.54918 > 168.63.244.178.443: Flags [.], ack 1, win 502, options [nop,nop,TS val 578442023 ecr 674655248], length 0
18:45:33.513311 IP 192.168.43.126.54918 > 168.63.244.178.443: Flags [P.], seq 1:518, ack 1, win 502, options [nop,nop,TS val 578442024 ecr 674655248], length 517
18:45:33.572234 IP 168.63.244.178.443 > 192.168.43.126.54920: Flags [S.], seq 1520960357, ack 885964145, win 8192, options [mss 1370,nop,wscale 8,sackOK,TS val 675119400 ecr 578441944], length 0
18:45:33.572303 IP 192.168.43.126.54920 > 168.63.244.178.443: Flags [.], ack 1, win 502, options [nop,nop,TS val 578442083 ecr 675119400], length 0
18:45:33.572887 IP 192.168.43.126.54920 > 168.63.244.178.443: Flags [P.], seq 1:518, ack 1, win 502, options [nop,nop,TS val 578442084 ecr 675119400], length 517
18:45:33.638238 IP 168.63.244.178.443 > 192.168.43.126.54918: Flags [.], seq 1:1359, ack 518, win 1029, options [nop,nop,TS val 674655376 ecr 578442024], length 1358
18:45:33.638304 IP 192.168.43.126.54918 > 168.63.244.178.443: Flags [.], ack 1359, win 501, options [nop,nop,TS val 578442149 ecr 674655376], length 0
18:45:33.638646 IP 168.63.244.178.443 > 192.168.43.126.54918: Flags [.], seq 1359:2717, ack 518, win 1029, options [nop,nop,TS val 674655376 ecr 578442024], length 1358
18:45:33.638670 IP 192.168.43.126.54918 > 168.63.244.178.443: Flags [.], ack 2717, win 501, options [nop,nop,TS val 578442149 ecr 674655376], length 0
18:45:33.638783 IP 168.63.244.178.443 > 192.168.43.126.54918: Flags [.], seq 2717:4075, ack 518, win 1029, options [nop,nop,TS val 674655376 ecr 578442024], length 1358
18:45:33.638798 IP 192.168.43.126.54918 > 168.63.244.178.443: Flags [.], ack 4075, win 501, options [nop,nop,TS val 578442150 ecr 674655376], length 0
18:45:33.638964 IP 168.63.244.178.443 > 192.168.43.126.54918: Flags [.], seq 4075:5433, ack 518, win 1029, options [nop,nop,TS val 674655376 ecr 578442024], length 1358
18:45:33.638983 IP 192.168.43.126.54918 > 168.63.244.178.443: Flags [.], ack 5433, win 501, options [nop,nop,TS val 578442150 ecr 674655376], length 0
18:45:33.639148 IP 168.63.244.178.443 > 192.168.43.126.54918: Flags [.], seq 5433:6791, ack 518, win 1029, options [nop,nop,TS val 674655376 ecr 578442024], length 1358
18:45:33.639167 IP 192.168.43.126.54918 > 168.63.244.178.443: Flags [.], ack 6791, win 501, options [nop,nop,TS val 578442150 ecr 674655376], length 0
18:45:33.639248 IP 168.63.244.178.443 > 192.168.43.126.54918: Flags [P.], seq 6791:7159, ack 518, win 1029, options [nop,nop,TS val 674655376 ecr 578442024], length 368
18:45:33.639269 IP 192.168.43.126.54918 > 168.63.244.178.443: Flags [.], ack 7159, win 501, options [nop,nop,TS val 578442150 ecr 674655376], length 0
18:45:33.653939 IP 192.168.43.126.54918 > 168.63.244.178.443: Flags [P.], seq 518:611, ack 7159, win 501, options [nop,nop,TS val 578442165 ecr 674655376], length 93
18:45:33.704216 IP 168.63.244.178.443 > 192.168.43.126.54920: Flags [.], seq 1:1359, ack 518, win 1029, options [nop,nop,TS val 675119533 ecr 578442084], length 1358
18:45:33.704290 IP 192.168.43.126.54920 > 168.63.244.178.443: Flags [.], ack 1359, win 501, options [nop,nop,TS val 578442215 ecr 675119533], length 0
18:45:33.705755 IP 168.63.244.178.443 > 192.168.43.126.54920: Flags [.], seq 1359:2717, ack 518, win 1029, options [nop,nop,TS val 675119533 ecr 578442084], length 1358
18:45:33.705780 IP 192.168.43.126.54920 > 168.63.244.178.443: Flags [.], ack 2717, win 501, options [nop,nop,TS val 578442216 ecr 675119533], length 0
18:45:33.706196 IP 168.63.244.178.443 > 192.168.43.126.54920: Flags [.], seq 2717:4075, ack 518, win 1029, options [nop,nop,TS val 675119533 ecr 578442084], length 1358
18:45:33.706219 IP 192.168.43.126.54920 > 168.63.244.178.443: Flags [.], ack 4075, win 501, options [nop,nop,TS val 578442217 ecr 675119533], length 0
18:45:33.713988 IP 168.63.244.178.443 > 192.168.43.126.54920: Flags [.], seq 4075:5433, ack 518, win 1029, options [nop,nop,TS val 675119533 ecr 578442084], length 1358
18:45:33.714022 IP 192.168.43.126.54920 > 168.63.244.178.443: Flags [.], ack 5433, win 501, options [nop,nop,TS val 578442225 ecr 675119533], length 0
18:45:33.714342 IP 168.63.244.178.443 > 192.168.43.126.54920: Flags [.], seq 5433:6791, ack 518, win 1029, options [nop,nop,TS val 675119533 ecr 578442084], length 1358
18:45:33.714381 IP 192.168.43.126.54920 > 168.63.244.178.443: Flags [.], ack 6791, win 501, options [nop,nop,TS val 578442225 ecr 675119533], length 0
18:45:33.714463 IP 168.63.244.178.443 > 192.168.43.126.54920: Flags [P.], seq 6791:7159, ack 518, win 1029, options [nop,nop,TS val 675119533 ecr 578442084], length 368
18:45:33.714476 IP 192.168.43.126.54920 > 168.63.244.178.443: Flags [.], ack 7159, win 501, options [nop,nop,TS val 578442225 ecr 675119533], length 0
18:45:33.719842 IP 192.168.43.126.54920 > 168.63.244.178.443: Flags [P.], seq 518:611, ack 7159, win 501, options [nop,nop,TS val 578442231 ecr 675119533], length 93
18:45:33.825678 IP 168.63.244.178.443 > 192.168.43.126.54918: Flags [P.], seq 7159:7210, ack 611, win 1028, options [nop,nop,TS val 674655548 ecr 578442165], length 51
18:45:33.826357 IP 192.168.43.126.54918 > 168.63.244.178.443: Flags [P.], seq 611:1742, ack 7210, win 501, options [nop,nop,TS val 578442337 ecr 674655548], length 1131
18:45:33.843149 IP 192.168.43.126.55628 > 111.221.29.254.443: Flags [.], seq 1:1359, ack 1, win 501, options [nop,nop,TS val 1407361743 ecr 2448114508], length 1358
18:45:33.843173 IP 192.168.43.126.55628 > 111.221.29.254.443: Flags [P.], seq 1359:1365, ack 1, win 501, options [nop,nop,TS val 1407361743 ecr 2448114508], length 6
18:45:33.849618 IP 168.63.244.178.443 > 192.168.43.126.54920: Flags [P.], seq 7159:7210, ack 611, win 1028, options [nop,nop,TS val 675119677 ecr 578442231], length 51
18:45:33.890574 IP 192.168.43.126.54920 > 168.63.244.178.443: Flags [.], ack 7210, win 501, options [nop,nop,TS val 578442401 ecr 675119677], length 0
18:45:33.907710 IP 192.168.43.126.44626 > 54.95.198.227.443: Flags [S], seq 1527289485, win 64240, options [mss 1460,sackOK,TS val 3646561891 ecr 0,nop,wscale 7], length 0
18:45:33.973226 IP 168.63.244.178.443 > 192.168.43.126.54918: Flags [FP.], seq 7210:8185, ack 1742, win 1024, options [nop,nop,TS val 674655710 ecr 578442337], length 975
18:45:33.975140 IP 192.168.43.126.54918 > 168.63.244.178.443: Flags [F.], seq 1742, ack 8186, win 501, options [nop,nop,TS val 578442486 ecr 674655710], length 0
18:45:34.001668 IP 192.168.43.126.55668 > 111.221.29.254.443: Flags [.], seq 1:1359, ack 1, win 501, options [nop,nop,TS val 1407361901 ecr 2465180923], length 1358
18:45:34.001698 IP 192.168.43.126.55668 > 111.221.29.254.443: Flags [P.], seq 1359:1380, ack 1, win 501, options [nop,nop,TS val 1407361901 ecr 2465180923], length 21
18:45:34.012438 IP 192.168.43.126.44628 > 54.95.198.227.443: Flags [S], seq 3394829764, win 64240, options [mss 1460,sackOK,TS val 3646561996 ecr 0,nop,wscale 7], length 0
18:45:34.023214 IP 111.221.29.254.443 > 192.168.43.126.55628: Flags [.], ack 1365, win 1029, options [nop,nop,TS val 2448128007 ecr 1407361743], length 0
18:45:34.023238 IP 111.221.29.254.443 > 192.168.43.126.55628: Flags [P.], seq 1:720, ack 1365, win 1029, options [nop,nop,TS val 2448128007 ecr 1407361743], length 719
18:45:34.023261 IP 192.168.43.126.55628 > 111.221.29.254.443: Flags [.], ack 720, win 501, options [nop,nop,TS val 1407361923 ecr 2448128007], length 0
18:45:34.111109 IP 168.63.244.178.443 > 192.168.43.126.54918: Flags [.], ack 1743, win 1024, options [nop,nop,TS val 674655838 ecr 578442486], length 0
18:45:34.123181 IP 54.95.198.227.443 > 192.168.43.126.44626: Flags [S.], seq 1280299184, ack 1527289486, win 26847, options [mss 1370,sackOK,TS val 145547544 ecr 3646561891,nop,wscale 8], length 0
18:45:34.123255 IP 192.168.43.126.44626 > 54.95.198.227.443: Flags [.], ack 1, win 502, options [nop,nop,TS val 3646562107 ecr 145547544], length 0
18:45:34.124500 IP 192.168.43.126.44626 > 54.95.198.227.443: Flags [P.], seq 1:518, ack 1, win 502, options [nop,nop,TS val 3646562108 ecr 145547544], length 517
18:45:34.173220 IP 192.168.43.126.39386 > 35.190.9.187.443: Flags [S], seq 3780817290, win 64240, options [mss 1460,sackOK,TS val 3815903698 ecr 0,nop,wscale 7], length 0
18:45:34.220663 IP 111.221.29.254.443 > 192.168.43.126.55668: Flags [.], ack 1380, win 1029, options [nop,nop,TS val 2465197197 ecr 1407361901], length 0
18:45:34.220693 IP 111.221.29.254.443 > 192.168.43.126.55668: Flags [P.], seq 1:720, ack 1380, win 1029, options [nop,nop,TS val 2465197197 ecr 1407361901], length 719
18:45:34.220718 IP 192.168.43.126.55668 > 111.221.29.254.443: Flags [.], ack 720, win 501, options [nop,nop,TS val 1407362120 ecr 2465197197], length 0
18:45:34.223814 IP 35.190.9.187.443 > 192.168.43.126.39386: Flags [S.], seq 2346322943, ack 3780817291, win 60192, options [mss 1370,sackOK,TS val 3966077917 ecr 3815903698,nop,wscale 8], length 0
18:45:34.223874 IP 192.168.43.126.39386 > 35.190.9.187.443: Flags [.], ack 1, win 502, options [nop,nop,TS val 3815903749 ecr 3966077917], length 0
18:45:34.226999 IP 192.168.43.126.39386 > 35.190.9.187.443: Flags [P.], seq 1:538, ack 1, win 502, options [nop,nop,TS val 3815903752 ecr 3966077917], length 537
18:45:34.233306 IP 54.95.198.227.443 > 192.168.43.126.44628: Flags [S.], seq 3482592484, ack 3394829765, win 26847, options [mss 1370,sackOK,TS val 145547571 ecr 3646561996,nop,wscale 8], length 0
18:45:34.233358 IP 192.168.43.126.44628 > 54.95.198.227.443: Flags [.], ack 1, win 502, options [nop,nop,TS val 3646562217 ecr 145547571], length 0
18:45:34.233789 IP 192.168.43.126.44628 > 54.95.198.227.443: Flags [P.], seq 1:518, ack 1, win 502, options [nop,nop,TS val 3646562218 ecr 145547571], length 517
18:45:34.281545 IP 35.190.9.187.443 > 192.168.43.126.39386: Flags [.], ack 538, win 240, options [nop,nop,TS val 3966077967 ecr 3815903752], length 0
18:45:34.281570 IP 35.190.9.187.443 > 192.168.43.126.39386: Flags [P.], seq 1:157, ack 538, win 240, options [nop,nop,TS val 3966077967 ecr 3815903752], length 156
18:45:34.281589 IP 192.168.43.126.39386 > 35.190.9.187.443: Flags [.], ack 157, win 501, options [nop,nop,TS val 3815903806 ecr 3966077967], length 0
18:45:34.284607 IP 192.168.43.126.39386 > 35.190.9.187.443: Flags [P.], seq 538:589, ack 157, win 501, options [nop,nop,TS val 3815903809 ecr 3966077967], length 51
18:45:34.285002 IP 192.168.43.126.39386 > 35.190.9.187.443: Flags [P.], seq 589:682, ack 157, win 501, options [nop,nop,TS val 3815903810 ecr 3966077967], length 93
18:45:34.285701 IP 192.168.43.126.39386 > 35.190.9.187.443: Flags [.], seq 682:2040, ack 157, win 501, options [nop,nop,TS val 3815903810 ecr 3966077967], length 1358
18:45:34.285721 IP 192.168.43.126.39386 > 35.190.9.187.443: Flags [.], seq 2040:3398, ack 157, win 501, options [nop,nop,TS val 3815903810 ecr 3966077967], length 1358
18:45:34.285727 IP 192.168.43.126.39386 > 35.190.9.187.443: Flags [P.], seq 3398:3607, ack 157, win 501, options [nop,nop,TS val 3815903810 ecr 3966077967], length 209
18:45:34.344969 IP 35.190.9.187.443 > 192.168.43.126.39386: Flags [P.], seq 157:226, ack 682, win 240, options [nop,nop,TS val 3966078039 ecr 3815903809], length 69
18:45:34.345117 IP 35.190.9.187.443 > 192.168.43.126.39386: Flags [P.], seq 226:264, ack 682, win 240, options [nop,nop,TS val 3966078039 ecr 3815903809], length 38
18:45:34.345232 IP 192.168.43.126.39386 > 35.190.9.187.443: Flags [.], ack 264, win 501, options [nop,nop,TS val 3815903870 ecr 3966078039], length 0
18:45:34.345374 IP 192.168.43.126.39386 > 35.190.9.187.443: Flags [P.], seq 3607:3645, ack 264, win 501, options [nop,nop,TS val 3815903870 ecr 3966078039], length 38
18:45:34.349561 IP 35.190.9.187.443 > 192.168.43.126.39386: Flags [.], ack 3398, win 261, options [nop,nop,TS val 3966078041 ecr 3815903810], length 0
18:45:34.360630 IP 54.95.198.227.443 > 192.168.43.126.44626: Flags [.], ack 518, win 110, options [nop,nop,TS val 145547604 ecr 3646562108], length 0
18:45:34.361868 IP 54.95.198.227.443 > 192.168.43.126.44626: Flags [.], seq 1:1359, ack 518, win 110, options [nop,nop,TS val 145547604 ecr 3646562108], length 1358
18:45:34.361900 IP 192.168.43.126.44626 > 54.95.198.227.443: Flags [.], ack 1359, win 501, options [nop,nop,TS val 3646562346 ecr 145547604], length 0
18:45:34.362297 IP 54.95.198.227.443 > 192.168.43.126.44626: Flags [.], seq 1359:2717, ack 518, win 110, options [nop,nop,TS val 145547604 ecr 3646562108], length 1358
18:45:34.362355 IP 192.168.43.126.44626 > 54.95.198.227.443: Flags [.], ack 2717, win 501, options [nop,nop,TS val 3646562346 ecr 145547604], length 0
18:45:34.362454 IP 54.95.198.227.443 > 192.168.43.126.44626: Flags [P.], seq 2717:3474, ack 518, win 110, options [nop,nop,TS val 145547604 ecr 3646562108], length 757
18:45:34.362469 IP 192.168.43.126.44626 > 54.95.198.227.443: Flags [.], ack 3474, win 498, options [nop,nop,TS val 3646562346 ecr 145547604], length 0
18:45:34.366281 IP 192.168.43.126.44626 > 54.95.198.227.443: Flags [P.], seq 518:644, ack 3474, win 501, options [nop,nop,TS val 3646562350 ecr 145547604], length 126
18:45:34.366704 IP 192.168.43.126.44626 > 54.95.198.227.443: Flags [P.], seq 644:737, ack 3474, win 501, options [nop,nop,TS val 3646562350 ecr 145547604], length 93
18:45:34.367262 IP 192.168.43.126.44626 > 54.95.198.227.443: Flags [.], seq 737:2095, ack 3474, win 501, options [nop,nop,TS val 3646562351 ecr 145547604], length 1358
18:45:34.367282 IP 192.168.43.126.44626 > 54.95.198.227.443: Flags [P.], seq 2095:3080, ack 3474, win 501, options [nop,nop,TS val 3646562351 ecr 145547604], length 985
18:45:34.430767 IP 54.95.198.227.443 > 192.168.43.126.44628: Flags [.], ack 518, win 110, options [nop,nop,TS val 145547616 ecr 3646562218], length 0
18:45:34.430798 IP 35.190.9.187.443 > 192.168.43.126.39386: Flags [.], ack 3607, win 272, options [nop,nop,TS val 3966078081 ecr 3815903810], length 0
18:45:34.431408 IP 54.95.198.227.443 > 192.168.43.126.44628: Flags [.], seq 1:1359, ack 518, win 110, options [nop,nop,TS val 145547616 ecr 3646562218], length 1358
18:45:34.431472 IP 192.168.43.126.44628 > 54.95.198.227.443: Flags [.], ack 1359, win 501, options [nop,nop,TS val 3646562415 ecr 145547616], length 0
18:45:34.431540 IP 54.95.198.227.443 > 192.168.43.126.44628: Flags [.], seq 1359:2717, ack 518, win 110, options [nop,nop,TS val 145547616 ecr 3646562218], length 1358
18:45:34.431555 IP 192.168.43.126.44628 > 54.95.198.227.443: Flags [.], ack 2717, win 496, options [nop,nop,TS val 3646562415 ecr 145547616], length 0
18:45:34.431574 IP 54.95.198.227.443 > 192.168.43.126.44628: Flags [P.], seq 2717:3474, ack 518, win 110, options [nop,nop,TS val 145547616 ecr 3646562218], length 757
18:45:34.431614 IP 192.168.43.126.44628 > 54.95.198.227.443: Flags [.], ack 3474, win 491, options [nop,nop,TS val 3646562415 ecr 145547616], length 0
18:45:34.432000 IP 35.190.9.187.443 > 192.168.43.126.39386: Flags [.], ack 3645, win 272, options [nop,nop,TS val 3966078089 ecr 3815903870], length 0
18:45:34.436587 IP 192.168.43.126.44628 > 54.95.198.227.443: Flags [P.], seq 518:644, ack 3474, win 501, options [nop,nop,TS val 3646562420 ecr 145547616], length 126
18:45:34.647780 IP 54.95.198.227.443 > 192.168.43.126.44626: Flags [P.], seq 3474:3732, ack 644, win 110, options [nop,nop,TS val 145547661 ecr 3646562350], length 258
18:45:34.647824 IP 54.95.198.227.443 > 192.168.43.126.44626: Flags [P.], seq 3732:3801, ack 644, win 110, options [nop,nop,TS val 145547661 ecr 3646562350], length 69
18:45:34.647832 IP 54.95.198.227.443 > 192.168.43.126.44626: Flags [P.], seq 3801:3839, ack 737, win 110, options [nop,nop,TS val 145547671 ecr 3646562350], length 38
18:45:34.647844 IP 54.95.198.227.443 > 192.168.43.126.44626: Flags [.], ack 3080, win 131, options [nop,nop,TS val 145547674 ecr 3646562351], length 0
18:45:34.647884 IP 54.95.198.227.443 > 192.168.43.126.44626: Flags [.], seq 3839:5197, ack 3080, win 131, options [nop,nop,TS val 145547675 ecr 3646562351], length 1358
18:45:34.647945 IP 54.95.198.227.443 > 192.168.43.126.44626: Flags [P.], seq 5197:5591, ack 3080, win 131, options [nop,nop,TS val 145547675 ecr 3646562351], length 394
18:45:34.647977 IP 54.95.198.227.443 > 192.168.43.126.44626: Flags [P.], seq 5591:5629, ack 3080, win 131, options [nop,nop,TS val 145547675 ecr 3646562351], length 38
18:45:34.647956 IP 192.168.43.126.44626 > 54.95.198.227.443: Flags [.], ack 5197, win 501, options [nop,nop,TS val 3646562632 ecr 145547661], length 0
18:45:34.647985 IP 54.95.198.227.443 > 192.168.43.126.44628: Flags [P.], seq 3474:3732, ack 644, win 110, options [nop,nop,TS val 145547674 ecr 3646562420], length 258
18:45:34.648429 IP 35.190.9.187.443 > 192.168.43.126.39386: Flags [P.], seq 264:595, ack 3645, win 272, options [nop,nop,TS val 3966078319 ecr 3815903870], length 331
18:45:34.648667 IP 35.190.9.187.443 > 192.168.43.126.39386: Flags [P.], seq 595:1953, ack 3645, win 272, options [nop,nop,TS val 3966078319 ecr 3815903870], length 1358
18:45:34.648687 IP 35.190.9.187.443 > 192.168.43.126.39386: Flags [P.], seq 1953:2460, ack 3645, win 272, options [nop,nop,TS val 3966078319 ecr 3815903870], length 507
18:45:34.648699 IP 35.190.9.187.443 > 192.168.43.126.39386: Flags [P.], seq 2460:3022, ack 3645, win 272, options [nop,nop,TS val 3966078321 ecr 3815903870], length 562
18:45:34.648706 IP 35.190.9.187.443 > 192.168.43.126.39386: Flags [P.], seq 3022:3068, ack 3645, win 272, options [nop,nop,TS val 3966078321 ecr 3815903870], length 46
18:45:34.651549 IP 54.95.198.227.443 > 192.168.43.126.44628: Flags [P.], seq 3732:3801, ack 644, win 110, options [nop,nop,TS val 145547674 ecr 3646562420], length 69
18:45:34.652077 IP 192.168.43.126.39386 > 35.190.9.187.443: Flags [.], ack 3068, win 501, options [nop,nop,TS val 3815904177 ecr 3966078319], length 0
18:45:34.654426 IP 192.168.43.126.42644 > 34.203.2.172.443: Flags [.], ack 1416066550, win 501, options [nop,nop,TS val 2794153806 ecr 1099395408], length 0
18:45:34.656950 IP 192.168.43.126.44626 > 54.95.198.227.443: Flags [P.], seq 3080:3118, ack 5629, win 501, options [nop,nop,TS val 3646562641 ecr 145547675], length 38
18:45:34.658664 IP 192.168.43.126.39386 > 35.190.9.187.443: Flags [P.], seq 3645:3691, ack 3068, win 501, options [nop,nop,TS val 3815904183 ecr 3966078319], length 46
18:45:34.690411 IP 192.168.43.126.44628 > 54.95.198.227.443: Flags [.], ack 3801, win 501, options [nop,nop,TS val 3646562674 ecr 145547674], length 0
18:45:34.723902 IP 35.190.9.187.443 > 192.168.43.126.39386: Flags [.], ack 3691, win 272, options [nop,nop,TS val 3966078409 ecr 3815904183], length 0
18:45:34.739372 IP 192.168.43.126.54622 > 104.84.184.166.443: Flags [.], seq 124505657:124507015, ack 4126535384, win 501, options [nop,nop,TS val 1620702994 ecr 1150645014], length 1358
18:45:34.739395 IP 192.168.43.126.54622 > 104.84.184.166.443: Flags [.], seq 1358:2716, ack 1, win 501, options [nop,nop,TS val 1620702994 ecr 1150645014], length 1358
18:45:34.739409 IP 192.168.43.126.54622 > 104.84.184.166.443: Flags [.], seq 2716:4074, ack 1, win 501, options [nop,nop,TS val 1620702994 ecr 1150645014], length 1358
18:45:34.739414 IP 192.168.43.126.54622 > 104.84.184.166.443: Flags [.], seq 4074:5432, ack 1, win 501, options [nop,nop,TS val 1620702994 ecr 1150645014], length 1358
18:45:34.739514 IP 192.168.43.126.54622 > 104.84.184.166.443: Flags [P.], seq 5432:5907, ack 1, win 501, options [nop,nop,TS val 1620702994 ecr 1150645014], length 475
18:45:34.745858 IP 192.168.43.126.55668 > 111.221.29.254.443: Flags [.], seq 1380:2738, ack 720, win 501, options [nop,nop,TS val 1407362646 ecr 2465197197], length 1358
18:45:34.745878 IP 192.168.43.126.55668 > 111.221.29.254.443: Flags [P.], seq 2738:2793, ack 720, win 501, options [nop,nop,TS val 1407362646 ecr 2465197197], length 55
18:45:34.921659 IP 54.95.198.227.443 > 192.168.43.126.44626: Flags [.], ack 3118, win 131, options [nop,nop,TS val 145547737 ecr 3646562641], length 0
18:45:34.930957 IP 34.203.2.172.443 > 192.168.43.126.42644: Flags [.], ack 1, win 126, options [nop,nop,TS val 1099407011 ecr 2793831121], length 0
18:45:34.934498 IP 111.221.29.254.443 > 192.168.43.126.55668: Flags [.], ack 2793, win 1029, options [nop,nop,TS val 2465197941 ecr 1407362646], length 0
18:45:34.934864 IP 111.221.29.254.443 > 192.168.43.126.55668: Flags [P.], seq 720:1439, ack 2793, win 1029, options [nop,nop,TS val 2465197941 ecr 1407362646], length 719
18:45:34.934893 IP 192.168.43.126.55668 > 111.221.29.254.443: Flags [.], ack 1439, win 501, options [nop,nop,TS val 1407362835 ecr 2465197941], length 0
18:45:35.104536 IP 104.84.184.166.443 > 192.168.43.126.54622: Flags [.], ack 1358, win 437, options [nop,nop,TS val 1150673114 ecr 1620702994], length 0
18:45:35.104963 IP 104.84.184.166.443 > 192.168.43.126.54622: Flags [.], ack 2716, win 460, options [nop,nop,TS val 1150673115 ecr 1620702994], length 0
18:45:35.104984 IP 104.84.184.166.443 > 192.168.43.126.54622: Flags [.], ack 4074, win 483, options [nop,nop,TS val 1150673116 ecr 1620702994], length 0
18:45:35.104993 IP 104.84.184.166.443 > 192.168.43.126.54622: Flags [.], ack 5432, win 505, options [nop,nop,TS val 1150673117 ecr 1620702994], length 0
18:45:35.105002 IP 104.84.184.166.443 > 192.168.43.126.54622: Flags [.], ack 5907, win 526, options [nop,nop,TS val 1150673117 ecr 1620702994], length 0
18:45:35.105113 IP 104.84.184.166.443 > 192.168.43.126.54622: Flags [P.], seq 1:1179, ack 5907, win 526, options [nop,nop,TS val 1150673124 ecr 1620702994], length 1178
18:45:35.105137 IP 192.168.43.126.54622 > 104.84.184.166.443: Flags [.], ack 1179, win 501, options [nop,nop,TS val 1620703360 ecr 1150673124], length 0
18:45:35.241918 IP 192.168.43.126.54622 > 104.84.184.166.443: Flags [.], seq 5907:7265, ack 1179, win 501, options [nop,nop,TS val 1620703497 ecr 1150673124], length 1358
18:45:35.241942 IP 192.168.43.126.54622 > 104.84.184.166.443: Flags [.], seq 7265:8623, ack 1179, win 501, options [nop,nop,TS val 1620703497 ecr 1150673124], length 1358
18:45:35.241956 IP 192.168.43.126.54622 > 104.84.184.166.443: Flags [P.], seq 8623:9906, ack 1179, win 501, options [nop,nop,TS val 1620703497 ecr 1150673124], length 1283
18:45:35.310427 IP 192.168.43.126.46826 > 35.241.23.116.443: Flags [S], seq 501013934, win 64240, options [mss 1460,sackOK,TS val 1802912688 ecr 0,nop,wscale 7], length 0
18:45:35.310552 IP 192.168.43.126.33164 > 35.241.16.233.443: Flags [S], seq 4006072070, win 64240, options [mss 1460,sackOK,TS val 1467141126 ecr 0,nop,wscale 7], length 0
18:45:35.362830 IP 35.241.23.116.443 > 192.168.43.126.46826: Flags [S.], seq 1512539745, ack 501013935, win 60192, options [mss 1370,sackOK,TS val 525963105 ecr 1802912688,nop,wscale 8], length 0
18:45:35.362903 IP 192.168.43.126.46826 > 35.241.23.116.443: Flags [.], ack 1, win 502, options [nop,nop,TS val 1802912741 ecr 525963105], length 0
18:45:35.363522 IP 192.168.43.126.46826 > 35.241.23.116.443: Flags [P.], seq 1:533, ack 1, win 502, options [nop,nop,TS val 1802912741 ecr 525963105], length 532
18:45:35.366070 IP 35.241.16.233.443 > 192.168.43.126.33164: Flags [S.], seq 2151373879, ack 4006072071, win 60192, options [mss 1370,sackOK,TS val 2572504475 ecr 1467141126,nop,wscale 8], length 0
18:45:35.366142 IP 192.168.43.126.33164 > 35.241.16.233.443: Flags [.], ack 1, win 502, options [nop,nop,TS val 1467141182 ecr 2572504475], length 0
18:45:35.366850 IP 192.168.43.126.33164 > 35.241.16.233.443: Flags [P.], seq 1:539, ack 1, win 502, options [nop,nop,TS val 1467141183 ecr 2572504475], length 538
18:45:35.439093 IP 35.241.23.116.443 > 192.168.43.126.46826: Flags [.], ack 533, win 240, options [nop,nop,TS val 525963175 ecr 1802912741], length 0
18:45:35.439122 IP 35.241.23.116.443 > 192.168.43.126.46826: Flags [P.], seq 1:157, ack 533, win 240, options [nop,nop,TS val 525963176 ecr 1802912741], length 156
18:45:35.439144 IP 192.168.43.126.46826 > 35.241.23.116.443: Flags [.], ack 157, win 501, options [nop,nop,TS val 1802912817 ecr 525963176], length 0
18:45:35.439215 IP 35.241.16.233.443 > 192.168.43.126.33164: Flags [.], ack 539, win 240, options [nop,nop,TS val 2572504537 ecr 1467141183], length 0
18:45:35.439226 IP 35.241.16.233.443 > 192.168.43.126.33164: Flags [P.], seq 1:157, ack 539, win 240, options [nop,nop,TS val 2572504537 ecr 1467141183], length 156
18:45:35.439235 IP 192.168.43.126.33164 > 35.241.16.233.443: Flags [.], ack 157, win 501, options [nop,nop,TS val 1467141255 ecr 2572504537], length 0
18:45:35.442190 IP 192.168.43.126.46826 > 35.241.23.116.443: Flags [P.], seq 533:584, ack 157, win 501, options [nop,nop,TS val 1802912820 ecr 525963176], length 51
18:45:35.446803 IP 192.168.43.126.33164 > 35.241.16.233.443: Flags [P.], seq 539:590, ack 157, win 501, options [nop,nop,TS val 1467141263 ecr 2572504537], length 51
18:45:35.447020 IP 192.168.43.126.46826 > 35.241.23.116.443: Flags [P.], seq 584:677, ack 157, win 501, options [nop,nop,TS val 1802912825 ecr 525963176], length 93
18:45:35.448065 IP 192.168.43.126.46826 > 35.241.23.116.443: Flags [.], seq 677:2035, ack 157, win 501, options [nop,nop,TS val 1802912826 ecr 525963176], length 1358
18:45:35.448087 IP 192.168.43.126.46826 > 35.241.23.116.443: Flags [P.], seq 2035:3368, ack 157, win 501, options [nop,nop,TS val 1802912826 ecr 525963176], length 1333
18:45:35.448170 IP 192.168.43.126.33164 > 35.241.16.233.443: Flags [P.], seq 590:683, ack 157, win 501, options [nop,nop,TS val 1467141264 ecr 2572504537], length 93
18:45:35.458110 IP 192.168.43.126.33164 > 35.241.16.233.443: Flags [.], seq 683:2041, ack 157, win 501, options [nop,nop,TS val 1467141274 ecr 2572504537], length 1358
18:45:35.458139 IP 192.168.43.126.33164 > 35.241.16.233.443: Flags [.], seq 2041:3399, ack 157, win 501, options [nop,nop,TS val 1467141274 ecr 2572504537], length 1358
18:45:35.458163 IP 192.168.43.126.33164 > 35.241.16.233.443: Flags [P.], seq 3399:4617, ack 157, win 501, options [nop,nop,TS val 1467141274 ecr 2572504537], length 1218
18:45:35.515070 IP 35.241.23.116.443 > 192.168.43.126.46826: Flags [P.], seq 157:226, ack 584, win 240, options [nop,nop,TS val 525963255 ecr 1802912820], length 69
18:45:35.515117 IP 35.241.23.116.443 > 192.168.43.126.46826: Flags [P.], seq 226:264, ack 677, win 240, options [nop,nop,TS val 525963256 ecr 1802912825], length 38
18:45:35.515133 IP 35.241.16.233.443 > 192.168.43.126.33164: Flags [P.], seq 157:226, ack 590, win 240, options [nop,nop,TS val 2572504615 ecr 1467141263], length 69
18:45:35.515145 IP 35.241.23.116.443 > 192.168.43.126.46826: Flags [.], ack 3368, win 261, options [nop,nop,TS val 525963257 ecr 1802912826], length 0
18:45:35.515156 IP 35.241.16.233.443 > 192.168.43.126.33164: Flags [P.], seq 226:264, ack 683, win 240, options [nop,nop,TS val 2572504618 ecr 1467141264], length 38
18:45:35.515260 IP 192.168.43.126.46826 > 35.241.23.116.443: Flags [.], ack 264, win 501, options [nop,nop,TS val 1802912893 ecr 525963255], length 0
18:45:35.515402 IP 192.168.43.126.33164 > 35.241.16.233.443: Flags [.], ack 264, win 501, options [nop,nop,TS val 1467141331 ecr 2572504615], length 0
18:45:35.515492 IP 192.168.43.126.46826 > 35.241.23.116.443: Flags [P.], seq 3368:3406, ack 264, win 501, options [nop,nop,TS val 1802912893 ecr 525963255], length 38
18:45:35.515557 IP 192.168.43.126.33164 > 35.241.16.233.443: Flags [P.], seq 4617:4655, ack 264, win 501, options [nop,nop,TS val 1467141331 ecr 2572504615], length 38
