16:38:28.042306 58:00:e3:7e:0b:53 > d8:24:bd:91:5d:40, ethertype IPv4 (0x0800), length 66: 172.31.8.111.36146 > 205.185.208.52.80: Flags [.], ack 629415560, win 502, options [nop,nop,TS val 1754598774 ecr 223193317], length 0
16:38:28.043501 d8:24:bd:91:5d:40 > 58:00:e3:7e:0b:53, ethertype IPv4 (0x0800), length 66: 205.185.208.52.80 > 172.31.8.111.36146: Flags [.], ack 1, win 2896, options [nop,nop,TS val 223197831 ecr 1754553694], length 0
16:38:28.814342 58:00:e3:7e:0b:53 > d8:24:bd:91:5d:40, ethertype IPv6 (0x86dd), length 86: 2001:df0:92:0:c50f:5aca:b1f4:c6a7.58828 > 2404:6800:4002:80d::2005.443: Flags [.], ack 3374063595, win 501, options [nop,nop,TS val 2814181354 ecr 3912818039], length 0
16:38:28.936156 00:09:0f:09:00:0d > 58:00:e3:7e:0b:53, ethertype IPv6 (0x86dd), length 86: 2404:6800:4002:80d::2005.443 > 2001:df0:92:0:c50f:5aca:b1f4:c6a7.58828: Flags [.], ack 1, win 142, options [nop,nop,TS val 3912910021 ecr 2813998692], length 0
16:38:30.858273 58:00:e3:7e:0b:53 > d8:24:bd:91:5d:40, ethertype IPv6 (0x86dd), length 86: 2001:df0:92:0:c50f:5aca:b1f4:c6a7.39210 > 2404:6800:4002:807::2003.443: Flags [.], ack 2724382972, win 501, options [nop,nop,TS val 956823908 ecr 2403918741], length 0
16:38:30.858369 58:00:e3:7e:0b:53 > d8:24:bd:91:5d:40, ethertype IPv6 (0x86dd), length 86: 2001:df0:92:0:c50f:5aca:b1f4:c6a7.36034 > 2404:6800:4003:c00::bc.5228: Flags [.], ack 1707523328, win 501, options [nop,nop,TS val 3448023834 ecr 896192307], length 0
16:38:33.149669 d8:24:bd:91:5d:40 > 58:00:e3:7e:0b:53, ethertype IPv4 (0x0800), length 66: 209.197.3.15.443 > 172.31.8.111.46228: Flags [F.], seq 1315883477, ack 2891999678, win 59, options [nop,nop,TS val 152060018 ecr 1983609289], length 0
16:38:33.149713 58:00:e3:7e:0b:53 > d8:24:bd:91:5d:40, ethertype IPv4 (0x0800), length 78: 172.31.8.111.46228 > 209.197.3.15.443: Flags [.], ack 4294967233, win 501, options [nop,nop,TS val 1983669261 ecr 152045607,nop,nop,sack 1 {0:1}], length 0
16:38:33.149774 d8:24:bd:91:5d:40 > 58:00:e3:7e:0b:53, ethertype IPv4 (0x0800), length 105: 209.197.3.15.443 > 172.31.8.111.46228: Flags [P.], seq 4294967233:4294967272, ack 1, win 59, options [nop,nop,TS val 152060018 ecr 1983609289], length 39
16:38:33.149790 58:00:e3:7e:0b:53 > d8:24:bd:91:5d:40, ethertype IPv4 (0x0800), length 78: 172.31.8.111.46228 > 209.197.3.15.443: Flags [.], ack 4294967272, win 501, options [nop,nop,TS val 1983669261 ecr 152060018,nop,nop,sack 1 {0:1}], length 0
16:38:33.149808 d8:24:bd:91:5d:40 > 58:00:e3:7e:0b:53, ethertype IPv4 (0x0800), length 90: 209.197.3.15.443 > 172.31.8.111.46228: Flags [P.], seq 4294967272:0, ack 1, win 59, options [nop,nop,TS val 152060018 ecr 1983609289], length 24
16:38:33.149844 58:00:e3:7e:0b:53 > d8:24:bd:91:5d:40, ethertype IPv4 (0x0800), length 66: 172.31.8.111.46228 > 209.197.3.15.443: Flags [.], ack 1, win 501, options [nop,nop,TS val 1983669261 ecr 152060018], length 0
16:38:33.178184 d8:24:bd:91:5d:40 > 58:00:e3:7e:0b:53, ethertype IPv4 (0x0800), length 66: 209.197.3.15.443 > 172.31.8.111.46232: Flags [F.], seq 2293472374, ack 431305370, win 59, options [nop,nop,TS val 152060047 ecr 1983609317], length 0
16:38:33.178262 58:00:e3:7e:0b:53 > d8:24:bd:91:5d:40, ethertype IPv4 (0x0800), length 78: 172.31.8.111.46232 > 209.197.3.15.443: Flags [.], ack 4294967233, win 501, options [nop,nop,TS val 1983669289 ecr 152045607,nop,nop,sack 1 {0:1}], length 0
16:38:33.178345 d8:24:bd:91:5d:40 > 58:00:e3:7e:0b:53, ethertype IPv4 (0x0800), length 105: 209.197.3.15.443 > 172.31.8.111.46232: Flags [P.], seq 4294967233:4294967272, ack 1, win 59, options [nop,nop,TS val 152060046 ecr 1983609317], length 39
16:38:33.178371 58:00:e3:7e:0b:53 > d8:24:bd:91:5d:40, ethertype IPv4 (0x0800), length 78: 172.31.8.111.46232 > 209.197.3.15.443: Flags [.], ack 4294967272, win 501, options [nop,nop,TS val 1983669289 ecr 152060046,nop,nop,sack 1 {0:1}], length 0
16:38:33.178398 d8:24:bd:91:5d:40 > 58:00:e3:7e:0b:53, ethertype IPv4 (0x0800), length 90: 209.197.3.15.443 > 172.31.8.111.46232: Flags [P.], seq 4294967272:0, ack 1, win 59, options [nop,nop,TS val 152060046 ecr 1983609317], length 24
16:38:33.178444 58:00:e3:7e:0b:53 > d8:24:bd:91:5d:40, ethertype IPv4 (0x0800), length 66: 172.31.8.111.46232 > 209.197.3.15.443: Flags [.], ack 1, win 501, options [nop,nop,TS val 1983669290 ecr 152060046], length 0
16:38:34.703008 e8:ed:f3:96:e6:9d > 01:80:c2:00:00:00, 802.3, length 46: LLC, dsap STP (0x42) Individual, ssap STP (0x42) Command, ctrl 0x03: STP 802.1d, Config, Flags [Topology change], bridge-id 8001.e8:ed:f3:96:e6:80.801d, length 43
16:38:51.066096 e8:ed:f3:96:e6:9d > 01:80:c2:00:00:00, 802.3, length 46: LLC, dsap STP (0x42) Individual, ssap STP (0x42) Command, ctrl 0x03: STP 802.1d, Config, Flags [Topology change], bridge-id 8001.e8:ed:f3:96:e6:80.801d, length 43
16:38:51.066411 e8:ed:f3:96:e6:9d > 01:80:c2:00:00:00, 802.3, length 46: LLC, dsap STP (0x42) Individual, ssap STP (0x42) Command, ctrl 0x03: STP 802.1d, Config, Flags [Topology change], bridge-id 8001.e8:ed:f3:96:e6:80.801d, length 43
16:38:54.645180 e8:ed:f3:96:e6:9d > 01:80:c2:00:00:00, 802.3, length 46: LLC, dsap STP (0x42) Individual, ssap STP (0x42) Command, ctrl 0x03: STP 802.1d, Config, Flags [Topology change], bridge-id 8001.e8:ed:f3:96:e6:80.801d, length 43
16:38:56.800182 e8:ed:f3:96:e6:9d > 01:80:c2:00:00:00, 802.3, length 46: LLC, dsap STP (0x42) Individual, ssap STP (0x42) Command, ctrl 0x03: STP 802.1d, Config, Flags [Topology change], bridge-id 8001.e8:ed:f3:96:e6:80.801d, length 43
16:38:56.800494 e8:ed:f3:96:e6:9d > 01:80:c2:00:00:00, 802.3, length 46: LLC, dsap STP (0x42) Individual, ssap STP (0x42) Command, ctrl 0x03: STP 802.1d, Config, Flags [Topology change], bridge-id 8001.e8:ed:f3:96:e6:80.801d, length 43
16:38:57.562301 58:00:e3:7e:0b:53 > d8:24:bd:91:5d:40, ethertype IPv4 (0x0800), length 66: 172.31.8.111.56850 > 13.224.17.224.443: Flags [.], ack 3706524257, win 501, options [nop,nop,TS val 2384247122 ecr 607312828], length 0
16:38:57.629197 d8:24:bd:91:5d:40 > 58:00:e3:7e:0b:53, ethertype IPv4 (0x0800), length 66: 13.224.17.224.443 > 172.31.8.111.56850: Flags [.], ack 1, win 122, options [nop,nop,TS val 607317339 ecr 2384156546], length 0
16:39:01.102729 e8:ed:f3:96:e6:9d > 01:80:c2:00:00:00, 802.3, length 46: LLC, dsap STP (0x42) Individual, ssap STP (0x42) Command, ctrl 0x03: STP 802.1d, Config, Flags [Topology change], bridge-id 8001.e8:ed:f3:96:e6:80.801d, length 43
16:39:01.103039 e8:ed:f3:96:e6:9d > 01:80:c2:00:00:00, 802.3, length 46: LLC, dsap STP (0x42) Individual, ssap STP (0x42) Command, ctrl 0x03: STP 802.1d, Config, Flags [Topology change], bridge-id 8001.e8:ed:f3:96:e6:80.801d, length 43
16:39:03.742314 58:00:e3:7e:0b:53 > d8:24:bd:91:5d:40, ethertype IPv4 (0x0800), length 66: 172.31.8.111.51468 > 40.77.226.250.443: Flags [.], ack 2614821723, win 501, options [nop,nop,TS val 3466916974 ecr 2814016959], length 0
16:39:03.912667 d8:24:bd:91:5d:40 > 58:00:e3:7e:0b:53, ethertype IPv4 (0x0800), length 66: 40.77.226.250.443 > 172.31.8.111.51468: Flags [.], ack 1, win 1029, options [nop,nop,TS val 2814062042 ecr 3466826754], length 0
16:39:05.674473 58:00:e3:7e:0b:53 > d8:24:bd:91:5d:40, ethertype IPv4 (0x0800), length 54: 172.31.8.111.42210 > 104.19.197.151.443: Flags [.], ack 2240557163, win 501, length 0
16:39:06.124858 d8:24:bd:91:5d:40 > 58:00:e3:7e:0b:53, ethertype IPv4 (0x0800), length 60: 104.19.197.151.443 > 172.31.8.111.42210: Flags [.], ack 1, win 30, length 0
