02:02:06.995435 80:ad:16:cb:e4:d0 > 58:00:e3:7e:0b:53, ethertype IPv4 (0x0800), length 74: 13.35.130.56.443 > 192.168.43.126.40388: Flags [S.], seq 931746969, ack 810791420, win 28960, options [mss 1370,sackOK,TS val 1684073363 ecr 3857386401,nop,wscale 8], length 0
02:02:07.030162 80:ad:16:cb:e4:d0 > 58:00:e3:7e:0b:53, ethertype IPv6 (0x86dd), length 94: 2a03:2880:f22f:c5:face:b00c:0:167.443 > 2409:4063:4015:31fe:c50f:5aca:b1f4:c6a7.45860: Flags [S.], seq 4281112038, ack 3750152951, win 27760, options [mss 1370,sackOK,TS val 121941422 ecr 1342281281,nop,wscale 8], length 0
02:02:07.042909 58:00:e3:7e:0b:53 > 80:ad:16:cb:e4:d0, ethertype IPv4 (0x0800), length 66: 192.168.43.126.40388 > 13.35.130.56.443: Flags [.], ack 1, win 502, options [nop,nop,TS val 3857386472 ecr 1684073363], length 0
02:02:07.042938 58:00:e3:7e:0b:53 > 80:ad:16:cb:e4:d0, ethertype IPv4 (0x0800), length 583: 192.168.43.126.40388 > 13.35.130.56.443: Flags [P.], seq 1:518, ack 1, win 502, options [nop,nop,TS val 3857386472 ecr 1684073363], length 517
02:02:07.042945 58:00:e3:7e:0b:53 > 80:ad:16:cb:e4:d0, ethertype IPv6 (0x86dd), length 86: 2409:4063:4015:31fe:c50f:5aca:b1f4:c6a7.45860 > 2a03:2880:f22f:c5:face:b00c:0:167.443: Flags [.], ack 1, win 507, options [nop,nop,TS val 1342281362 ecr 121941422], length 0
02:02:07.042971 58:00:e3:7e:0b:53 > 80:ad:16:cb:e4:d0, ethertype IPv6 (0x86dd), length 603: 2409:4063:4015:31fe:c50f:5aca:b1f4:c6a7.45860 > 2a03:2880:f22f:c5:face:b00c:0:167.443: Flags [P.], seq 1:518, ack 1, win 507, options [nop,nop,TS val 1342281362 ecr 121941422], length 517
02:02:07.071736 58:00:e3:7e:0b:53 > 80:ad:16:cb:e4:d0, ethertype IPv6 (0x86dd), length 1434: 2409:4063:4015:31fe:c50f:5aca:b1f4:c6a7.47474 > 2606:4700::6810:5c34.443: Flags [.], seq 356601418:356602778, ack 2637627738, win 12525, length 1360
02:02:07.071759 58:00:e3:7e:0b:53 > 80:ad:16:cb:e4:d0, ethertype IPv6 (0x86dd), length 1434: 2409:4063:4015:31fe:c50f:5aca:b1f4:c6a7.47474 > 2606:4700::6810:5c34.443: Flags [.], seq 1360:2720, ack 1, win 12525, length 1360
02:02:07.071826 58:00:e3:7e:0b:53 > 80:ad:16:cb:e4:d0, ethertype IPv6 (0x86dd), length 133: 2409:4063:4015:31fe:c50f:5aca:b1f4:c6a7.47474 > 2606:4700::6810:5c34.443: Flags [P.], seq 2720:2779, ack 1, win 12525, length 59
02:02:07.107039 58:00:e3:7e:0b:53 > 80:ad:16:cb:e4:d0, ethertype IPv6 (0x86dd), length 1434: 2409:4063:4015:31fe:c50f:5aca:b1f4:c6a7.47474 > 2606:4700::6810:5c34.443: Flags [.], seq 2779:4139, ack 1, win 12525, length 1360
02:02:07.107061 58:00:e3:7e:0b:53 > 80:ad:16:cb:e4:d0, ethertype IPv6 (0x86dd), length 1434: 2409:4063:4015:31fe:c50f:5aca:b1f4:c6a7.47474 > 2606:4700::6810:5c34.443: Flags [.], seq 4139:5499, ack 1, win 12525, length 1360
02:02:07.107146 58:00:e3:7e:0b:53 > 80:ad:16:cb:e4:d0, ethertype IPv6 (0x86dd), length 111: 2409:4063:4015:31fe:c50f:5aca:b1f4:c6a7.47474 > 2606:4700::6810:5c34.443: Flags [P.], seq 5499:5536, ack 1, win 12525, length 37
02:02:07.112475 80:ad:16:cb:e4:d0 > 58:00:e3:7e:0b:53, ethertype IPv4 (0x0800), length 66: 13.35.130.56.443 > 192.168.43.126.40388: Flags [.], ack 518, win 118, options [nop,nop,TS val 1684073375 ecr 3857386472], length 0
02:02:07.113798 80:ad:16:cb:e4:d0 > 58:00:e3:7e:0b:53, ethertype IPv4 (0x0800), length 171: 13.35.130.56.443 > 192.168.43.126.40388: Flags [P.], seq 1:106, ack 518, win 118, options [nop,nop,TS val 1684073375 ecr 3857386472], length 105
02:02:07.113815 58:00:e3:7e:0b:53 > 80:ad:16:cb:e4:d0, ethertype IPv4 (0x0800), length 66: 192.168.43.126.40388 > 13.35.130.56.443: Flags [.], ack 106, win 502, options [nop,nop,TS val 3857386590 ecr 1684073375], length 0
02:02:07.184345 80:ad:16:cb:e4:d0 > 58:00:e3:7e:0b:53, ethertype IPv4 (0x0800), length 117: 13.35.130.56.443 > 192.168.43.126.40388: Flags [P.], seq 106:157, ack 518, win 118, options [nop,nop,TS val 1684073382 ecr 3857386590], length 51
02:02:07.184364 58:00:e3:7e:0b:53 > 80:ad:16:cb:e4:d0, ethertype IPv4 (0x0800), length 66: 192.168.43.126.40388 > 13.35.130.56.443: Flags [.], ack 157, win 502, options [nop,nop,TS val 3857386661 ecr 1684073382], length 0
02:02:07.184523 58:00:e3:7e:0b:53 > 80:ad:16:cb:e4:d0, ethertype IPv4 (0x0800), length 117: 192.168.43.126.40388 > 13.35.130.56.443: Flags [P.], seq 518:569, ack 157, win 502, options [nop,nop,TS val 3857386661 ecr 1684073382], length 51
02:02:07.184776 58:00:e3:7e:0b:53 > 80:ad:16:cb:e4:d0, ethertype IPv4 (0x0800), length 159: 192.168.43.126.40388 > 13.35.130.56.443: Flags [P.], seq 569:662, ack 157, win 502, options [nop,nop,TS val 3857386661 ecr 1684073382], length 93
02:02:07.185022 58:00:e3:7e:0b:53 > 80:ad:16:cb:e4:d0, ethertype IPv4 (0x0800), length 356: 192.168.43.126.40388 > 13.35.130.56.443: Flags [P.], seq 662:952, ack 157, win 502, options [nop,nop,TS val 3857386662 ecr 1684073382], length 290
02:02:07.210240 80:ad:16:cb:e4:d0 > 58:00:e3:7e:0b:53, ethertype IPv6 (0x86dd), length 74: 2606:4700::6810:5c34.443 > 2409:4063:4015:31fe:c50f:5aca:b1f4:c6a7.47474: Flags [.], ack 1360, win 286, length 0
02:02:07.211448 80:ad:16:cb:e4:d0 > 58:00:e3:7e:0b:53, ethertype IPv6 (0x86dd), length 74: 2606:4700::6810:5c34.443 > 2409:4063:4015:31fe:c50f:5aca:b1f4:c6a7.47474: Flags [.], ack 2720, win 288, length 0
02:02:07.212288 80:ad:16:cb:e4:d0 > 58:00:e3:7e:0b:53, ethertype IPv6 (0x86dd), length 74: 2606:4700::6810:5c34.443 > 2409:4063:4015:31fe:c50f:5aca:b1f4:c6a7.47474: Flags [.], ack 2779, win 288, length 0
02:02:07.352791 58:00:e3:7e:0b:53 > 80:ad:16:cb:e4:d0, ethertype IPv4 (0x0800), length 356: 192.168.43.126.40388 > 13.35.130.56.443: Flags [P.], seq 662:952, ack 157, win 502, options [nop,nop,TS val 3857386829 ecr 1684073382], length 290
02:02:07.374803 58:00:e3:7e:0b:53 > 80:ad:16:cb:e4:d0, ethertype IPv4 (0x0800), length 145: 192.168.43.126.33020 > 151.101.154.110.443: Flags [P.], seq 3702524109:3702524188, ack 575052124, win 501, options [nop,nop,TS val 4089367667 ecr 1641556976], length 79
02:02:07.374886 58:00:e3:7e:0b:53 > 80:ad:16:cb:e4:d0, ethertype IPv4 (0x0800), length 112: 192.168.43.126.33020 > 151.101.154.110.443: Flags [P.], seq 79:125, ack 1, win 501, options [nop,nop,TS val 4089367667 ecr 1641556976], length 46
02:02:07.404789 58:00:e3:7e:0b:53 > 80:ad:16:cb:e4:d0, ethertype IPv6 (0x86dd), length 603: 2409:4063:4015:31fe:c50f:5aca:b1f4:c6a7.45860 > 2a03:2880:f22f:c5:face:b00c:0:167.443: Flags [P.], seq 1:518, ack 1, win 507, options [nop,nop,TS val 1342281736 ecr 121941422], length 517
02:02:07.413995 80:ad:16:cb:e4:d0 > 58:00:e3:7e:0b:53, ethertype IPv4 (0x0800), length 78: 13.35.130.56.443 > 192.168.43.126.40388: Flags [.], ack 952, win 122, options [nop,nop,TS val 1684073405 ecr 3857386829,nop,nop,sack 1 {662:952}], length 0
02:02:07.427060 58:00:e3:7e:0b:53 > 80:ad:16:cb:e4:d0, ethertype IPv6 (0x86dd), length 144: 2409:4063:4015:31fe:c50f:5aca:b1f4:c6a7.56070 > 2606:4700:30::6812:3d08.443: Flags [P.], seq 93433352:93433422, ack 2956174952, win 501, length 70
02:02:07.427148 58:00:e3:7e:0b:53 > 80:ad:16:cb:e4:d0, ethertype IPv6 (0x86dd), length 278: 2409:4063:4015:31fe:c50f:5aca:b1f4:c6a7.56070 > 2606:4700:30::6812:3d08.443: Flags [P.], seq 70:274, ack 1, win 501, length 204
02:02:07.432660 80:ad:16:cb:e4:d0 > 58:00:e3:7e:0b:53, ethertype IPv6 (0x86dd), length 289: 2a03:2880:f22f:c5:face:b00c:0:167.443 > 2409:4063:4015:31fe:c50f:5aca:b1f4:c6a7.45860: Flags [P.], seq 1:204, ack 518, win 113, options [nop,nop,TS val 121941825 ecr 1342281362], length 203
02:02:07.432702 58:00:e3:7e:0b:53 > 80:ad:16:cb:e4:d0, ethertype IPv6 (0x86dd), length 86: 2409:4063:4015:31fe:c50f:5aca:b1f4:c6a7.45860 > 2a03:2880:f22f:c5:face:b00c:0:167.443: Flags [.], ack 204, win 506, options [nop,nop,TS val 1342281764 ecr 121941825], length 0
02:02:07.434186 58:00:e3:7e:0b:53 > 80:ad:16:cb:e4:d0, ethertype IPv6 (0x86dd), length 150: 2409:4063:4015:31fe:c50f:5aca:b1f4:c6a7.45860 > 2a03:2880:f22f:c5:face:b00c:0:167.443: Flags [P.], seq 518:582, ack 204, win 506, options [nop,nop,TS val 1342281766 ecr 121941825], length 64
02:02:07.434530 58:00:e3:7e:0b:53 > 80:ad:16:cb:e4:d0, ethertype IPv6 (0x86dd), length 608: 2409:4063:4015:31fe:c50f:5aca:b1f4:c6a7.45860 > 2a03:2880:f22f:c5:face:b00c:0:167.443: Flags [P.], seq 582:1104, ack 204, win 506, options [nop,nop,TS val 1342281766 ecr 121941825], length 522
02:02:07.466657 80:ad:16:cb:e4:d0 > 58:00:e3:7e:0b:53, ethertype IPv4 (0x0800), length 66: 151.101.154.110.443 > 192.168.43.126.33020: Flags [.], ack 79, win 61, options [nop,nop,TS val 1641557161 ecr 4089367667], length 0
02:02:07.466942 80:ad:16:cb:e4:d0 > 58:00:e3:7e:0b:53, ethertype IPv4 (0x0800), length 66: 151.101.154.110.443 > 192.168.43.126.33020: Flags [.], ack 125, win 61, options [nop,nop,TS val 1641557161 ecr 4089367667], length 0
02:02:07.466968 80:ad:16:cb:e4:d0 > 58:00:e3:7e:0b:53, ethertype IPv4 (0x0800), length 112: 151.101.154.110.443 > 192.168.43.126.33020: Flags [P.], seq 1:47, ack 125, win 61, options [nop,nop,TS val 1641557161 ecr 4089367667], length 46
02:02:07.466980 80:ad:16:cb:e4:d0 > 58:00:e3:7e:0b:53, ethertype IPv4 (0x0800), length 270: 151.101.154.110.443 > 192.168.43.126.33020: Flags [P.], seq 47:251, ack 125, win 61, options [nop,nop,TS val 1641557161 ecr 4089367667], length 204
02:02:07.467042 58:00:e3:7e:0b:53 > 80:ad:16:cb:e4:d0, ethertype IPv4 (0x0800), length 66: 192.168.43.126.33020 > 151.101.154.110.443: Flags [.], ack 251, win 501, options [nop,nop,TS val 4089367760 ecr 1641557161], length 0
02:02:07.467441 58:00:e3:7e:0b:53 > 80:ad:16:cb:e4:d0, ethertype IPv4 (0x0800), length 108: 192.168.43.126.33020 > 151.101.154.110.443: Flags [P.], seq 125:167, ack 251, win 501, options [nop,nop,TS val 4089367760 ecr 1641557161], length 42
02:02:07.491622 80:ad:16:cb:e4:d0 > 58:00:e3:7e:0b:53, ethertype IPv6 (0x86dd), length 86: 2a03:2880:f22f:c5:face:b00c:0:167.443 > 2409:4063:4015:31fe:c50f:5aca:b1f4:c6a7.45860: Flags [.], ack 518, win 113, options [nop,nop,TS val 121941882 ecr 1342281736], length 0
02:02:07.521739 80:ad:16:cb:e4:d0 > 58:00:e3:7e:0b:53, ethertype IPv6 (0x86dd), length 86: 2a03:2880:f22f:c5:face:b00c:0:167.443 > 2409:4063:4015:31fe:c50f:5aca:b1f4:c6a7.45860: Flags [.], ack 582, win 113, options [nop,nop,TS val 121941913 ecr 1342281766], length 0
02:02:07.522282 80:ad:16:cb:e4:d0 > 58:00:e3:7e:0b:53, ethertype IPv6 (0x86dd), length 86: 2a03:2880:f22f:c5:face:b00c:0:167.443 > 2409:4063:4015:31fe:c50f:5aca:b1f4:c6a7.45860: Flags [.], ack 1104, win 117, options [nop,nop,TS val 121941913 ecr 1342281766], length 0
02:02:07.522294 80:ad:16:cb:e4:d0 > 58:00:e3:7e:0b:53, ethertype IPv6 (0x86dd), length 241: 2a03:2880:f22f:c5:face:b00c:0:167.443 > 2409:4063:4015:31fe:c50f:5aca:b1f4:c6a7.45860: Flags [P.], seq 204:359, ack 1104, win 117, options [nop,nop,TS val 121941913 ecr 1342281766], length 155
02:02:07.523540 58:00:e3:7e:0b:53 > 80:ad:16:cb:e4:d0, ethertype IPv4 (0x0800), length 145: 192.168.43.126.56972 > 35.186.220.184.443: Flags [P.], seq 1950972813:1950972892, ack 1390123470, win 501, options [nop,nop,TS val 1071242576 ecr 1824347611], length 79
02:02:07.523621 58:00:e3:7e:0b:53 > 80:ad:16:cb:e4:d0, ethertype IPv4 (0x0800), length 555: 192.168.43.126.56972 > 35.186.220.184.443: Flags [P.], seq 79:568, ack 1, win 501, options [nop,nop,TS val 1071242576 ecr 1824347611], length 489
02:02:07.528174 80:ad:16:cb:e4:d0 > 58:00:e3:7e:0b:53, ethertype IPv6 (0x86dd), length 1434: 2606:4700::6810:5c34.443 > 2409:4063:4015:31fe:c50f:5aca:b1f4:c6a7.47474: Flags [.], seq 1:1361, ack 5536, win 294, length 1360
02:02:07.603344 80:ad:16:cb:e4:d0 > 58:00:e3:7e:0b:53, ethertype IPv4 (0x0800), length 66: 151.101.154.110.443 > 192.168.43.126.33020: Flags [.], ack 167, win 61, options [nop,nop,TS val 1641557195 ecr 4089367760], length 0
02:02:07.610903 58:00:e3:7e:0b:53 > 80:ad:16:cb:e4:d0, ethertype IPv6 (0x86dd), length 86: 2409:4063:4015:31fe:c50f:5aca:b1f4:c6a7.45860 > 2a03:2880:f22f:c5:face:b00c:0:167.443: Flags [.], ack 359, win 505, options [nop,nop,TS val 1342281896 ecr 121941913], length 0
02:02:07.610930 58:00:e3:7e:0b:53 > 80:ad:16:cb:e4:d0, ethertype IPv6 (0x86dd), length 74: 2409:4063:4015:31fe:c50f:5aca:b1f4:c6a7.47474 > 2606:4700::6810:5c34.443: Flags [.], ack 1361, win 12547, length 0
02:02:07.684807 58:00:e3:7e:0b:53 > 80:ad:16:cb:e4:d0, ethertype IPv4 (0x0800), length 555: 192.168.43.126.56972 > 35.186.220.184.443: Flags [P.], seq 79:568, ack 1, win 501, options [nop,nop,TS val 1071242737 ecr 1824347611], length 489
02:02:07.724847 58:00:e3:7e:0b:53 > 80:ad:16:cb:e4:d0, ethertype IPv6 (0x86dd), length 278: 2409:4063:4015:31fe:c50f:5aca:b1f4:c6a7.56070 > 2606:4700:30::6812:3d08.443: Flags [P.], seq 70:274, ack 1, win 501, length 204
02:02:07.729066 80:ad:16:cb:e4:d0 > 58:00:e3:7e:0b:53, ethertype IPv6 (0x86dd), length 300: 2a03:2880:f22f:c5:face:b00c:0:167.443 > 2409:4063:4015:31fe:c50f:5aca:b1f4:c6a7.45860: Flags [P.], seq 359:573, ack 1104, win 117, options [nop,nop,TS val 121942119 ecr 1342281896], length 214
02:02:07.729082 58:00:e3:7e:0b:53 > 80:ad:16:cb:e4:d0, ethertype IPv6 (0x86dd), length 86: 2409:4063:4015:31fe:c50f:5aca:b1f4:c6a7.45860 > 2a03:2880:f22f:c5:face:b00c:0:167.443: Flags [.], ack 573, win 504, options [nop,nop,TS val 1342282061 ecr 121942119], length 0
02:02:07.752921 80:ad:16:cb:e4:d0 > 58:00:e3:7e:0b:53, ethertype IPv4 (0x0800), length 78: 35.186.220.184.443 > 192.168.43.126.56972: Flags [.], ack 568, win 265, options [nop,nop,TS val 1824352291 ecr 1071242737,nop,nop,sack 1 {79:568}], length 0
02:02:07.754079 80:ad:16:cb:e4:d0 > 58:00:e3:7e:0b:53, ethertype IPv4 (0x0800), length 244: 35.186.220.184.443 > 192.168.43.126.56972: Flags [P.], seq 1:179, ack 568, win 265, options [nop,nop,TS val 1824352293 ecr 1071242737], length 178
02:02:07.755176 80:ad:16:cb:e4:d0 > 58:00:e3:7e:0b:53, ethertype IPv4 (0x0800), length 221: 35.186.220.184.443 > 192.168.43.126.56972: Flags [P.], seq 179:334, ack 568, win 265, options [nop,nop,TS val 1824352293 ecr 1071242737], length 155
02:02:07.755230 58:00:e3:7e:0b:53 > 80:ad:16:cb:e4:d0, ethertype IPv4 (0x0800), length 66: 192.168.43.126.56972 > 35.186.220.184.443: Flags [.], ack 334, win 501, options [nop,nop,TS val 1071242808 ecr 1824352293], length 0
02:02:07.757677 80:ad:16:cb:e4:d0 > 58:00:e3:7e:0b:53, ethertype IPv4 (0x0800), length 112: 35.186.220.184.443 > 192.168.43.126.56972: Flags [P.], seq 334:380, ack 568, win 265, options [nop,nop,TS val 1824352293 ecr 1071242737], length 46
02:02:07.758027 58:00:e3:7e:0b:53 > 80:ad:16:cb:e4:d0, ethertype IPv4 (0x0800), length 112: 192.168.43.126.56972 > 35.186.220.184.443: Flags [P.], seq 568:614, ack 380, win 501, options [nop,nop,TS val 1071242811 ecr 1824352293], length 46
02:02:07.795880 80:ad:16:cb:e4:d0 > 58:00:e3:7e:0b:53, ethertype IPv6 (0x86dd), length 183: 2606:4700:30::6812:3d08.443 > 2409:4063:4015:31fe:c50f:5aca:b1f4:c6a7.56070: Flags [P.], seq 1:110, ack 274, win 104, length 109
02:02:07.795904 58:00:e3:7e:0b:53 > 80:ad:16:cb:e4:d0, ethertype IPv6 (0x86dd), length 74: 2409:4063:4015:31fe:c50f:5aca:b1f4:c6a7.56070 > 2606:4700:30::6812:3d08.443: Flags [.], ack 110, win 501, length 0
02:02:07.796086 80:ad:16:cb:e4:d0 > 58:00:e3:7e:0b:53, ethertype IPv6 (0x86dd), length 105: 2606:4700:30::6812:3d08.443 > 2409:4063:4015:31fe:c50f:5aca:b1f4:c6a7.56070: Flags [P.], seq 110:141, ack 274, win 104, length 31
02:02:07.796093 58:00:e3:7e:0b:53 > 80:ad:16:cb:e4:d0, ethertype IPv6 (0x86dd), length 74: 2409:4063:4015:31fe:c50f:5aca:b1f4:c6a7.56070 > 2606:4700:30::6812:3d08.443: Flags [.], ack 141, win 501, length 0
02:02:07.920395 80:ad:16:cb:e4:d0 > 58:00:e3:7e:0b:53, ethertype IPv4 (0x0800), length 135: 13.35.130.56.443 > 192.168.43.126.40388: Flags [P.], seq 157:226, ack 952, win 122, options [nop,nop,TS val 1684073456 ecr 3857386829], length 69
02:02:07.920704 58:00:e3:7e:0b:53 > 80:ad:16:cb:e4:d0, ethertype IPv4 (0x0800), length 104: 192.168.43.126.40388 > 13.35.130.56.443: Flags [P.], seq 952:990, ack 226, win 502, options [nop,nop,TS val 3857387397 ecr 1684073456], length 38
02:02:07.978630 80:ad:16:cb:e4:d0 > 58:00:e3:7e:0b:53, ethertype IPv4 (0x0800), length 104: 13.35.130.56.443 > 192.168.43.126.40388: Flags [P.], seq 226:264, ack 990, win 122, options [nop,nop,TS val 1684073462 ecr 3857387397], length 38
02:02:07.978700 80:ad:16:cb:e4:d0 > 58:00:e3:7e:0b:53, ethertype IPv4 (0x0800), length 402: 13.35.130.56.443 > 192.168.43.126.40388: Flags [P.], seq 264:600, ack 990, win 122, options [nop,nop,TS val 1684073462 ecr 3857387397], length 336
02:02:07.980690 58:00:e3:7e:0b:53 > 80:ad:16:cb:e4:d0, ethertype IPv4 (0x0800), length 66: 192.168.43.126.40388 > 13.35.130.56.443: Flags [.], ack 600, win 501, options [nop,nop,TS val 3857387457 ecr 1684073462], length 0
02:02:07.984313 58:00:e3:7e:0b:53 > 80:ad:16:cb:e4:d0, ethertype IPv4 (0x0800), length 108: 192.168.43.126.40388 > 13.35.130.56.443: Flags [P.], seq 990:1032, ack 600, win 501, options [nop,nop,TS val 3857387461 ecr 1684073462], length 42
02:02:08.031047 80:ad:16:cb:e4:d0 > 58:00:e3:7e:0b:53, ethertype IPv6 (0x86dd), length 105: 2606:4700::6810:5c34.443 > 2409:4063:4015:31fe:c50f:5aca:b1f4:c6a7.47474: Flags [P.], seq 2080:2111, ack 5536, win 294, length 31
02:02:08.031073 58:00:e3:7e:0b:53 > 80:ad:16:cb:e4:d0, ethertype IPv6 (0x86dd), length 86: 2409:4063:4015:31fe:c50f:5aca:b1f4:c6a7.47474 > 2606:4700::6810:5c34.443: Flags [.], ack 1361, win 12547, options [nop,nop,sack 1 {2080:2111}], length 0
02:02:08.044787 58:00:e3:7e:0b:53 > 80:ad:16:cb:e4:d0, ethertype IPv4 (0x0800), length 112: 192.168.43.126.56972 > 35.186.220.184.443: Flags [P.], seq 568:614, ack 380, win 501, options [nop,nop,TS val 1071243097 ecr 1824352293], length 46
02:02:08.268788 58:00:e3:7e:0b:53 > 80:ad:16:cb:e4:d0, ethertype IPv4 (0x0800), length 108: 192.168.43.126.40388 > 13.35.130.56.443: Flags [P.], seq 990:1032, ack 600, win 501, options [nop,nop,TS val 3857387745 ecr 1684073462], length 42
02:02:08.332629 80:ad:16:cb:e4:d0 > 58:00:e3:7e:0b:53, ethertype IPv4 (0x0800), length 78: 13.35.130.56.443 > 192.168.43.126.40388: Flags [.], ack 1032, win 122, options [nop,nop,TS val 1684073497 ecr 3857387745,nop,nop,sack 1 {990:1032}], length 0
02:02:08.332787 58:00:e3:7e:0b:53 > 80:ad:16:cb:e4:d0, ethertype IPv4 (0x0800), length 112: 192.168.43.126.56972 > 35.186.220.184.443: Flags [P.], seq 568:614, ack 380, win 501, options [nop,nop,TS val 1071243385 ecr 1824352293], length 46
02:02:08.358991 58:00:e3:7e:0b:53 > 80:ad:16:cb:e4:d0, ethertype IPv4 (0x0800), length 171: 192.168.43.126.54722 > 199.232.22.2.443: Flags [P.], seq 1455079010:1455079115, ack 98392493, win 501, options [nop,nop,TS val 290128819 ecr 302477587], length 105
02:02:08.359069 58:00:e3:7e:0b:53 > 80:ad:16:cb:e4:d0, ethertype IPv4 (0x0800), length 112: 192.168.43.126.54722 > 199.232.22.2.443: Flags [P.], seq 105:151, ack 1, win 501, options [nop,nop,TS val 290128819 ecr 302477587], length 46
02:02:08.363038 58:00:e3:7e:0b:53 > 80:ad:16:cb:e4:d0, ethertype IPv6 (0x86dd), length 214: 2409:4063:4015:31fe:c50f:5aca:b1f4:c6a7.45860 > 2a03:2880:f22f:c5:face:b00c:0:167.443: Flags [P.], seq 1104:1232, ack 573, win 504, options [nop,nop,TS val 1342282695 ecr 121942119], length 128
02:02:08.379788 58:00:e3:7e:0b:53 > 80:ad:16:cb:e4:d0, ethertype IPv6 (0x86dd), length 318: 2409:4063:4015:31fe:c50f:5aca:b1f4:c6a7.45860 > 2a03:2880:f22f:c5:face:b00c:0:167.443: Flags [P.], seq 1232:1464, ack 573, win 504, options [nop,nop,TS val 1342282711 ecr 121942119], length 232
02:02:08.462577 80:ad:16:cb:e4:d0 > 58:00:e3:7e:0b:53, ethertype IPv6 (0x86dd), length 86: 2a03:2880:f22f:c5:face:b00c:0:167.443 > 2409:4063:4015:31fe:c50f:5aca:b1f4:c6a7.45860: Flags [.], ack 1464, win 126, options [nop,nop,TS val 121942852 ecr 1342282695], length 0
02:02:08.467565 80:ad:16:cb:e4:d0 > 58:00:e3:7e:0b:53, ethertype IPv4 (0x0800), length 66: 199.232.22.2.443 > 192.168.43.126.54722: Flags [.], ack 105, win 63, options [nop,nop,TS val 302489262 ecr 290128819], length 0
02:02:08.471355 80:ad:16:cb:e4:d0 > 58:00:e3:7e:0b:53, ethertype IPv4 (0x0800), length 66: 199.232.22.2.443 > 192.168.43.126.54722: Flags [.], ack 151, win 63, options [nop,nop,TS val 302489262 ecr 290128819], length 0
02:02:08.471371 80:ad:16:cb:e4:d0 > 58:00:e3:7e:0b:53, ethertype IPv4 (0x0800), length 112: 199.232.22.2.443 > 192.168.43.126.54722: Flags [P.], seq 1:47, ack 151, win 63, options [nop,nop,TS val 302489262 ecr 290128819], length 46
02:02:08.471383 58:00:e3:7e:0b:53 > 80:ad:16:cb:e4:d0, ethertype IPv4 (0x0800), length 66: 192.168.43.126.54722 > 199.232.22.2.443: Flags [.], ack 47, win 501, options [nop,nop,TS val 290128931 ecr 302489262], length 0
02:02:08.553355 80:ad:16:cb:e4:d0 > 58:00:e3:7e:0b:53, ethertype IPv6 (0x86dd), length 793: 2606:4700::6810:5c34.443 > 2409:4063:4015:31fe:c50f:5aca:b1f4:c6a7.47474: Flags [P.], seq 1361:2080, ack 5536, win 294, length 719
02:02:08.553376 58:00:e3:7e:0b:53 > 80:ad:16:cb:e4:d0, ethertype IPv6 (0x86dd), length 74: 2409:4063:4015:31fe:c50f:5aca:b1f4:c6a7.47474 > 2606:4700::6810:5c34.443: Flags [.], ack 2111, win 12547, length 0
02:02:08.553418 80:ad:16:cb:e4:d0 > 58:00:e3:7e:0b:53, ethertype IPv4 (0x0800), length 283: 199.232.22.2.443 > 192.168.43.126.54722: Flags [P.], seq 47:264, ack 151, win 63, options [nop,nop,TS val 302489280 ecr 290128819], length 217
02:02:08.553448 58:00:e3:7e:0b:53 > 80:ad:16:cb:e4:d0, ethertype IPv4 (0x0800), length 66: 192.168.43.126.54722 > 199.232.22.2.443: Flags [.], ack 264, win 501, options [nop,nop,TS val 290129013 ecr 302489280], length 0
02:02:08.654093 80:ad:16:cb:e4:d0 > 58:00:e3:7e:0b:53, ethertype IPv6 (0x86dd), length 276: 2a03:2880:f22f:c5:face:b00c:0:167.443 > 2409:4063:4015:31fe:c50f:5aca:b1f4:c6a7.45860: Flags [P.], seq 573:763, ack 1464, win 126, options [nop,nop,TS val 121943038 ecr 1342282695], length 190
02:02:08.654117 58:00:e3:7e:0b:53 > 80:ad:16:cb:e4:d0, ethertype IPv6 (0x86dd), length 86: 2409:4063:4015:31fe:c50f:5aca:b1f4:c6a7.45860 > 2a03:2880:f22f:c5:face:b00c:0:167.443: Flags [.], ack 763, win 503, options [nop,nop,TS val 1342282986 ecr 121943038], length 0
02:02:08.827564 58:00:e3:7e:0b:53 > 80:ad:16:cb:e4:d0, ethertype IPv4 (0x0800), length 74: 192.168.43.126.57562 > 13.35.130.69.443: Flags [S], seq 1623438648, win 64240, options [mss 1460,sackOK,TS val 2886910310 ecr 0,nop,wscale 7], length 0
02:02:08.893238 80:ad:16:cb:e4:d0 > 58:00:e3:7e:0b:53, ethertype IPv4 (0x0800), length 74: 13.35.130.69.443 > 192.168.43.126.57562: Flags [S.], seq 4273167119, ack 1623438649, win 28960, options [mss 1370,sackOK,TS val 1684076452 ecr 2886910310,nop,wscale 8], length 0
02:02:08.893276 58:00:e3:7e:0b:53 > 80:ad:16:cb:e4:d0, ethertype IPv4 (0x0800), length 66: 192.168.43.126.57562 > 13.35.130.69.443: Flags [.], ack 1, win 502, options [nop,nop,TS val 2886910376 ecr 1684076452], length 0
02:02:08.893550 58:00:e3:7e:0b:53 > 80:ad:16:cb:e4:d0, ethertype IPv4 (0x0800), length 583: 192.168.43.126.57562 > 13.35.130.69.443: Flags [P.], seq 1:518, ack 1, win 502, options [nop,nop,TS val 2886910376 ecr 1684076452], length 517
02:02:08.908788 58:00:e3:7e:0b:53 > 80:ad:16:cb:e4:d0, ethertype IPv4 (0x0800), length 112: 192.168.43.126.56972 > 35.186.220.184.443: Flags [P.], seq 568:614, ack 380, win 501, options [nop,nop,TS val 1071243961 ecr 1824352293], length 46
02:02:09.034909 58:00:e3:7e:0b:53 > 80:ad:16:cb:e4:d0, ethertype IPv6 (0x86dd), length 135: 2409:4063:4015:31fe:c50f:5aca:b1f4:c6a7.35988 > 2606:4700::6810:ea09.443: Flags [P.], seq 566065463:566065524, ack 2788640465, win 501, length 61
02:02:09.034937 58:00:e3:7e:0b:53 > 80:ad:16:cb:e4:d0, ethertype IPv6 (0x86dd), length 1309: 2409:4063:4015:31fe:c50f:5aca:b1f4:c6a7.35988 > 2606:4700::6810:ea09.443: Flags [P.], seq 61:1296, ack 1, win 501, length 1235
02:02:09.161010 80:ad:16:cb:e4:d0 > 58:00:e3:7e:0b:53, ethertype IPv6 (0x86dd), length 74: 2606:4700::6810:ea09.443 > 2409:4063:4015:31fe:c50f:5aca:b1f4:c6a7.35988: Flags [.], ack 61, win 32, length 0
02:02:09.166044 80:ad:16:cb:e4:d0 > 58:00:e3:7e:0b:53, ethertype IPv6 (0x86dd), length 74: 2606:4700::6810:ea09.443 > 2409:4063:4015:31fe:c50f:5aca:b1f4:c6a7.35988: Flags [.], ack 1296, win 34, length 0
02:02:09.166185 80:ad:16:cb:e4:d0 > 58:00:e3:7e:0b:53, ethertype IPv6 (0x86dd), length 113: 2606:4700::6810:ea09.443 > 2409:4063:4015:31fe:c50f:5aca:b1f4:c6a7.35988: Flags [P.], seq 1:40, ack 1296, win 34, length 39
02:02:09.166211 58:00:e3:7e:0b:53 > 80:ad:16:cb:e4:d0, ethertype IPv6 (0x86dd), length 74: 2409:4063:4015:31fe:c50f:5aca:b1f4:c6a7.35988 > 2606:4700::6810:ea09.443: Flags [.], ack 40, win 501, length 0
02:02:09.184308 80:ad:16:cb:e4:d0 > 58:00:e3:7e:0b:53, ethertype IPv6 (0x86dd), length 1010: 2a03:2880:f22f:c5:face:b00c:0:167.443 > 2409:4063:4015:31fe:c50f:5aca:b1f4:c6a7.45860: Flags [P.], seq 763:1687, ack 1464, win 126, options [nop,nop,TS val 121943565 ecr 1342282986], length 924
02:02:09.184327 58:00:e3:7e:0b:53 > 80:ad:16:cb:e4:d0, ethertype IPv6 (0x86dd), length 86: 2409:4063:4015:31fe:c50f:5aca:b1f4:c6a7.45860 > 2a03:2880:f22f:c5:face:b00c:0:167.443: Flags [.], ack 1687, win 501, options [nop,nop,TS val 1342283516 ecr 121943565], length 0
02:02:09.187374 80:ad:16:cb:e4:d0 > 58:00:e3:7e:0b:53, ethertype IPv6 (0x86dd), length 230: 2a03:2880:f22f:c5:face:b00c:0:167.443 > 2409:4063:4015:31fe:c50f:5aca:b1f4:c6a7.45860: Flags [P.], seq 1687:1831, ack 1464, win 126, options [nop,nop,TS val 121943565 ecr 1342282986], length 144
02:02:09.187406 58:00:e3:7e:0b:53 > 80:ad:16:cb:e4:d0, ethertype IPv6 (0x86dd), length 86: 2409:4063:4015:31fe:c50f:5aca:b1f4:c6a7.45860 > 2a03:2880:f22f:c5:face:b00c:0:167.443: Flags [.], ack 1831, win 501, options [nop,nop,TS val 1342283519 ecr 121943565], length 0
02:02:09.187507 80:ad:16:cb:e4:d0 > 58:00:e3:7e:0b:53, ethertype IPv6 (0x86dd), length 139: 2a03:2880:f22f:c5:face:b00c:0:167.443 > 2409:4063:4015:31fe:c50f:5aca:b1f4:c6a7.45860: Flags [P.], seq 1831:1884, ack 1464, win 126, options [nop,nop,TS val 121943565 ecr 1342282986], length 53
02:02:09.187536 58:00:e3:7e:0b:53 > 80:ad:16:cb:e4:d0, ethertype IPv6 (0x86dd), length 86: 2409:4063:4015:31fe:c50f:5aca:b1f4:c6a7.45860 > 2a03:2880:f22f:c5:face:b00c:0:167.443: Flags [.], ack 1884, win 501, options [nop,nop,TS val 1342283519 ecr 121943565], length 0
02:02:09.187582 58:00:e3:7e:0b:53 > 80:ad:16:cb:e4:d0, ethertype IPv4 (0x0800), length 1423: 192.168.43.126.44694 > 111.221.29.254.443: Flags [P.], seq 235704911:235706268, ack 3178224267, win 501, options [nop,nop,TS val 570695384 ecr 148424087], length 1357
02:02:09.187591 80:ad:16:cb:e4:d0 > 58:00:e3:7e:0b:53, ethertype IPv6 (0x86dd), length 196: 2a03:2880:f22f:c5:face:b00c:0:167.443 > 2409:4063:4015:31fe:c50f:5aca:b1f4:c6a7.45860: Flags [P.], seq 1884:1994, ack 1464, win 126, options [nop,nop,TS val 121943565 ecr 1342282986], length 110
02:02:09.187619 58:00:e3:7e:0b:53 > 80:ad:16:cb:e4:d0, ethertype IPv6 (0x86dd), length 86: 2409:4063:4015:31fe:c50f:5aca:b1f4:c6a7.45860 > 2a03:2880:f22f:c5:face:b00c:0:167.443: Flags [.], ack 1994, win 501, options [nop,nop,TS val 1342283519 ecr 121943565], length 0
02:02:09.187620 80:ad:16:cb:e4:d0 > 58:00:e3:7e:0b:53, ethertype IPv6 (0x86dd), length 149: 2a03:2880:f22f:c5:face:b00c:0:167.443 > 2409:4063:4015:31fe:c50f:5aca:b1f4:c6a7.45860: Flags [P.], seq 1994:2057, ack 1464, win 126, options [nop,nop,TS val 121943565 ecr 1342282986], length 63
02:02:09.187660 58:00:e3:7e:0b:53 > 80:ad:16:cb:e4:d0, ethertype IPv6 (0x86dd), length 86: 2409:4063:4015:31fe:c50f:5aca:b1f4:c6a7.45860 > 2a03:2880:f22f:c5:face:b00c:0:167.443: Flags [.], ack 2057, win 501, options [nop,nop,TS val 1342283519 ecr 121943565], length 0
02:02:09.187776 80:ad:16:cb:e4:d0 > 58:00:e3:7e:0b:53, ethertype IPv6 (0x86dd), length 654: 2a03:2880:f22f:c5:face:b00c:0:167.443 > 2409:4063:4015:31fe:c50f:5aca:b1f4:c6a7.45860: Flags [P.], seq 2057:2625, ack 1464, win 126, options [nop,nop,TS val 121943565 ecr 1342282986], length 568
02:02:09.187799 58:00:e3:7e:0b:53 > 80:ad:16:cb:e4:d0, ethertype IPv6 (0x86dd), length 86: 2409:4063:4015:31fe:c50f:5aca:b1f4:c6a7.45860 > 2a03:2880:f22f:c5:face:b00c:0:167.443: Flags [.], ack 2625, win 501, options [nop,nop,TS val 1342283519 ecr 121943565], length 0
02:02:09.200680 80:ad:16:cb:e4:d0 > 58:00:e3:7e:0b:53, ethertype IPv6 (0x86dd), length 822: 2a03:2880:f22f:c5:face:b00c:0:167.443 > 2409:4063:4015:31fe:c50f:5aca:b1f4:c6a7.45860: Flags [P.], seq 2625:3361, ack 1464, win 126, options [nop,nop,TS val 121943591 ecr 1342282986], length 736
02:02:09.200700 58:00:e3:7e:0b:53 > 80:ad:16:cb:e4:d0, ethertype IPv6 (0x86dd), length 86: 2409:4063:4015:31fe:c50f:5aca:b1f4:c6a7.45860 > 2a03:2880:f22f:c5:face:b00c:0:167.443: Flags [.], ack 3361, win 501, options [nop,nop,TS val 1342283532 ecr 121943591], length 0
02:02:09.228405 80:ad:16:cb:e4:d0 > 58:00:e3:7e:0b:53, ethertype IPv6 (0x86dd), length 1444: 2a03:2880:f22f:c5:face:b00c:0:167.443 > 2409:4063:4015:31fe:c50f:5aca:b1f4:c6a7.45860: Flags [.], seq 3361:4719, ack 1464, win 126, options [nop,nop,TS val 121943618 ecr 1342282986], length 1358
02:02:09.228425 58:00:e3:7e:0b:53 > 80:ad:16:cb:e4:d0, ethertype IPv6 (0x86dd), length 86: 2409:4063:4015:31fe:c50f:5aca:b1f4:c6a7.45860 > 2a03:2880:f22f:c5:face:b00c:0:167.443: Flags [.], ack 4719, win 501, options [nop,nop,TS val 1342283560 ecr 121943618], length 0
02:02:09.228783 58:00:e3:7e:0b:53 > 80:ad:16:cb:e4:d0, ethertype IPv4 (0x0800), length 583: 192.168.43.126.57562 > 13.35.130.69.443: Flags [P.], seq 1:518, ack 1, win 502, options [nop,nop,TS val 2886910711 ecr 1684076452], length 517
02:02:09.231573 80:ad:16:cb:e4:d0 > 58:00:e3:7e:0b:53, ethertype IPv6 (0x86dd), length 1444: 2a03:2880:f22f:c5:face:b00c:0:167.443 > 2409:4063:4015:31fe:c50f:5aca:b1f4:c6a7.45860: Flags [.], seq 4719:6077, ack 1464, win 126, options [nop,nop,TS val 121943618 ecr 1342282986], length 1358
02:02:09.231592 58:00:e3:7e:0b:53 > 80:ad:16:cb:e4:d0, ethertype IPv6 (0x86dd), length 86: 2409:4063:4015:31fe:c50f:5aca:b1f4:c6a7.45860 > 2a03:2880:f22f:c5:face:b00c:0:167.443: Flags [.], ack 6077, win 501, options [nop,nop,TS val 1342283563 ecr 121943618], length 0
02:02:09.232179 80:ad:16:cb:e4:d0 > 58:00:e3:7e:0b:53, ethertype IPv6 (0x86dd), length 1444: 2a03:2880:f22f:c5:face:b00c:0:167.443 > 2409:4063:4015:31fe:c50f:5aca:b1f4:c6a7.45860: Flags [.], seq 6077:7435, ack 1464, win 126, options [nop,nop,TS val 121943618 ecr 1342282986], length 1358
02:02:09.232192 58:00:e3:7e:0b:53 > 80:ad:16:cb:e4:d0, ethertype IPv6 (0x86dd), length 86: 2409:4063:4015:31fe:c50f:5aca:b1f4:c6a7.45860 > 2a03:2880:f22f:c5:face:b00c:0:167.443: Flags [.], ack 7435, win 501, options [nop,nop,TS val 1342283564 ecr 121943618], length 0
02:02:09.232798 80:ad:16:cb:e4:d0 > 58:00:e3:7e:0b:53, ethertype IPv6 (0x86dd), length 1444: 2a03:2880:f22f:c5:face:b00c:0:167.443 > 2409:4063:4015:31fe:c50f:5aca:b1f4:c6a7.45860: Flags [.], seq 7435:8793, ack 1464, win 126, options [nop,nop,TS val 121943618 ecr 1342282986], length 1358
02:02:09.232811 58:00:e3:7e:0b:53 > 80:ad:16:cb:e4:d0, ethertype IPv6 (0x86dd), length 86: 2409:4063:4015:31fe:c50f:5aca:b1f4:c6a7.45860 > 2a03:2880:f22f:c5:face:b00c:0:167.443: Flags [.], ack 8793, win 501, options [nop,nop,TS val 1342283564 ecr 121943618], length 0
02:02:09.233267 80:ad:16:cb:e4:d0 > 58:00:e3:7e:0b:53, ethertype IPv6 (0x86dd), length 1170: 2a03:2880:f22f:c5:face:b00c:0:167.443 > 2409:4063:4015:31fe:c50f:5aca:b1f4:c6a7.45860: Flags [P.], seq 8793:9877, ack 1464, win 126, options [nop,nop,TS val 121943618 ecr 1342282986], length 1084
02:02:09.233278 58:00:e3:7e:0b:53 > 80:ad:16:cb:e4:d0, ethertype IPv6 (0x86dd), length 86: 2409:4063:4015:31fe:c50f:5aca:b1f4:c6a7.45860 > 2a03:2880:f22f:c5:face:b00c:0:167.443: Flags [.], ack 9877, win 501, options [nop,nop,TS val 1342283565 ecr 121943618], length 0
02:02:09.318911 58:00:e3:7e:0b:53 > 80:ad:16:cb:e4:d0, ethertype IPv6 (0x86dd), length 188: 2409:4063:4015:31fe:c50f:5aca:b1f4:c6a7.45860 > 2a03:2880:f22f:c5:face:b00c:0:167.443: Flags [P.], seq 1464:1566, ack 9877, win 501, options [nop,nop,TS val 1342283601 ecr 121943618], length 102
02:02:09.318994 58:00:e3:7e:0b:53 > 80:ad:16:cb:e4:d0, ethertype IPv6 (0x86dd), length 510: 2409:4063:4015:31fe:c50f:5aca:b1f4:c6a7.45860 > 2a03:2880:f22f:c5:face:b00c:0:167.443: Flags [P.], seq 1566:1990, ack 9877, win 501, options [nop,nop,TS val 1342283651 ecr 121943618], length 424
02:02:09.385360 80:ad:16:cb:e4:d0 > 58:00:e3:7e:0b:53, ethertype IPv4 (0x0800), length 785: 111.221.29.254.443 > 192.168.43.126.44694: Flags [P.], seq 1:720, ack 1357, win 1023, options [nop,nop,TS val 148427609 ecr 570695384], length 719
02:02:09.385411 58:00:e3:7e:0b:53 > 80:ad:16:cb:e4:d0, ethertype IPv4 (0x0800), length 66: 192.168.43.126.44694 > 111.221.29.254.443: Flags [.], ack 720, win 501, options [nop,nop,TS val 570695582 ecr 148427609], length 0
02:02:09.411188 80:ad:16:cb:e4:d0 > 58:00:e3:7e:0b:53, ethertype IPv6 (0x86dd), length 86: 2a03:2880:f22f:c5:face:b00c:0:167.443 > 2409:4063:4015:31fe:c50f:5aca:b1f4:c6a7.45860: Flags [.], ack 1990, win 130, options [nop,nop,TS val 121943802 ecr 1342283601], length 0
02:02:09.485247 80:ad:16:cb:e4:d0 > 58:00:e3:7e:0b:53, ethertype IPv4 (0x0800), length 117: 13.35.130.69.443 > 192.168.43.126.57562: Flags [P.], seq 106:157, ack 518, win 118, options [nop,nop,TS val 1684076512 ecr 2886910711], length 51
02:02:09.485267 58:00:e3:7e:0b:53 > 80:ad:16:cb:e4:d0, ethertype IPv4 (0x0800), length 78: 192.168.43.126.57562 > 13.35.130.69.443: Flags [.], ack 1, win 502, options [nop,nop,TS val 2886910968 ecr 1684076452,nop,nop,sack 1 {106:157}], length 0
02:02:09.602878 58:00:e3:7e:0b:53 > 80:ad:16:cb:e4:d0, ethertype IPv6 (0x86dd), length 165: 2409:4063:4015:31fe:c50f:5aca:b1f4:c6a7.45860 > 2a03:2880:f22f:c5:face:b00c:0:167.443: Flags [P.], seq 1990:2069, ack 9877, win 501, options [nop,nop,TS val 1342283857 ecr 121943802], length 79
02:02:09.610279 80:ad:16:cb:e4:d0 > 58:00:e3:7e:0b:53, ethertype IPv4 (0x0800), length 171: 13.35.130.69.443 > 192.168.43.126.57562: Flags [P.], seq 1:106, ack 518, win 118, options [nop,nop,TS val 1684076524 ecr 2886910968], length 105
02:02:09.610301 58:00:e3:7e:0b:53 > 80:ad:16:cb:e4:d0, ethertype IPv4 (0x0800), length 66: 192.168.43.126.57562 > 13.35.130.69.443: Flags [.], ack 157, win 501, options [nop,nop,TS val 2886911093 ecr 1684076524], length 0
02:02:09.611071 58:00:e3:7e:0b:53 > 80:ad:16:cb:e4:d0, ethertype IPv4 (0x0800), length 117: 192.168.43.126.57562 > 13.35.130.69.443: Flags [P.], seq 518:569, ack 157, win 501, options [nop,nop,TS val 2886911094 ecr 1684076524], length 51
02:02:09.611243 58:00:e3:7e:0b:53 > 80:ad:16:cb:e4:d0, ethertype IPv4 (0x0800), length 159: 192.168.43.126.57562 > 13.35.130.69.443: Flags [P.], seq 569:662, ack 157, win 501, options [nop,nop,TS val 2886911094 ecr 1684076524], length 93
02:02:09.611391 58:00:e3:7e:0b:53 > 80:ad:16:cb:e4:d0, ethertype IPv4 (0x0800), length 325: 192.168.43.126.57562 > 13.35.130.69.443: Flags [P.], seq 662:921, ack 157, win 501, options [nop,nop,TS val 2886911094 ecr 1684076524], length 259
02:02:09.611425 58:00:e3:7e:0b:53 > 80:ad:16:cb:e4:d0, ethertype IPv4 (0x0800), length 837: 192.168.43.126.57562 > 13.35.130.69.443: Flags [P.], seq 921:1692, ack 157, win 501, options [nop,nop,TS val 2886911094 ecr 1684076524], length 771
02:02:09.617937 80:ad:16:cb:e4:d0 > 58:00:e3:7e:0b:53, ethertype IPv6 (0x86dd), length 118: 2a03:2880:f22f:c5:face:b00c:0:167.443 > 2409:4063:4015:31fe:c50f:5aca:b1f4:c6a7.45860: Flags [P.], seq 9877:9909, ack 1990, win 130, options [nop,nop,TS val 121943998 ecr 1342283601], length 32
02:02:09.621079 80:ad:16:cb:e4:d0 > 58:00:e3:7e:0b:53, ethertype IPv6 (0x86dd), length 118: 2a03:2880:f22f:c5:face:b00c:0:167.443 > 2409:4063:4015:31fe:c50f:5aca:b1f4:c6a7.45860: Flags [P.], seq 9909:9941, ack 1990, win 130, options [nop,nop,TS val 121943998 ecr 1342283601], length 32
02:02:09.621149 58:00:e3:7e:0b:53 > 80:ad:16:cb:e4:d0, ethertype IPv6 (0x86dd), length 86: 2409:4063:4015:31fe:c50f:5aca:b1f4:c6a7.45860 > 2a03:2880:f22f:c5:face:b00c:0:167.443: Flags [.], ack 9941, win 501, options [nop,nop,TS val 1342283953 ecr 121943998], length 0
02:02:09.626539 80:ad:16:cb:e4:d0 > 58:00:e3:7e:0b:53, ethertype IPv6 (0x86dd), length 118: 2a03:2880:f22f:c5:face:b00c:0:167.443 > 2409:4063:4015:31fe:c50f:5aca:b1f4:c6a7.45860: Flags [P.], seq 9941:9973, ack 1990, win 130, options [nop,nop,TS val 121943998 ecr 1342283601], length 32
02:02:09.629417 58:00:e3:7e:0b:53 > 80:ad:16:cb:e4:d0, ethertype IPv6 (0x86dd), length 165: 2409:4063:4015:31fe:c50f:5aca:b1f4:c6a7.45860 > 2a03:2880:f22f:c5:face:b00c:0:167.443: Flags [P.], seq 2069:2148, ack 9973, win 501, options [nop,nop,TS val 1342283961 ecr 121943998], length 79
02:02:09.634871 80:ad:16:cb:e4:d0 > 58:00:e3:7e:0b:53, ethertype IPv6 (0x86dd), length 118: 2a03:2880:f22f:c5:face:b00c:0:167.443 > 2409:4063:4015:31fe:c50f:5aca:b1f4:c6a7.45860: Flags [P.], seq 9973:10005, ack 1990, win 130, options [nop,nop,TS val 121943998 ecr 1342283601], length 32
02:02:09.638989 80:ad:16:cb:e4:d0 > 58:00:e3:7e:0b:53, ethertype IPv6 (0x86dd), length 118: 2a03:2880:f22f:c5:face:b00c:0:167.443 > 2409:4063:4015:31fe:c50f:5aca:b1f4:c6a7.45860: Flags [P.], seq 10005:10037, ack 1990, win 130, options [nop,nop,TS val 121943998 ecr 1342283601], length 32
02:02:09.639131 58:00:e3:7e:0b:53 > 80:ad:16:cb:e4:d0, ethertype IPv6 (0x86dd), length 86: 2409:4063:4015:31fe:c50f:5aca:b1f4:c6a7.45860 > 2a03:2880:f22f:c5:face:b00c:0:167.443: Flags [.], ack 10037, win 501, options [nop,nop,TS val 1342283971 ecr 121943998], length 0
02:02:09.742059 58:00:e3:7e:0b:53 > 80:ad:16:cb:e4:d0, ethertype IPv6 (0x86dd), length 165: 2409:4063:4015:31fe:c50f:5aca:b1f4:c6a7.45860 > 2a03:2880:f22f:c5:face:b00c:0:167.443: Flags [P.], seq 2148:2227, ack 10037, win 501, options [nop,nop,TS val 1342284074 ecr 121943998], length 79
02:02:09.890873 58:00:e3:7e:0b:53 > 80:ad:16:cb:e4:d0, ethertype IPv6 (0x86dd), length 166: 2409:4063:4015:31fe:c50f:5aca:b1f4:c6a7.45860 > 2a03:2880:f22f:c5:face:b00c:0:167.443: Flags [P.], seq 2227:2307, ack 10037, win 501, options [nop,nop,TS val 1342284163 ecr 121943998], length 80
02:02:09.992796 58:00:e3:7e:0b:53 > 80:ad:16:cb:e4:d0, ethertype IPv6 (0x86dd), length 166: 2409:4063:4015:31fe:c50f:5aca:b1f4:c6a7.45860 > 2a03:2880:f22f:c5:face:b00c:0:167.443: Flags [P.], seq 2227:2307, ack 10037, win 501, options [nop,nop,TS val 1342284324 ecr 121943998], length 80
02:02:09.996783 58:00:e3:7e:0b:53 > 80:ad:16:cb:e4:d0, ethertype IPv4 (0x0800), length 1240: 192.168.43.126.57562 > 13.35.130.69.443: Flags [P.], seq 518:1692, ack 157, win 501, options [nop,nop,TS val 2886911479 ecr 1684076524], length 1174
02:02:10.028788 58:00:e3:7e:0b:53 > 80:ad:16:cb:e4:d0, ethertype IPv4 (0x0800), length 112: 192.168.43.126.56972 > 35.186.220.184.443: Flags [P.], seq 568:614, ack 380, win 501, options [nop,nop,TS val 1071245081 ecr 1824352293], length 46
02:02:10.364023 80:ad:16:cb:e4:d0 > 58:00:e3:7e:0b:53, ethertype IPv4 (0x0800), length 66: 13.35.130.69.443 > 192.168.43.126.57562: Flags [.], ack 569, win 118, options [nop,nop,TS val 1684076534 ecr 2886911094], length 0
02:02:10.365380 80:ad:16:cb:e4:d0 > 58:00:e3:7e:0b:53, ethertype IPv4 (0x0800), length 66: 13.35.130.69.443 > 192.168.43.126.57562: Flags [.], ack 662, win 118, options [nop,nop,TS val 1684076534 ecr 2886911094], length 0
02:02:10.366802 80:ad:16:cb:e4:d0 > 58:00:e3:7e:0b:53, ethertype IPv4 (0x0800), length 66: 13.35.130.69.443 > 192.168.43.126.57562: Flags [.], ack 921, win 122, options [nop,nop,TS val 1684076534 ecr 2886911094], length 0
02:02:10.372937 80:ad:16:cb:e4:d0 > 58:00:e3:7e:0b:53, ethertype IPv4 (0x0800), length 144: 13.35.130.69.443 > 192.168.43.126.57562: Flags [P.], seq 157:235, ack 921, win 122, options [nop,nop,TS val 1684076534 ecr 2886911094], length 78
02:02:10.373246 58:00:e3:7e:0b:53 > 80:ad:16:cb:e4:d0, ethertype IPv4 (0x0800), length 104: 192.168.43.126.57562 > 13.35.130.69.443: Flags [P.], seq 1692:1730, ack 235, win 501, options [nop,nop,TS val 2886911856 ecr 1684076534], length 38
