18:45:18.966320 IP6 2405:204:a59d:38b6:410d:d45e:ae02:b1bd.54001 > 2404:6800:4002:808::2002.443: UDP, length 1104
18:45:19.075002 IP6 2404:6800:4002:808::2002.443 > 2405:204:a59d:38b6:410d:d45e:ae02:b1bd.54001: UDP, length 21
18:45:19.166859 IP6 2404:6800:4002:808::2002.443 > 2405:204:a59d:38b6:410d:d45e:ae02:b1bd.54001: UDP, length 110
18:45:19.166889 IP6 2404:6800:4002:808::2002.443 > 2405:204:a59d:38b6:410d:d45e:ae02:b1bd.54001: UDP, length 19
18:45:19.167316 IP6 2405:204:a59d:38b6:410d:d45e:ae02:b1bd.54001 > 2404:6800:4002:808::2002.443: UDP, length 28
18:45:20.972344 IP6 2405:204:a59d:38b6:410d:d45e:ae02:b1bd.54001 > 2404:6800:4002:808::2002.443: UDP, length 1036
18:45:21.124212 IP6 2404:6800:4002:808::2002.443 > 2405:204:a59d:38b6:410d:d45e:ae02:b1bd.54001: UDP, length 21
18:45:21.200376 IP6 2404:6800:4002:808::2002.443 > 2405:204:a59d:38b6:410d:d45e:ae02:b1bd.54001: UDP, length 110
18:45:21.200404 IP6 2404:6800:4002:808::2002.443 > 2405:204:a59d:38b6:410d:d45e:ae02:b1bd.54001: UDP, length 19
18:45:21.200742 IP6 2405:204:a59d:38b6:410d:d45e:ae02:b1bd.54001 > 2404:6800:4002:808::2002.443: UDP, length 28
18:45:23.714500 IP6 2405:204:a59d:38b6:410d:d45e:ae02:b1bd.53657 > 2404:6800:4002:80f::200e.443: UDP, length 23
18:45:23.883598 IP6 2404:6800:4002:80f::200e.443 > 2405:204:a59d:38b6:410d:d45e:ae02:b1bd.53657: UDP, length 20
18:45:33.167326 IP6 2405:204:a59d:38b6:410d:d45e:ae02:b1bd.54001 > 2404:6800:4002:808::2002.443: UDP, length 1291
18:45:33.385118 IP6 2404:6800:4002:808::2002.443 > 2405:204:a59d:38b6:410d:d45e:ae02:b1bd.54001: UDP, length 21
18:45:33.723751 IP6 2404:6800:4002:808::2002.443 > 2405:204:a59d:38b6:410d:d45e:ae02:b1bd.54001: UDP, length 1330
18:45:33.723980 IP6 2404:6800:4002:808::2002.443 > 2405:204:a59d:38b6:410d:d45e:ae02:b1bd.54001: UDP, length 1330
18:45:33.724056 IP6 2404:6800:4002:808::2002.443 > 2405:204:a59d:38b6:410d:d45e:ae02:b1bd.54001: UDP, length 1058
18:45:33.724061 IP6 2404:6800:4002:808::2002.443 > 2405:204:a59d:38b6:410d:d45e:ae02:b1bd.54001: UDP, length 199
18:45:33.724179 IP6 2405:204:a59d:38b6:410d:d45e:ae02:b1bd.54001 > 2404:6800:4002:808::2002.443: UDP, length 28
18:45:33.724299 IP6 2405:204:a59d:38b6:410d:d45e:ae02:b1bd.54001 > 2404:6800:4002:808::2002.443: UDP, length 28
18:45:33.815430 IP6 2405:204:a59d:38b6:410d:d45e:ae02:b1bd.46773 > 2404:6800:4002:808::2004.443: UDP, length 1330
18:45:33.816786 IP6 2405:204:a59d:38b6:410d:d45e:ae02:b1bd.46773 > 2404:6800:4002:808::2004.443: UDP, length 1330
18:45:33.816869 IP6 2405:204:a59d:38b6:410d:d45e:ae02:b1bd.46773 > 2404:6800:4002:808::2004.443: UDP, length 762
18:45:33.817474 IP6 2405:204:a59d:38b6:410d:d45e:ae02:b1bd.54001 > 2404:6800:4002:808::2002.443: UDP, length 1330
18:45:33.817537 IP6 2405:204:a59d:38b6:410d:d45e:ae02:b1bd.54001 > 2404:6800:4002:808::2002.443: UDP, length 264
18:45:33.835034 IP6 2405:204:a59d:38b6:410d:d45e:ae02:b1bd.52719 > 2404:6800:4002:809::2003.443: UDP, length 1330
18:45:33.901868 IP6 2404:6800:4002:808::2002.443 > 2405:204:a59d:38b6:410d:d45e:ae02:b1bd.54001: UDP, length 21
18:45:33.901877 IP6 2404:6800:4002:808::2004.443 > 2405:204:a59d:38b6:410d:d45e:ae02:b1bd.46773: UDP, length 36
18:45:33.923335 IP6 2404:6800:4002:809::2003.443 > 2405:204:a59d:38b6:410d:d45e:ae02:b1bd.52719: UDP, length 36
18:45:33.962813 IP6 2404:6800:4002:808::2004.443 > 2405:204:a59d:38b6:410d:d45e:ae02:b1bd.46773: UDP, length 1330
18:45:33.962838 IP6 2404:6800:4002:808::2004.443 > 2405:204:a59d:38b6:410d:d45e:ae02:b1bd.46773: UDP, length 31
18:45:33.962856 IP6 2404:6800:4002:808::2004.443 > 2405:204:a59d:38b6:410d:d45e:ae02:b1bd.46773: UDP, length 20
18:45:33.963804 IP6 2405:204:a59d:38b6:410d:d45e:ae02:b1bd.46773 > 2404:6800:4002:808::2004.443: UDP, length 41
18:45:33.963933 IP6 2405:204:a59d:38b6:410d:d45e:ae02:b1bd.46773 > 2404:6800:4002:808::2004.443: UDP, length 28
18:45:33.974605 IP6 2404:6800:4002:809::2003.443 > 2405:204:a59d:38b6:410d:d45e:ae02:b1bd.52719: UDP, length 1330
18:45:33.974627 IP6 2404:6800:4002:809::2003.443 > 2405:204:a59d:38b6:410d:d45e:ae02:b1bd.52719: UDP, length 31
18:45:33.976881 IP6 2405:204:a59d:38b6:410d:d45e:ae02:b1bd.52719 > 2404:6800:4002:809::2003.443: UDP, length 39
18:45:33.977074 IP6 2405:204:a59d:38b6:410d:d45e:ae02:b1bd.52719 > 2404:6800:4002:809::2003.443: UDP, length 28
18:45:33.977562 IP6 2405:204:a59d:38b6:410d:d45e:ae02:b1bd.52719 > 2404:6800:4002:809::2003.443: UDP, length 527
18:45:33.977788 IP6 2405:204:a59d:38b6:410d:d45e:ae02:b1bd.52719 > 2404:6800:4002:809::2003.443: UDP, length 664
18:45:34.023138 IP6 2404:6800:4002:808::2002.443 > 2405:204:a59d:38b6:410d:d45e:ae02:b1bd.54001: UDP, length 38
18:45:34.023207 IP6 2404:6800:4002:808::2002.443 > 2405:204:a59d:38b6:410d:d45e:ae02:b1bd.54001: UDP, length 17
18:45:34.023558 IP6 2405:204:a59d:38b6:410d:d45e:ae02:b1bd.54001 > 2404:6800:4002:808::2002.443: UDP, length 28
18:45:34.025162 IP6 2404:6800:4002:809::2003.443 > 2405:204:a59d:38b6:410d:d45e:ae02:b1bd.52719: UDP, length 20
18:45:34.043520 IP6 2404:6800:4002:808::2004.443 > 2405:204:a59d:38b6:410d:d45e:ae02:b1bd.46773: UDP, length 20
18:45:34.110929 IP6 2404:6800:4002:808::2004.443 > 2405:204:a59d:38b6:410d:d45e:ae02:b1bd.46773: UDP, length 16
18:45:34.111271 IP6 2405:204:a59d:38b6:410d:d45e:ae02:b1bd.46773 > 2404:6800:4002:808::2004.443: UDP, length 31
18:45:34.111495 IP6 2404:6800:4002:809::2003.443 > 2405:204:a59d:38b6:410d:d45e:ae02:b1bd.52719: UDP, length 891
18:45:34.111948 IP6 2405:204:a59d:38b6:410d:d45e:ae02:b1bd.52719 > 2404:6800:4002:809::2003.443: UDP, length 31
18:45:34.121583 IP6 2404:6800:4002:809::2003.443 > 2405:204:a59d:38b6:410d:d45e:ae02:b1bd.52719: UDP, length 16
18:45:34.121626 IP6 2404:6800:4002:809::2003.443 > 2405:204:a59d:38b6:410d:d45e:ae02:b1bd.52719: UDP, length 37
18:45:34.121637 IP6 2404:6800:4002:809::2003.443 > 2405:204:a59d:38b6:410d:d45e:ae02:b1bd.52719: UDP, length 16
18:45:34.121916 IP6 2405:204:a59d:38b6:410d:d45e:ae02:b1bd.52719 > 2404:6800:4002:809::2003.443: UDP, length 31
18:45:34.122214 IP6 2405:204:a59d:38b6:410d:d45e:ae02:b1bd.52719 > 2404:6800:4002:809::2003.443: UDP, length 31
18:45:34.122347 IP6 2405:204:a59d:38b6:410d:d45e:ae02:b1bd.52719 > 2404:6800:4002:809::2003.443: UDP, length 31
18:45:34.203970 IP6 2405:204:a59d:38b6:410d:d45e:ae02:b1bd.52719 > 2404:6800:4002:809::2003.443: UDP, length 664
18:45:34.220580 IP6 2404:6800:4002:808::2004.443 > 2405:204:a59d:38b6:410d:d45e:ae02:b1bd.46773: UDP, length 333
18:45:34.220992 IP6 2405:204:a59d:38b6:410d:d45e:ae02:b1bd.46773 > 2404:6800:4002:808::2004.443: UDP, length 31
18:45:34.299406 IP6 2404:6800:4002:809::2003.443 > 2405:204:a59d:38b6:410d:d45e:ae02:b1bd.52719: UDP, length 20
18:45:48.168527 IP6 2405:204:a59d:38b6:410d:d45e:ae02:b1bd.54001 > 2404:6800:4002:808::2002.443: UDP, length 23
18:45:48.254676 IP6 2404:6800:4002:808::2002.443 > 2405:204:a59d:38b6:410d:d45e:ae02:b1bd.54001: UDP, length 21
18:45:48.818253 IP6 2405:204:a59d:38b6:410d:d45e:ae02:b1bd.46773 > 2404:6800:4002:808::2004.443: UDP, length 23
18:45:48.922931 IP6 2404:6800:4002:808::2004.443 > 2405:204:a59d:38b6:410d:d45e:ae02:b1bd.46773: UDP, length 20
18:46:05.884501 IP 192.168.43.126.34154 > 239.255.255.250.1900: UDP, length 171
18:46:06.885387 IP 192.168.43.126.34154 > 239.255.255.250.1900: UDP, length 171
18:46:07.885956 IP 192.168.43.126.34154 > 239.255.255.250.1900: UDP, length 171
18:46:08.886954 IP 192.168.43.126.34154 > 239.255.255.250.1900: UDP, length 171
18:46:11.110737 IP6 2405:204:a59d:38b6:410d:d45e:ae02:b1bd.48869 > 2404:6800:4001:80e::2003.443: UDP, length 1330
18:46:11.261824 IP6 2404:6800:4001:80e::2003.443 > 2405:204:a59d:38b6:410d:d45e:ae02:b1bd.48869: UDP, length 1330
18:46:11.262064 IP6 2404:6800:4001:80e::2003.443 > 2405:204:a59d:38b6:410d:d45e:ae02:b1bd.48869: UDP, length 1330
18:46:11.262226 IP6 2404:6800:4001:80e::2003.443 > 2405:204:a59d:38b6:410d:d45e:ae02:b1bd.48869: UDP, length 1330
18:46:11.262259 IP6 2405:204:a59d:38b6:410d:d45e:ae02:b1bd.48869 > 2404:6800:4001:80e::2003.443: UDP, length 36
18:46:11.348483 IP6 2405:204:a59d:38b6:410d:d45e:ae02:b1bd.48869 > 2404:6800:4001:80e::2003.443: UDP, length 1330
18:46:11.348517 IP6 2405:204:a59d:38b6:410d:d45e:ae02:b1bd.48869 > 2404:6800:4001:80e::2003.443: UDP, length 310
18:46:11.457447 IP6 2404:6800:4001:80e::2003.443 > 2405:204:a59d:38b6:410d:d45e:ae02:b1bd.48869: UDP, length 1330
18:46:11.483257 IP6 2405:204:a59d:38b6:410d:d45e:ae02:b1bd.48869 > 2404:6800:4001:80e::2003.443: UDP, length 36
18:46:11.498727 IP6 2405:204:a59d:38b6:410d:d45e:ae02:b1bd.48869 > 2404:6800:4001:80e::2003.443: UDP, length 1330
18:46:11.530013 IP6 2404:6800:4001:80e::2003.443 > 2405:204:a59d:38b6:410d:d45e:ae02:b1bd.48869: UDP, length 1330
18:46:11.530087 IP6 2404:6800:4001:80e::2003.443 > 2405:204:a59d:38b6:410d:d45e:ae02:b1bd.48869: UDP, length 31
18:46:11.530889 IP6 2405:204:a59d:38b6:410d:d45e:ae02:b1bd.48869 > 2404:6800:4001:80e::2003.443: UDP, length 41
18:46:11.531048 IP6 2405:204:a59d:38b6:410d:d45e:ae02:b1bd.48869 > 2404:6800:4001:80e::2003.443: UDP, length 28
18:46:11.532381 IP6 2404:6800:4001:80e::2003.443 > 2405:204:a59d:38b6:410d:d45e:ae02:b1bd.48869: UDP, length 232
18:46:11.532911 IP6 2404:6800:4001:80e::2003.443 > 2405:204:a59d:38b6:410d:d45e:ae02:b1bd.48869: UDP, length 16
18:46:11.532967 IP6 2405:204:a59d:38b6:410d:d45e:ae02:b1bd.48869 > 2404:6800:4001:80e::2003.443: UDP, length 45
18:46:11.533637 IP6 2405:204:a59d:38b6:410d:d45e:ae02:b1bd.48869 > 2404:6800:4001:80e::2003.443: UDP, length 952
18:46:11.656588 IP6 2404:6800:4001:80e::2003.443 > 2405:204:a59d:38b6:410d:d45e:ae02:b1bd.48869: UDP, length 23
18:46:11.663620 IP6 2404:6800:4001:80e::2003.443 > 2405:204:a59d:38b6:410d:d45e:ae02:b1bd.48869: UDP, length 23
18:46:11.762161 IP6 2404:6800:4001:80e::2003.443 > 2405:204:a59d:38b6:410d:d45e:ae02:b1bd.48869: UDP, length 23
18:46:11.762188 IP6 2404:6800:4001:80e::2003.443 > 2405:204:a59d:38b6:410d:d45e:ae02:b1bd.48869: UDP, length 770
18:46:11.762192 IP6 2404:6800:4001:80e::2003.443 > 2405:204:a59d:38b6:410d:d45e:ae02:b1bd.48869: UDP, length 16
18:46:11.762717 IP6 2405:204:a59d:38b6:410d:d45e:ae02:b1bd.48869 > 2404:6800:4001:80e::2003.443: UDP, length 28
18:46:15.417148 IP 192.168.43.27.63551 > 239.255.255.250.1900: UDP, length 174
18:46:17.272428 IP 192.168.43.27.63551 > 239.255.255.250.1900: UDP, length 174
18:46:17.480692 IP 192.168.43.27.63551 > 239.255.255.250.1900: UDP, length 174
18:46:18.500531 IP 192.168.43.27.63551 > 239.255.255.250.1900: UDP, length 174
18:46:25.258933 IP6 2405:204:a59d:38b6:410d:d45e:ae02:b1bd.55295 > 2404:6800:4002:806::2002.443: UDP, length 1330
18:46:25.259766 IP6 2405:204:a59d:38b6:410d:d45e:ae02:b1bd.55295 > 2404:6800:4002:806::2002.443: UDP, length 1330
18:46:25.259851 IP6 2405:204:a59d:38b6:410d:d45e:ae02:b1bd.55295 > 2404:6800:4002:806::2002.443: UDP, length 108
18:46:25.372660 IP6 2404:6800:4002:806::2002.443 > 2405:204:a59d:38b6:410d:d45e:ae02:b1bd.55295: UDP, length 36
18:46:25.433309 IP6 2404:6800:4002:806::2002.443 > 2405:204:a59d:38b6:410d:d45e:ae02:b1bd.55295: UDP, length 1330
18:46:25.433401 IP6 2404:6800:4002:806::2002.443 > 2405:204:a59d:38b6:410d:d45e:ae02:b1bd.55295: UDP, length 1330
18:46:25.438039 IP6 2405:204:a59d:38b6:410d:d45e:ae02:b1bd.55295 > 2404:6800:4002:806::2002.443: UDP, length 36
18:46:25.446025 IP6 2405:204:a59d:38b6:410d:d45e:ae02:b1bd.55295 > 2404:6800:4002:806::2002.443: UDP, length 1330
18:46:25.446177 IP6 2405:204:a59d:38b6:410d:d45e:ae02:b1bd.55295 > 2404:6800:4002:806::2002.443: UDP, length 1330
18:46:25.446250 IP6 2405:204:a59d:38b6:410d:d45e:ae02:b1bd.55295 > 2404:6800:4002:806::2002.443: UDP, length 108
18:46:25.496960 IP6 2404:6800:4002:806::2002.443 > 2405:204:a59d:38b6:410d:d45e:ae02:b1bd.55295: UDP, length 39
18:46:25.554899 IP6 2404:6800:4002:806::2002.443 > 2405:204:a59d:38b6:410d:d45e:ae02:b1bd.55295: UDP, length 1330
18:46:25.554969 IP6 2404:6800:4002:806::2002.443 > 2405:204:a59d:38b6:410d:d45e:ae02:b1bd.55295: UDP, length 1330
18:46:25.555341 IP6 2405:204:a59d:38b6:410d:d45e:ae02:b1bd.55295 > 2404:6800:4002:806::2002.443: UDP, length 36
18:46:25.571358 IP6 2404:6800:4002:806::2002.443 > 2405:204:a59d:38b6:410d:d45e:ae02:b1bd.55295: UDP, length 1330
18:46:25.571625 IP6 2404:6800:4002:806::2002.443 > 2405:204:a59d:38b6:410d:d45e:ae02:b1bd.55295: UDP, length 31
18:46:25.572637 IP6 2405:204:a59d:38b6:410d:d45e:ae02:b1bd.55295 > 2404:6800:4002:806::2002.443: UDP, length 41
18:46:25.572808 IP6 2405:204:a59d:38b6:410d:d45e:ae02:b1bd.55295 > 2404:6800:4002:806::2002.443: UDP, length 28
18:46:25.630734 IP6 2404:6800:4002:806::2002.443 > 2405:204:a59d:38b6:410d:d45e:ae02:b1bd.55295: UDP, length 23
18:46:25.631120 IP6 2405:204:a59d:38b6:410d:d45e:ae02:b1bd.55295 > 2404:6800:4002:806::2002.443: UDP, length 1330
18:46:25.634612 IP6 2405:204:a59d:38b6:410d:d45e:ae02:b1bd.55295 > 2404:6800:4002:806::2002.443: UDP, length 92
18:46:25.707036 IP6 2404:6800:4002:806::2002.443 > 2405:204:a59d:38b6:410d:d45e:ae02:b1bd.55295: UDP, length 23
18:46:25.717698 IP6 2405:204:a59d:38b6:410d:d45e:ae02:b1bd.33819 > 2404:6800:4002:809::2003.443: UDP, length 1330
18:46:25.841318 IP6 2405:204:a59d:38b6:410d:d45e:ae02:b1bd.33819 > 2404:6800:4002:809::2003.443: UDP, length 1330
18:46:25.921783 IP6 2404:6800:4002:809::2003.443 > 2405:204:a59d:38b6:410d:d45e:ae02:b1bd.33819: UDP, length 36
18:46:25.921909 IP6 2404:6800:4002:809::2003.443 > 2405:204:a59d:38b6:410d:d45e:ae02:b1bd.33819: UDP, length 1330
18:46:25.921918 IP6 2404:6800:4002:809::2003.443 > 2405:204:a59d:38b6:410d:d45e:ae02:b1bd.33819: UDP, length 31
18:46:25.922999 IP6 2405:204:a59d:38b6:410d:d45e:ae02:b1bd.33819 > 2404:6800:4002:809::2003.443: UDP, length 39
18:46:25.923248 IP6 2405:204:a59d:38b6:410d:d45e:ae02:b1bd.33819 > 2404:6800:4002:809::2003.443: UDP, length 28
18:46:25.923742 IP6 2405:204:a59d:38b6:410d:d45e:ae02:b1bd.33819 > 2404:6800:4002:809::2003.443: UDP, length 524
18:46:26.013736 IP6 2404:6800:4002:809::2003.443 > 2405:204:a59d:38b6:410d:d45e:ae02:b1bd.33819: UDP, length 23
18:46:26.013780 IP6 2404:6800:4002:809::2003.443 > 2405:204:a59d:38b6:410d:d45e:ae02:b1bd.33819: UDP, length 23
18:46:26.089846 IP6 2404:6800:4002:809::2003.443 > 2405:204:a59d:38b6:410d:d45e:ae02:b1bd.33819: UDP, length 891
18:46:26.089876 IP6 2404:6800:4002:809::2003.443 > 2405:204:a59d:38b6:410d:d45e:ae02:b1bd.33819: UDP, length 16
18:46:26.090335 IP6 2405:204:a59d:38b6:410d:d45e:ae02:b1bd.33819 > 2404:6800:4002:809::2003.443: UDP, length 28
18:46:26.475756 IP6 2404:6800:4002:806::2002.443 > 2405:204:a59d:38b6:410d:d45e:ae02:b1bd.55295: UDP, length 1330
18:46:26.475855 IP6 2404:6800:4002:806::2002.443 > 2405:204:a59d:38b6:410d:d45e:ae02:b1bd.55295: UDP, length 1330
18:46:26.476100 IP6 2404:6800:4002:806::2002.443 > 2405:204:a59d:38b6:410d:d45e:ae02:b1bd.55295: UDP, length 1330
18:46:26.476170 IP6 2404:6800:4002:806::2002.443 > 2405:204:a59d:38b6:410d:d45e:ae02:b1bd.55295: UDP, length 1330
18:46:26.476363 IP6 2405:204:a59d:38b6:410d:d45e:ae02:b1bd.55295 > 2404:6800:4002:806::2002.443: UDP, length 28
18:46:26.476512 IP6 2405:204:a59d:38b6:410d:d45e:ae02:b1bd.55295 > 2404:6800:4002:806::2002.443: UDP, length 28
18:46:26.476845 IP6 2404:6800:4002:806::2002.443 > 2405:204:a59d:38b6:410d:d45e:ae02:b1bd.55295: UDP, length 1330
18:46:26.477434 IP6 2404:6800:4002:806::2002.443 > 2405:204:a59d:38b6:410d:d45e:ae02:b1bd.55295: UDP, length 1330
18:46:26.477451 IP6 2404:6800:4002:806::2002.443 > 2405:204:a59d:38b6:410d:d45e:ae02:b1bd.55295: UDP, length 517
18:46:26.479654 IP6 2404:6800:4002:806::2002.443 > 2405:204:a59d:38b6:410d:d45e:ae02:b1bd.55295: UDP, length 1330
18:46:26.479771 IP6 2405:204:a59d:38b6:410d:d45e:ae02:b1bd.55295 > 2404:6800:4002:806::2002.443: UDP, length 28
18:46:26.479779 IP6 2404:6800:4002:806::2002.443 > 2405:204:a59d:38b6:410d:d45e:ae02:b1bd.55295: UDP, length 1330
18:46:26.479900 IP6 2405:204:a59d:38b6:410d:d45e:ae02:b1bd.55295 > 2404:6800:4002:806::2002.443: UDP, length 28
18:46:26.479932 IP6 2404:6800:4002:806::2002.443 > 2405:204:a59d:38b6:410d:d45e:ae02:b1bd.55295: UDP, length 1330
18:46:26.480037 IP6 2405:204:a59d:38b6:410d:d45e:ae02:b1bd.55295 > 2404:6800:4002:806::2002.443: UDP, length 28
18:46:26.480101 IP6 2404:6800:4002:806::2002.443 > 2405:204:a59d:38b6:410d:d45e:ae02:b1bd.55295: UDP, length 1330
18:46:26.480259 IP6 2404:6800:4002:806::2002.443 > 2405:204:a59d:38b6:410d:d45e:ae02:b1bd.55295: UDP, length 1330
18:46:26.481075 IP6 2404:6800:4002:806::2002.443 > 2405:204:a59d:38b6:410d:d45e:ae02:b1bd.55295: UDP, length 1330
18:46:26.481093 IP6 2404:6800:4002:806::2002.443 > 2405:204:a59d:38b6:410d:d45e:ae02:b1bd.55295: UDP, length 338
18:46:26.481369 IP6 2405:204:a59d:38b6:410d:d45e:ae02:b1bd.55295 > 2404:6800:4002:806::2002.443: UDP, length 28
18:46:26.481479 IP6 2405:204:a59d:38b6:410d:d45e:ae02:b1bd.55295 > 2404:6800:4002:806::2002.443: UDP, length 28
18:46:26.533998 IP6 2405:204:a59d:38b6:410d:d45e:ae02:b1bd.48869 > 2404:6800:4001:80e::2003.443: UDP, length 23
18:46:26.575816 IP6 2405:204:a59d:38b6:410d:d45e:ae02:b1bd.41043 > 2404:6800:4002:80d::2003.443: UDP, length 1330
18:46:26.610194 IP6 2404:6800:4002:806::2002.443 > 2405:204:a59d:38b6:410d:d45e:ae02:b1bd.55295: UDP, length 1330
18:46:26.610217 IP6 2404:6800:4002:806::2002.443 > 2405:204:a59d:38b6:410d:d45e:ae02:b1bd.55295: UDP, length 1330
18:46:26.610245 IP6 2404:6800:4002:806::2002.443 > 2405:204:a59d:38b6:410d:d45e:ae02:b1bd.55295: UDP, length 1330
18:46:26.610464 IP6 2404:6800:4002:806::2002.443 > 2405:204:a59d:38b6:410d:d45e:ae02:b1bd.55295: UDP, length 1330
18:46:26.610522 IP6 2405:204:a59d:38b6:410d:d45e:ae02:b1bd.55295 > 2404:6800:4002:806::2002.443: UDP, length 28
18:46:26.610598 IP6 2405:204:a59d:38b6:410d:d45e:ae02:b1bd.55295 > 2404:6800:4002:806::2002.443: UDP, length 28
18:46:26.610653 IP6 2404:6800:4002:806::2002.443 > 2405:204:a59d:38b6:410d:d45e:ae02:b1bd.55295: UDP, length 1330
18:46:26.610768 IP6 2404:6800:4002:806::2002.443 > 2405:204:a59d:38b6:410d:d45e:ae02:b1bd.55295: UDP, length 1330
18:46:26.610777 IP6 2404:6800:4002:806::2002.443 > 2405:204:a59d:38b6:410d:d45e:ae02:b1bd.55295: UDP, length 338
18:46:26.610957 IP6 2404:6800:4002:806::2002.443 > 2405:204:a59d:38b6:410d:d45e:ae02:b1bd.55295: UDP, length 1330
18:46:26.611133 IP6 2404:6800:4002:806::2002.443 > 2405:204:a59d:38b6:410d:d45e:ae02:b1bd.55295: UDP, length 1330
18:46:26.611181 IP6 2405:204:a59d:38b6:410d:d45e:ae02:b1bd.55295 > 2404:6800:4002:806::2002.443: UDP, length 28
18:46:26.611250 IP6 2405:204:a59d:38b6:410d:d45e:ae02:b1bd.55295 > 2404:6800:4002:806::2002.443: UDP, length 28
18:46:26.611264 IP6 2404:6800:4002:806::2002.443 > 2405:204:a59d:38b6:410d:d45e:ae02:b1bd.55295: UDP, length 1330
18:46:26.611423 IP6 2404:6800:4002:806::2002.443 > 2405:204:a59d:38b6:410d:d45e:ae02:b1bd.55295: UDP, length 1330
18:46:26.611585 IP6 2404:6800:4002:806::2002.443 > 2405:204:a59d:38b6:410d:d45e:ae02:b1bd.55295: UDP, length 1330
18:46:26.611745 IP6 2404:6800:4002:806::2002.443 > 2405:204:a59d:38b6:410d:d45e:ae02:b1bd.55295: UDP, length 1330
18:46:26.611747 IP6 2405:204:a59d:38b6:410d:d45e:ae02:b1bd.55295 > 2404:6800:4002:806::2002.443: UDP, length 28
18:46:26.611833 IP6 2405:204:a59d:38b6:410d:d45e:ae02:b1bd.55295 > 2404:6800:4002:806::2002.443: UDP, length 28
18:46:26.611899 IP6 2404:6800:4002:806::2002.443 > 2405:204:a59d:38b6:410d:d45e:ae02:b1bd.55295: UDP, length 1330
18:46:26.611958 IP6 2405:204:a59d:38b6:410d:d45e:ae02:b1bd.55295 > 2404:6800:4002:806::2002.443: UDP, length 28
18:46:26.612047 IP6 2404:6800:4002:806::2002.443 > 2405:204:a59d:38b6:410d:d45e:ae02:b1bd.55295: UDP, length 1330
18:46:26.612224 IP6 2404:6800:4002:806::2002.443 > 2405:204:a59d:38b6:410d:d45e:ae02:b1bd.55295: UDP, length 1330
18:46:26.612231 IP6 2404:6800:4002:806::2002.443 > 2405:204:a59d:38b6:410d:d45e:ae02:b1bd.55295: UDP, length 126
18:46:26.612400 IP6 2404:6800:4002:806::2002.443 > 2405:204:a59d:38b6:410d:d45e:ae02:b1bd.55295: UDP, length 1330
18:46:26.612567 IP6 2404:6800:4002:806::2002.443 > 2405:204:a59d:38b6:410d:d45e:ae02:b1bd.55295: UDP, length 1330
18:46:26.612694 IP6 2405:204:a59d:38b6:410d:d45e:ae02:b1bd.55295 > 2404:6800:4002:806::2002.443: UDP, length 28
18:46:26.612794 IP6 2405:204:a59d:38b6:410d:d45e:ae02:b1bd.55295 > 2404:6800:4002:806::2002.443: UDP, length 28
18:46:26.633690 IP6 2405:204:a59d:38b6:410d:d45e:ae02:b1bd.56290 > 2404:6800:4002:808::2004.443: UDP, length 1330
18:46:26.635200 IP6 2405:204:a59d:38b6:410d:d45e:ae02:b1bd.56290 > 2404:6800:4002:808::2004.443: UDP, length 1330
18:46:26.635326 IP6 2405:204:a59d:38b6:410d:d45e:ae02:b1bd.56290 > 2404:6800:4002:808::2004.443: UDP, length 693
18:46:26.638136 IP6 2405:204:a59d:38b6:410d:d45e:ae02:b1bd.55295 > 2404:6800:4002:806::2002.443: UDP, length 28
18:46:26.679781 IP6 2405:204:a59d:38b6:410d:d45e:ae02:b1bd.55295 > 2404:6800:4002:806::2002.443: UDP, length 1330
18:46:26.679849 IP6 2405:204:a59d:38b6:410d:d45e:ae02:b1bd.55295 > 2404:6800:4002:806::2002.443: UDP, length 240
18:46:26.773744 IP6 2405:204:a59d:38b6:410d:d45e:ae02:b1bd.56290 > 2404:6800:4002:808::2004.443: UDP, length 1330
18:46:26.778080 IP6 2404:6800:4002:80d::2003.443 > 2405:204:a59d:38b6:410d:d45e:ae02:b1bd.41043: UDP, length 36
18:46:26.778212 IP6 2404:6800:4002:808::2004.443 > 2405:204:a59d:38b6:410d:d45e:ae02:b1bd.56290: UDP, length 36
18:46:26.778226 IP6 2404:6800:4002:806::2002.443 > 2405:204:a59d:38b6:410d:d45e:ae02:b1bd.55295: UDP, length 20
18:46:26.778235 IP6 2404:6800:4002:80d::2003.443 > 2405:204:a59d:38b6:410d:d45e:ae02:b1bd.41043: UDP, length 1330
18:46:26.778241 IP6 2404:6800:4002:80d::2003.443 > 2405:204:a59d:38b6:410d:d45e:ae02:b1bd.41043: UDP, length 31
18:46:26.778248 IP6 2404:6800:4002:808::2004.443 > 2405:204:a59d:38b6:410d:d45e:ae02:b1bd.56290: UDP, length 1330
18:46:26.778254 IP6 2404:6800:4002:808::2004.443 > 2405:204:a59d:38b6:410d:d45e:ae02:b1bd.56290: UDP, length 31
18:46:26.778260 IP6 2404:6800:4002:808::2004.443 > 2405:204:a59d:38b6:410d:d45e:ae02:b1bd.56290: UDP, length 20
18:46:26.778266 IP6 2404:6800:4001:80e::2003.443 > 2405:204:a59d:38b6:410d:d45e:ae02:b1bd.48869: UDP, length 20
18:46:26.779492 IP6 2405:204:a59d:38b6:410d:d45e:ae02:b1bd.41043 > 2404:6800:4002:80d::2003.443: UDP, length 39
18:46:26.779675 IP6 2405:204:a59d:38b6:410d:d45e:ae02:b1bd.41043 > 2404:6800:4002:80d::2003.443: UDP, length 28
18:46:26.780722 IP6 2405:204:a59d:38b6:410d:d45e:ae02:b1bd.56290 > 2404:6800:4002:808::2004.443: UDP, length 41
18:46:26.780837 IP6 2405:204:a59d:38b6:410d:d45e:ae02:b1bd.56290 > 2404:6800:4002:808::2004.443: UDP, length 28
18:46:26.839658 IP6 2404:6800:4002:806::2002.443 > 2405:204:a59d:38b6:410d:d45e:ae02:b1bd.55295: UDP, length 40
18:46:26.841620 IP6 2404:6800:4002:806::2002.443 > 2405:204:a59d:38b6:410d:d45e:ae02:b1bd.55295: UDP, length 17
18:46:26.842136 IP6 2405:204:a59d:38b6:410d:d45e:ae02:b1bd.55295 > 2404:6800:4002:806::2002.443: UDP, length 28
18:46:26.851385 IP6 2404:6800:4002:808::2004.443 > 2405:204:a59d:38b6:410d:d45e:ae02:b1bd.56290: UDP, length 23
18:46:26.915089 IP6 2404:6800:4002:80d::2003.443 > 2405:204:a59d:38b6:410d:d45e:ae02:b1bd.41043: UDP, length 20
18:46:26.915123 IP6 2404:6800:4002:808::2004.443 > 2405:204:a59d:38b6:410d:d45e:ae02:b1bd.56290: UDP, length 336
18:46:26.915130 IP6 2404:6800:4002:808::2004.443 > 2405:204:a59d:38b6:410d:d45e:ae02:b1bd.56290: UDP, length 16
18:46:26.915658 IP6 2405:204:a59d:38b6:410d:d45e:ae02:b1bd.56290 > 2404:6800:4002:808::2004.443: UDP, length 28
18:46:40.924478 IP6 2405:204:a59d:38b6:410d:d45e:ae02:b1bd.33819 > 2404:6800:4002:809::2003.443: UDP, length 23
18:46:41.205403 IP6 2404:6800:4002:809::2003.443 > 2405:204:a59d:38b6:410d:d45e:ae02:b1bd.33819: UDP, length 20
18:46:41.635826 IP6 2405:204:a59d:38b6:410d:d45e:ae02:b1bd.56290 > 2404:6800:4002:808::2004.443: UDP, length 23
18:46:41.680475 IP6 2405:204:a59d:38b6:410d:d45e:ae02:b1bd.55295 > 2404:6800:4002:806::2002.443: UDP, length 23
18:46:41.785290 IP6 2404:6800:4002:806::2002.443 > 2405:204:a59d:38b6:410d:d45e:ae02:b1bd.55295: UDP, length 21
18:46:41.941981 IP6 2405:204:a59d:38b6:410d:d45e:ae02:b1bd.56290 > 2404:6800:4002:808::2004.443: UDP, length 23
18:46:42.089381 IP6 2404:6800:4002:808::2004.443 > 2405:204:a59d:38b6:410d:d45e:ae02:b1bd.56290: UDP, length 20
18:48:05.892202 IP 192.168.43.126.45200 > 239.255.255.250.1900: UDP, length 171
18:48:06.893520 IP 192.168.43.126.45200 > 239.255.255.250.1900: UDP, length 171
18:48:07.893867 IP 192.168.43.126.45200 > 239.255.255.250.1900: UDP, length 171
18:48:08.894991 IP 192.168.43.126.45200 > 239.255.255.250.1900: UDP, length 171
18:48:15.597307 IP 192.168.43.27.52562 > 239.255.255.250.1900: UDP, length 174
18:48:16.402456 IP 192.168.43.27.52562 > 239.255.255.250.1900: UDP, length 174
18:48:17.380245 IP 192.168.43.27.52562 > 239.255.255.250.1900: UDP, length 174
18:48:18.393876 IP 192.168.43.27.52562 > 239.255.255.250.1900: UDP, length 174
18:49:09.080017 IP6 2405:204:a59d:38b6:410d:d45e:ae02:b1bd.47628 > 2404:6800:4002:80f::200e.443: UDP, length 1330
18:49:09.080217 IP6 2405:204:a59d:38b6:410d:d45e:ae02:b1bd.47628 > 2404:6800:4002:80f::200e.443: UDP, length 806
18:49:09.162662 IP6 2404:6800:4002:80f::200e.443 > 2405:204:a59d:38b6:410d:d45e:ae02:b1bd.47628: UDP, length 36
18:49:09.167913 IP6 2405:204:a59d:38b6:410d:d45e:ae02:b1bd.57614 > 2404:6800:4002:80d::2003.443: UDP, length 1330
18:49:09.168152 IP6 2405:204:a59d:38b6:410d:d45e:ae02:b1bd.57614 > 2404:6800:4002:80d::2003.443: UDP, length 348
18:49:09.231614 IP6 2404:6800:4002:80f::200e.443 > 2405:204:a59d:38b6:410d:d45e:ae02:b1bd.47628: UDP, length 1330
18:49:09.231641 IP6 2404:6800:4002:80f::200e.443 > 2405:204:a59d:38b6:410d:d45e:ae02:b1bd.47628: UDP, length 31
18:49:09.232418 IP6 2405:204:a59d:38b6:410d:d45e:ae02:b1bd.47628 > 2404:6800:4002:80f::200e.443: UDP, length 41
18:49:09.232538 IP6 2405:204:a59d:38b6:410d:d45e:ae02:b1bd.47628 > 2404:6800:4002:80f::200e.443: UDP, length 28
18:49:09.237702 IP6 2404:6800:4002:80f::200e.443 > 2405:204:a59d:38b6:410d:d45e:ae02:b1bd.47628: UDP, length 20
18:49:09.260671 IP6 2404:6800:4002:80d::2003.443 > 2405:204:a59d:38b6:410d:d45e:ae02:b1bd.57614: UDP, length 36
18:49:09.317270 IP6 2404:6800:4002:80d::2003.443 > 2405:204:a59d:38b6:410d:d45e:ae02:b1bd.57614: UDP, length 1330
18:49:09.317294 IP6 2404:6800:4002:80d::2003.443 > 2405:204:a59d:38b6:410d:d45e:ae02:b1bd.57614: UDP, length 31
18:49:09.317299 IP6 2404:6800:4002:80f::200e.443 > 2405:204:a59d:38b6:410d:d45e:ae02:b1bd.47628: UDP, length 20
18:49:09.317987 IP6 2405:204:a59d:38b6:410d:d45e:ae02:b1bd.57614 > 2404:6800:4002:80d::2003.443: UDP, length 41
18:49:09.318098 IP6 2405:204:a59d:38b6:410d:d45e:ae02:b1bd.57614 > 2404:6800:4002:80d::2003.443: UDP, length 28
18:49:09.340921 IP6 2404:6800:4002:80d::2003.443 > 2405:204:a59d:38b6:410d:d45e:ae02:b1bd.57614: UDP, length 20
18:49:09.391569 IP6 2404:6800:4002:80d::2003.443 > 2405:204:a59d:38b6:410d:d45e:ae02:b1bd.57614: UDP, length 20
18:49:09.402015 IP6 2404:6800:4002:80d::2003.443 > 2405:204:a59d:38b6:410d:d45e:ae02:b1bd.57614: UDP, length 293
18:49:09.402095 IP6 2404:6800:4002:80d::2003.443 > 2405:204:a59d:38b6:410d:d45e:ae02:b1bd.57614: UDP, length 18
18:49:09.402300 IP6 2405:204:a59d:38b6:410d:d45e:ae02:b1bd.57614 > 2404:6800:4002:80d::2003.443: UDP, length 28
18:49:09.473995 IP6 2405:204:a59d:38b6:410d:d45e:ae02:b1bd.51748 > 2404:6800:4002:809::2003.443: UDP, length 1330
18:49:09.563414 IP6 2404:6800:4002:809::2003.443 > 2405:204:a59d:38b6:410d:d45e:ae02:b1bd.51748: UDP, length 36
18:49:09.632506 IP6 2404:6800:4002:809::2003.443 > 2405:204:a59d:38b6:410d:d45e:ae02:b1bd.51748: UDP, length 1330
18:49:09.632527 IP6 2404:6800:4002:809::2003.443 > 2405:204:a59d:38b6:410d:d45e:ae02:b1bd.51748: UDP, length 31
18:49:09.633087 IP6 2405:204:a59d:38b6:410d:d45e:ae02:b1bd.51748 > 2404:6800:4002:809::2003.443: UDP, length 39
18:49:09.633214 IP6 2405:204:a59d:38b6:410d:d45e:ae02:b1bd.51748 > 2404:6800:4002:809::2003.443: UDP, length 28
18:49:09.633436 IP6 2405:204:a59d:38b6:410d:d45e:ae02:b1bd.51748 > 2404:6800:4002:809::2003.443: UDP, length 823
18:49:09.633593 IP6 2405:204:a59d:38b6:410d:d45e:ae02:b1bd.51748 > 2404:6800:4002:809::2003.443: UDP, length 666
18:49:09.712387 IP6 2404:6800:4002:809::2003.443 > 2405:204:a59d:38b6:410d:d45e:ae02:b1bd.51748: UDP, length 20
18:49:09.715023 IP6 2404:6800:4002:809::2003.443 > 2405:204:a59d:38b6:410d:d45e:ae02:b1bd.51748: UDP, length 20
18:49:09.793147 IP6 2404:6800:4002:809::2003.443 > 2405:204:a59d:38b6:410d:d45e:ae02:b1bd.51748: UDP, length 891
18:49:09.793174 IP6 2404:6800:4002:809::2003.443 > 2405:204:a59d:38b6:410d:d45e:ae02:b1bd.51748: UDP, length 16
18:49:09.793182 IP6 2404:6800:4002:809::2003.443 > 2405:204:a59d:38b6:410d:d45e:ae02:b1bd.51748: UDP, length 37
18:49:09.793188 IP6 2404:6800:4002:809::2003.443 > 2405:204:a59d:38b6:410d:d45e:ae02:b1bd.51748: UDP, length 16
18:49:09.793532 IP6 2405:204:a59d:38b6:410d:d45e:ae02:b1bd.51748 > 2404:6800:4002:809::2003.443: UDP, length 28
18:49:09.793714 IP6 2405:204:a59d:38b6:410d:d45e:ae02:b1bd.51748 > 2404:6800:4002:809::2003.443: UDP, length 28
18:49:10.696673 IP6 2404:6800:4002:80f::200e.443 > 2405:204:a59d:38b6:410d:d45e:ae02:b1bd.47628: UDP, length 549
18:49:10.698119 IP6 2404:6800:4002:80f::200e.443 > 2405:204:a59d:38b6:410d:d45e:ae02:b1bd.47628: UDP, length 748
18:49:10.698560 IP6 2405:204:a59d:38b6:410d:d45e:ae02:b1bd.47628 > 2404:6800:4002:80f::200e.443: UDP, length 28
18:49:10.704241 IP6 2404:6800:4002:80f::200e.443 > 2405:204:a59d:38b6:410d:d45e:ae02:b1bd.47628: UDP, length 28
18:49:10.704269 IP6 2404:6800:4002:80f::200e.443 > 2405:204:a59d:38b6:410d:d45e:ae02:b1bd.47628: UDP, length 28
18:49:10.704479 IP6 2405:204:a59d:38b6:410d:d45e:ae02:b1bd.47628 > 2404:6800:4002:80f::200e.443: UDP, length 28
18:49:24.169072 IP6 2405:204:a59d:38b6:410d:d45e:ae02:b1bd.57614 > 2404:6800:4002:80d::2003.443: UDP, length 23
18:49:24.394593 IP6 2404:6800:4002:80d::2003.443 > 2405:204:a59d:38b6:410d:d45e:ae02:b1bd.57614: UDP, length 20
18:49:24.633941 IP6 2405:204:a59d:38b6:410d:d45e:ae02:b1bd.51748 > 2404:6800:4002:809::2003.443: UDP, length 23
18:49:24.718432 IP6 2404:6800:4002:809::2003.443 > 2405:204:a59d:38b6:410d:d45e:ae02:b1bd.51748: UDP, length 20
18:49:25.275495 IP6 fe80::3d03:adb9:4bb2:337a.50679 > ff02::c.3702: UDP, length 774
18:49:25.282817 IP 192.168.43.27.50678 > 239.255.255.250.3702: UDP, length 774
18:49:25.444594 IP6 fe80::3d03:adb9:4bb2:337a.50679 > ff02::c.3702: UDP, length 774
18:49:25.516072 IP 192.168.43.27.50678 > 239.255.255.250.3702: UDP, length 774
18:49:25.697739 IP6 2405:204:a59d:38b6:410d:d45e:ae02:b1bd.47628 > 2404:6800:4002:80f::200e.443: UDP, length 23
18:49:25.829900 IP6 2404:6800:4002:80f::200e.443 > 2405:204:a59d:38b6:410d:d45e:ae02:b1bd.47628: UDP, length 20
18:49:25.837236 IP6 fe80::3d03:adb9:4bb2:337a.50679 > ff02::c.3702: UDP, length 774
18:49:25.997170 IP 192.168.43.27.50678 > 239.255.255.250.3702: UDP, length 774
18:49:26.408109 IP 192.168.43.27.50678 > 239.255.255.250.3702: UDP, length 774
18:50:05.886446 IP 192.168.43.126.45429 > 239.255.255.250.1900: UDP, length 171
18:50:06.887136 IP 192.168.43.126.45429 > 239.255.255.250.1900: UDP, length 171
18:50:07.887998 IP 192.168.43.126.45429 > 239.255.255.250.1900: UDP, length 171
18:50:08.888575 IP 192.168.43.126.45429 > 239.255.255.250.1900: UDP, length 171
18:50:50.127714 IP6 2405:204:a59d:38b6:410d:d45e:ae02:b1bd.39437 > 2404:6800:4002:80f::200e.443: UDP, length 1330
18:50:50.127922 IP6 2405:204:a59d:38b6:410d:d45e:ae02:b1bd.39437 > 2404:6800:4002:80f::200e.443: UDP, length 856
18:50:50.233008 IP6 2404:6800:4002:80f::200e.443 > 2405:204:a59d:38b6:410d:d45e:ae02:b1bd.39437: UDP, length 36
18:50:50.253165 IP6 2404:6800:4002:80f::200e.443 > 2405:204:a59d:38b6:410d:d45e:ae02:b1bd.39437: UDP, length 1330
18:50:50.253743 IP6 2404:6800:4002:80f::200e.443 > 2405:204:a59d:38b6:410d:d45e:ae02:b1bd.39437: UDP, length 31
18:50:50.254545 IP6 2405:204:a59d:38b6:410d:d45e:ae02:b1bd.39437 > 2404:6800:4002:80f::200e.443: UDP, length 41
18:50:50.254802 IP6 2405:204:a59d:38b6:410d:d45e:ae02:b1bd.39437 > 2404:6800:4002:80f::200e.443: UDP, length 28
18:50:50.294679 IP6 2404:6800:4002:80f::200e.443 > 2405:204:a59d:38b6:410d:d45e:ae02:b1bd.39437: UDP, length 20
18:50:50.354731 IP6 2404:6800:4002:80f::200e.443 > 2405:204:a59d:38b6:410d:d45e:ae02:b1bd.39437: UDP, length 20
18:50:50.813625 IP6 2404:6800:4002:80f::200e.443 > 2405:204:a59d:38b6:410d:d45e:ae02:b1bd.39437: UDP, length 484
18:50:50.813675 IP6 2404:6800:4002:80f::200e.443 > 2405:204:a59d:38b6:410d:d45e:ae02:b1bd.39437: UDP, length 16
18:50:50.813686 IP6 2404:6800:4002:80f::200e.443 > 2405:204:a59d:38b6:410d:d45e:ae02:b1bd.39437: UDP, length 484
18:50:50.813692 IP6 2404:6800:4002:80f::200e.443 > 2405:204:a59d:38b6:410d:d45e:ae02:b1bd.39437: UDP, length 16
18:50:50.814335 IP6 2405:204:a59d:38b6:410d:d45e:ae02:b1bd.39437 > 2404:6800:4002:80f::200e.443: UDP, length 28
18:50:50.814605 IP6 2405:204:a59d:38b6:410d:d45e:ae02:b1bd.39437 > 2404:6800:4002:80f::200e.443: UDP, length 28
18:50:52.705268 IP6 2405:204:a59d:38b6:410d:d45e:ae02:b1bd.36870 > 2404:6800:4002:808::2004.443: UDP, length 1330
18:50:52.715205 IP6 2405:204:a59d:38b6:410d:d45e:ae02:b1bd.51217 > 2404:6800:4002:808::2004.443: UDP, length 1330
18:50:52.715559 IP6 2405:204:a59d:38b6:410d:d45e:ae02:b1bd.51217 > 2404:6800:4002:808::2004.443: UDP, length 818
18:50:52.796601 IP6 2404:6800:4002:808::2004.443 > 2405:204:a59d:38b6:410d:d45e:ae02:b1bd.36870: UDP, length 36
18:50:52.796812 IP6 2404:6800:4002:808::2004.443 > 2405:204:a59d:38b6:410d:d45e:ae02:b1bd.51217: UDP, length 36
18:50:52.854434 IP6 2405:204:a59d:38b6:410d:d45e:ae02:b1bd.51217 > 2404:6800:4002:808::2004.443: UDP, length 161
18:50:52.854704 IP6 2405:204:a59d:38b6:410d:d45e:ae02:b1bd.51217 > 2404:6800:4002:808::2004.443: UDP, length 86
18:50:52.888584 IP6 2404:6800:4002:808::2004.443 > 2405:204:a59d:38b6:410d:d45e:ae02:b1bd.51217: UDP, length 1330
18:50:52.888597 IP6 2404:6800:4002:808::2004.443 > 2405:204:a59d:38b6:410d:d45e:ae02:b1bd.51217: UDP, length 31
18:50:52.888762 IP6 2404:6800:4002:808::2004.443 > 2405:204:a59d:38b6:410d:d45e:ae02:b1bd.36870: UDP, length 1330
18:50:52.888915 IP6 2404:6800:4002:808::2004.443 > 2405:204:a59d:38b6:410d:d45e:ae02:b1bd.36870: UDP, length 1330
18:50:52.888920 IP6 2404:6800:4002:808::2004.443 > 2405:204:a59d:38b6:410d:d45e:ae02:b1bd.51217: UDP, length 20
18:50:52.889105 IP6 2405:204:a59d:38b6:410d:d45e:ae02:b1bd.51217 > 2404:6800:4002:808::2004.443: UDP, length 41
18:50:52.889194 IP6 2405:204:a59d:38b6:410d:d45e:ae02:b1bd.51217 > 2404:6800:4002:808::2004.443: UDP, length 28
18:50:52.891690 IP6 2405:204:a59d:38b6:410d:d45e:ae02:b1bd.36870 > 2404:6800:4002:808::2004.443: UDP, length 1330
18:50:52.891982 IP6 2405:204:a59d:38b6:410d:d45e:ae02:b1bd.36870 > 2404:6800:4002:808::2004.443: UDP, length 453
18:50:52.949160 IP6 2404:6800:4002:808::2004.443 > 2405:204:a59d:38b6:410d:d45e:ae02:b1bd.51217: UDP, length 20
18:50:52.949173 IP6 2404:6800:4002:808::2004.443 > 2405:204:a59d:38b6:410d:d45e:ae02:b1bd.51217: UDP, length 437
18:50:52.949176 IP6 2404:6800:4002:808::2004.443 > 2405:204:a59d:38b6:410d:d45e:ae02:b1bd.51217: UDP, length 49
18:50:52.949402 IP6 2405:204:a59d:38b6:410d:d45e:ae02:b1bd.51217 > 2404:6800:4002:808::2004.443: UDP, length 28
18:50:53.044471 IP6 2405:204:a59d:38b6:410d:d45e:ae02:b1bd.36870 > 2404:6800:4002:808::2004.443: UDP, length 1330
18:50:53.056598 IP6 2404:6800:4002:808::2004.443 > 2405:204:a59d:38b6:410d:d45e:ae02:b1bd.36870: UDP, length 36
18:50:53.056614 IP6 2404:6800:4002:808::2004.443 > 2405:204:a59d:38b6:410d:d45e:ae02:b1bd.51217: UDP, length 257
18:50:53.056623 IP6 2404:6800:4002:808::2004.443 > 2405:204:a59d:38b6:410d:d45e:ae02:b1bd.51217: UDP, length 38
18:50:53.056782 IP6 2404:6800:4002:808::2004.443 > 2405:204:a59d:38b6:410d:d45e:ae02:b1bd.36870: UDP, length 1330
18:50:53.056788 IP6 2404:6800:4002:808::2004.443 > 2405:204:a59d:38b6:410d:d45e:ae02:b1bd.36870: UDP, length 31
18:50:53.056790 IP6 2404:6800:4002:808::2004.443 > 2405:204:a59d:38b6:410d:d45e:ae02:b1bd.36870: UDP, length 20
18:50:53.056902 IP6 2405:204:a59d:38b6:410d:d45e:ae02:b1bd.51217 > 2404:6800:4002:808::2004.443: UDP, length 28
18:50:53.058205 IP6 2405:204:a59d:38b6:410d:d45e:ae02:b1bd.36870 > 2404:6800:4002:808::2004.443: UDP, length 41
18:50:53.058272 IP6 2405:204:a59d:38b6:410d:d45e:ae02:b1bd.36870 > 2404:6800:4002:808::2004.443: UDP, length 28
18:50:53.064315 IP6 2404:6800:4002:808::2004.443 > 2405:204:a59d:38b6:410d:d45e:ae02:b1bd.51217: UDP, length 1330
18:50:53.065807 IP6 2404:6800:4002:808::2004.443 > 2405:204:a59d:38b6:410d:d45e:ae02:b1bd.51217: UDP, length 1330
18:50:53.066074 IP6 2405:204:a59d:38b6:410d:d45e:ae02:b1bd.51217 > 2404:6800:4002:808::2004.443: UDP, length 28
18:50:53.069256 IP6 2404:6800:4002:808::2004.443 > 2405:204:a59d:38b6:410d:d45e:ae02:b1bd.51217: UDP, length 1330
18:50:53.069369 IP6 2404:6800:4002:808::2004.443 > 2405:204:a59d:38b6:410d:d45e:ae02:b1bd.51217: UDP, length 1330
18:50:53.069589 IP6 2405:204:a59d:38b6:410d:d45e:ae02:b1bd.51217 > 2404:6800:4002:808::2004.443: UDP, length 28
18:50:53.071995 IP6 2404:6800:4002:808::2004.443 > 2405:204:a59d:38b6:410d:d45e:ae02:b1bd.51217: UDP, length 632
18:50:53.072013 IP6 2404:6800:4002:808::2004.443 > 2405:204:a59d:38b6:410d:d45e:ae02:b1bd.51217: UDP, length 102
18:50:53.072183 IP6 2405:204:a59d:38b6:410d:d45e:ae02:b1bd.51217 > 2404:6800:4002:808::2004.443: UDP, length 28
18:50:53.075707 IP6 2404:6800:4002:808::2004.443 > 2405:204:a59d:38b6:410d:d45e:ae02:b1bd.51217: UDP, length 1330
18:50:53.101653 IP6 2405:204:a59d:38b6:410d:d45e:ae02:b1bd.51217 > 2404:6800:4002:808::2004.443: UDP, length 28
18:50:53.226180 IP6 2404:6800:4002:808::2004.443 > 2405:204:a59d:38b6:410d:d45e:ae02:b1bd.51217: UDP, length 1330
18:50:53.226222 IP6 2404:6800:4002:808::2004.443 > 2405:204:a59d:38b6:410d:d45e:ae02:b1bd.51217: UDP, length 1330
18:50:53.226229 IP6 2404:6800:4002:808::2004.443 > 2405:204:a59d:38b6:410d:d45e:ae02:b1bd.51217: UDP, length 1330
18:50:53.226436 IP6 2404:6800:4002:808::2004.443 > 2405:204:a59d:38b6:410d:d45e:ae02:b1bd.51217: UDP, length 1330
18:50:53.226572 IP6 2404:6800:4002:808::2004.443 > 2405:204:a59d:38b6:410d:d45e:ae02:b1bd.51217: UDP, length 1330
18:50:53.226726 IP6 2405:204:a59d:38b6:410d:d45e:ae02:b1bd.51217 > 2404:6800:4002:808::2004.443: UDP, length 28
18:50:53.226839 IP6 2404:6800:4002:808::2004.443 > 2405:204:a59d:38b6:410d:d45e:ae02:b1bd.51217: UDP, length 1330
18:50:53.226890 IP6 2404:6800:4002:808::2004.443 > 2405:204:a59d:38b6:410d:d45e:ae02:b1bd.51217: UDP, length 1330
18:50:53.226929 IP6 2405:204:a59d:38b6:410d:d45e:ae02:b1bd.51217 > 2404:6800:4002:808::2004.443: UDP, length 28
18:50:53.227043 IP6 2405:204:a59d:38b6:410d:d45e:ae02:b1bd.51217 > 2404:6800:4002:808::2004.443: UDP, length 28
18:50:53.227066 IP6 2404:6800:4002:808::2004.443 > 2405:204:a59d:38b6:410d:d45e:ae02:b1bd.51217: UDP, length 1330
18:50:53.227148 IP6 2405:204:a59d:38b6:410d:d45e:ae02:b1bd.51217 > 2404:6800:4002:808::2004.443: UDP, length 28
18:50:53.227307 IP6 2404:6800:4002:808::2004.443 > 2405:204:a59d:38b6:410d:d45e:ae02:b1bd.51217: UDP, length 1330
18:50:53.227460 IP6 2404:6800:4002:808::2004.443 > 2405:204:a59d:38b6:410d:d45e:ae02:b1bd.51217: UDP, length 1330
18:50:53.227625 IP6 2404:6800:4002:808::2004.443 > 2405:204:a59d:38b6:410d:d45e:ae02:b1bd.51217: UDP, length 1330
18:50:53.227796 IP6 2404:6800:4002:808::2004.443 > 2405:204:a59d:38b6:410d:d45e:ae02:b1bd.51217: UDP, length 1330
18:50:53.227961 IP6 2404:6800:4002:808::2004.443 > 2405:204:a59d:38b6:410d:d45e:ae02:b1bd.51217: UDP, length 1330
18:50:53.228134 IP6 2404:6800:4002:808::2004.443 > 2405:204:a59d:38b6:410d:d45e:ae02:b1bd.51217: UDP, length 1330
18:50:53.228408 IP6 2404:6800:4002:808::2004.443 > 2405:204:a59d:38b6:410d:d45e:ae02:b1bd.51217: UDP, length 1330
18:50:53.228508 IP6 2404:6800:4002:808::2004.443 > 2405:204:a59d:38b6:410d:d45e:ae02:b1bd.51217: UDP, length 1330
18:50:53.228686 IP6 2404:6800:4002:808::2004.443 > 2405:204:a59d:38b6:410d:d45e:ae02:b1bd.51217: UDP, length 1330
18:50:53.228697 IP6 2404:6800:4002:808::2004.443 > 2405:204:a59d:38b6:410d:d45e:ae02:b1bd.36870: UDP, length 23
